name,title,company,quote,skill_category,source_url,date_accessed
Jeffrey Larson,Operations Director,Various,"My approach to problem solving is data driven. I have a keen ability to filter out the noise and identify the key metrics that define performance levels then employ Lean principles to develop an action plan.",Analytical Thinking,https://www.linkedin.com/in/larson-jeff/,2025-01-18
W. Edwards Deming,Quality Management Expert,Author,"If you can't describe what you are doing as a process you don't know what you're doing. Everything can be improved.",Process Thinking,https://www.teamguru.com/blog/25-inspirational-business-process-improvement-quotes/1632,2025-01-18
Bruce Hamilton,Lean Manufacturing Expert,GBMP,"Continuous improvement is not about the things you do well — that's work. Continuous improvement is about removing the things that get in the way of your work. The headaches the things that slow you down that's what continuous improvement is all about.",Problem Solving,https://blog.kainexus.com/continuous-improvement/continuous-improvement-leadership/23-inspiration-business-process-improvement-quotes,2025-01-18
Taiichi Ohno,Toyota Production System Creator,Toyota,"All we are doing is looking at the timeline from the moment a customer gives us an order to the point we collect the cash. And we are reducing that timeline in the value stream by removing non value-added wastes.",Systems Thinking,https://reverscore.com/85-quotes-operational-excellence-and-continuous-improvement/,2025-01-18
Peter Drucker,Management Consultant,Author,"What gets measured gets managed.",Data Analysis,https://reverscore.com/85-quotes-operational-excellence-and-continuous-improvement/,2025-01-18
Larry Mohl,Founder and Chief Transformation Officer,Rali,"While AI gets all the buzz the real difference maker for workforce agility is about personal and interpersonal skills including leadership teamwork emotional intelligence conflict excellence and critical thinking as essential skills.",Emotional Intelligence,https://hrexecutive.com/5-essential-skills-for-thriving-in-the-ai-driven-workplace-of-2025/,2025-01-18
Ben Eubanks,CEO,Lighthouse Research & Advisory,"Employers desperately want workers who aren't just technically qualified but have communication and social skills.",Communication,https://www.worklife.news/technology/linkedin-report-your-employees-need-better-ai-skills-to-get-your-company-ahead/,2025-01-18
Stephanie Conway,Senior Director Talent Development,LinkedIn,"As the pace of skills change our job as talent leaders is to help our employees build the skills they'll need to thrive in the next era of work — and today there's a big opportunity for every workforce to grow in two areas: AI literacy and human skills.",Continuous Learning,https://www.worklife.news/technology/linkedin-report-your-employees-need-better-ai-skills-to-get-your-company-ahead/,2025-01-18
James Humes,Author,Speechwriter,"The art of communication is the language of leadership.",Communication,https://www.peoplebox.ai/blog/hr-quotes/,2025-01-18
Joan Garry,Nonprofit Expert,Consultant,"The nonprofit sector should get way more credit for being a bedrock of our society — for being the compass leading us all in the direction of a truly civil society. Nonprofits attract the best in society because they see beyond the economic gain.",Mission-Driven Leadership,https://www.nonprofitfixer.com/nonprofit-fixer-blog//nonprofit-leadership-and-fundraising-quotes,2025-01-18
Millard Fuller,Founder,Habitat for Humanity,"For a community to be whole and healthy it must be based on people's love and concern for each other.",Human Connection,https://volunteerhub.com/blog/nonprofit-leadership-quotes,2025-01-18
John Maxwell,Leadership Expert,Author,"Leaders become great not because of their power but because of their ability to empower others.",Leadership Development,https://nlctb.org/tips/15-inspiring-quotes-for-nonprofit-leaders/,2025-01-18
Rajeev Rajan,CTO,Atlassian,"My leadership team and I made a bet: that joy unlocks productivity.",Team Leadership,https://digitaldefynd.com/IQ/inspirational-chief-technology-officer-cto-quotes/,2025-01-18
Oskar Stål,CTO,Spotify,"The CTO not only is or was a great coder more than anything she's a great leader. I started out writing software at the age of 12 and then gradually moved into working on larger and larger projects becoming more of a leader than an individual contributor.",Technical Leadership,https://digitaldefynd.com/IQ/inspirational-chief-technology-officer-cto-quotes/,2025-01-18
Nishant Batra,Chief Strategy & Technology Officer,Nokia,"AI will be a massive influence on how this world evolves… every industry every enterprise every consumer is touched by AI in some format or other.",AI Fluency,https://en.tigosolutions.com/inspirational-chief-technology-officer-cto-quotes-8912,2025-01-18
Alexander Statnikov,Co-founder and CEO,Crosswise Risk Management,"In 2025 there is pretty much no compliance without AI because compliance became exponentially harder.",AI Fluency,https://www.pymnts.com/news/risk-management/2025/financial-leaders-how-ai-transforms-compliance-and-risk-management,2025-01-18
Terah Lyons,Executive,JPMorgan Chase,"We've seen a lot of success from running smaller scale more internal-facing experiments and scaling those up. If you can provide proof points for value delivery and performance it makes a huge difference in getting everybody on board.",Strategic Implementation,https://thefinancialbrand.com/news/artificial-intelligence-banking/how-banking-leaders-can-enhance-risk-and-compliance-with-ai-183094,2025-01-18
Rajat Taneja,President of Technology,Visa,"Trust is the very foundation of commerce. The first use case for AI in financial services was actually in risk management and it remains a critical tool to combat fraud scams.",Risk Assessment,https://www.pymnts.com/artificial-intelligence-2/2025/a-matter-of-trust-how-ai-is-reshaping-risk-assessment/,2025-01-18
Jason Luck,Senior Fellow AI and Autonomy,Lockheed Martin,"When creating AI you need to generate and test on vast amounts of data in high-fidelity simulations. Unfortunately higher fidelity goes hand in hand with higher processing demands and longer run times.",Technical Expertise,https://www.lockheedmartin.com/en-us/news/features/2024/lockheed-martin-leverages-ai-and-machine-learning-to-revolutionize-defense-and-space-technology.html,2025-01-18
Dr Travis Bradberry,Author,Emotional Intelligence 2.0,"Emotional intelligence is the strongest predictor of performance explaining a full 58% of success in all types of jobs.",Emotional Intelligence,https://www.lcca.org.uk/blog/hospitality/the-power-of-emotional-intelligence-in-hospitality-management/,2025-01-18
Mary Barra,CEO,General Motors,"Connectivity offers a great opportunity for General Motors. When you look at the investment we have made in OnStar and putting 4GLT in and the access you have to not only put data in and we haven't really tapped into the data you can use from the vehicle.",Data Analysis,https://www.azquotes.com/quotes/topics/auto-industry.html,2025-01-18
Mary Barra,CEO,General Motors,"The key with autonomous is the whole ecosystem. One of the keys to having a truly fully autonomous is vehicles talking to each other.",Systems Thinking,https://www.supplychaintoday.com/quotes-self-driving-cars/,2025-01-18
Dieter Zetsche,Former CEO,Mercedes-Benz,"I think we see the merging of several worlds the tech industry the internet and the automotive industry. These two worlds merging is like a smart phone on wheels or you can say it's a car that has many of the capabilities of smart phones and computers and so on.",Innovation Thinking,https://www.ibm.com/thought-leadership/institute-business-value/en-us/report/automotive-in-ai-era,2025-01-18
Ted Sarandos,Co-CEO,Netflix,"I think that AI is going to generate a great set of creative tools a great way for creators to tell better stories. If you look back over a hundred years of entertainment you can see how great technology and great entertainment work hand in hand.",Creativity,https://www.hollywoodreporter.com/business/business-news/ted-sarandos-netflix-ceo-wsj-tech-1236041394/,2025-01-18
Ted Sarandos,Co-CEO,Netflix,"I'm pretty sure that there's a better business and a bigger business in making content 10% better than it is making it 50% cheaper.",Quality Focus,https://quotes.mirrorreview.com/7-innovative-quotes-netflix-ceo-reed-hastings/,2025-01-18
Yves Behar,Designer,Fuseproject,"AI will change the nature of creativity so it's important that we develop new ways to interact with these machines.",Adaptability,https://autogpt.net/most-significant-famous-artificial-intelligence-quotes/,2025-01-18
Jaron Lanier,Computer Scientist,Author,"The best art of the future will be a fusion of human imagination and AI precision.",Creativity,https://peak.ai/hub/blog/16-inspiring-quotes-about-ai/,2025-01-18
Sean Ward,Executive Vice President,CBRE,"Think of the amount of time an analyst spends underwriting a deal: the financial model the comp/data set comparing debt structures and so forth. AI will analyze that in seconds. The appraisal business lease administration property management … all will be completely changed by AI.",AI Fluency,https://www.naiop.org/research-and-publications/magazine/2023/winter-2023-2024/business-trends/navigating-the-ai-revolution-a-blueprint-for-real-estate-executives/,2025-01-18
Henry Boye,Real Estate Expert,Author,"Let your negotiation be about collaboration not competition.",Negotiation Skills,https://www.housingwire.com/articles/real-estate-quotes/,2025-01-18
Tom Peters,Management Consultant,Author,"Leaders win through logistics. Vision sure. Strategy yes. But when you go to war you need to have both toilet paper and bullets at the right place at the right time. In other words you must win through superior logistics.",Systems Thinking,https://digitaldefynd.com/IQ/motivational-supply-chain-management-quotes/,2025-01-18
Chris Caplice,Executive Director,MIT Center for Transportation and Logistics,"AI is a moving target. What was considered AI 30 years ago — even 20 years ago — is not considered cutting-edge AI anymore.",Adaptability,https://mitsloan.mit.edu/ideas-made-to-matter/how-artificial-intelligence-transforming-logistics,2025-01-18
Dave Waters,Supply Chain & AI Thought Leader,Author,"Artificial Intelligence will be rampant in the digital supply chain. Self-driving vehicles automatically choosing the most efficient route… Artificial Intelligence will dramatically improve logistics.",AI Integration,https://www.supplychaintoday.com/artificial-intelligence-supply-chain/,2025-01-18
Jonathan Byrnes,Senior Lecturer,MIT,"Many supply chains are perfectly suited to the needs that the business had 20 years ago.",Adaptability,https://digitaldefynd.com/IQ/motivational-supply-chain-management-quotes/,2025-01-18
RDML Kristen Fabry,U.S. Navy Rear Admiral,U.S. Navy,"Supply Chain is the science. Logistics is the art.",Strategic Thinking,https://www.supplychaintoday.com/supply-chain-quotes/,2025-01-18
John Carlin,Former Assistant Attorney General,U.S. DOJ,"Crisis is not the time to decide your breach response strategy.",Strategic Planning,https://solutionsreview.com/security-information-event-management/cybersecurity-awareness-month-quotes-from-industry-experts/,2025-01-18
Javvad Malik,Security Awareness Advocate,KnowBe4,"The weakest link isn't your system—it's the user who clicks without thinking.",Critical Thinking,https://digitaldefynd.com/IQ/inspirational-cybersecurity-quotes/,2025-01-18
Dr. Jessica Vitak,Associate Professor,University of Maryland,"The best security policies are ones that people actually follow.",Human Behavior,https://solutionsreview.com/security-information-event-management/cybersecurity-awareness-month-quotes-from-industry-experts/,2025-01-18
Andy Ellis,Former CSO,Akamai Technologies,"You can outsource operations but not responsibility.",Leadership Accountability,https://www.cyberrescue.co.uk/library/quotes,2025-01-18
Frank Kim,Fellow SANS Institute,SANS Institute,"Cybersecurity leadership means aligning technical risk with business value.",Business Acumen,https://huntsmansecurity.com/blog/quotes-front-line-cyber-security-data-protection/,2025-01-18
Greg Gottesman,Managing Director,Pioneer Square Labs,"The opportunity here smacks you in the face with a sledgehammer.",Market Analysis,https://www.geekwire.com/2025/can-seattle-own-the-ai-era-we-asked-20-investors-and-founders-to-weigh-the-citys-startup-potential/,2025-01-18
David Coats,Co-founder and Managing Director,Correlation Ventures,"We commit to making investment decisions in under two weeks but we have done so in less than 24 hours.",Decision Making,https://visible.vc/blog/ai-tools-for-venture-capital/,2025-01-18
Clint Korver,Managing Director,Ulu Ventures,"The AI is basically reinforcing the existing perspective of the data that it has been trained on. Venture capital is literally decades behind almost every other asset class in terms of sophistication in collecting data evaluating risks and building portfolios.",Critical Thinking,https://www.affinity.co/guides/vc-ai-tools,2025-01-18
Andre Retterath,Partner,Earlybird Ventures,"We've seen that we can leverage AI across the tech stack so for every single task that we do we can use AI to become more efficient more effective and also leverage data-driven approaches and AI to become more inclusive.",AI Integration,https://www.4degrees.ai/blog/venture-capital-due-diligence-guide,2025-01-18
Paul Ostergaard,CEO and Founder,Norwood Systems,"By partnering with Microsoft Norwood Systems is pushing the boundaries of innovation in telecommunications. Leveraging Azure AI in our cutting-edge solutions we're empowering telecoms operators to unlock new revenue streams elevate customer engagement and deliver next-generation experiences.",Innovation,https://www.microsoft.com/en-us/industry/blog/telecommunications/2024/10/01/transforming-telecoms-with-ai/,2025-01-18
Haisung Kwon,Head of MNO AI Platforms,SK Telecom,"Through our collaboration with Dell Technologies we aim to accelerate AI adoption and innovation to deliver superior service and value to our customers.",Customer Focus,https://www.dell.com/en-us/dt/corporate/newsroom/announcements/detailpage.press-releases~usa~2024~09~telecommunications-into-the-ai-era.htm,2025-01-18
Ronnie Vasishta,Senior Vice President Telecom,NVIDIA,"Telecom networks provide a critical fabric to bring AI applications to consumers and enterprises at scale. With NVIDIA's AI suite Dell is accelerating the adoption of AI factories AI-powered operations and AI-RAN in telecom.",Systems Thinking,https://www.dell.com/en-us/dt/corporate/newsroom/announcements/detailpage.press-releases~usa~2024~09~telecommunications-into-the-ai-era.htm,2025-01-18