company,question,difficulty,question_type,skills_assessed,eng_mgmt_level,source
SpaceX,"Your team's ground control software needs 99.99% uptime for mission-critical operations. How do you achieve this reliability?",Staff,Technical Strategy,Technical Leadership & Vision,Director,Interview
Boeing,"You're managing software for flight control systems with strict regulatory requirements. How do you balance innovation with compliance?",Staff,Technical Strategy,Strategic Planning & Decision Making,VP Engineering,Interview
General Electric,"Your team needs to modernize industrial IoT systems while maintaining backward compatibility. What's your strategy?",Senior,Technical Strategy,Technical Leadership & Vision,Senior Manager,Interview
General,"Your startup team of 3 engineers needs to build an MVP in 2 months. How do you prioritize and execute?",Junior,Project Management,Project Planning & Execution,Team Lead,Interview
General,"You inherited a team with no coding standards and inconsistent practices. How do you establish engineering discipline?",Mid,Technical Strategy,Technical Leadership & Vision,Engineering Manager,Interview
General,"Your team's open source project is gaining traction but creating maintenance burden. How do you manage this?",Senior,Resource Allocation,Strategic Planning & Decision Making,Senior Manager,Interview
General,"A security audit revealed multiple vulnerabilities in your team's code. How do you address this systematically?",Senior,Technical Strategy,Technical Leadership & Vision,Senior Manager,Interview
General,"Your team needs to choose between three different architectural approaches for a new system. How do you make this decision?",Senior,Technical Strategy,Strategic Planning & Decision Making,Senior Manager,Interview
Google,"Your team's search algorithm update is causing unexpected results. How do you diagnose and fix this quickly?",Senior,Technical Strategy,Technical Leadership & Vision,Senior Manager,Interview
Apple,"You need to coordinate iOS and macOS feature parity across two separate teams. How do you ensure consistency?",Senior,Cross-functional Collaboration,Project Planning & Execution,Senior Manager,Interview
Microsoft,"Your team's Azure service is experiencing intermittent failures affecting customers. What's your incident response strategy?",Senior,Technical Strategy,Technical Leadership & Vision,Senior Manager,Interview
Amazon,"You need to optimize your team's recommendation engine for Black Friday traffic. How do you prepare for this scale?",Senior,Technical Strategy,Resource Management & Allocation,Senior Manager,Interview
Tesla,"Your team's autonomous driving software needs to handle edge cases safely. How do you approach comprehensive testing?",Staff,Technical Strategy,Technical Leadership & Vision,Director,Interview
Meta,"Your team's social media algorithm is showing bias in content distribution. How do you investigate and fix this?",Senior,Technical Strategy,Innovation & Technology Strategy,Senior Manager,Interview
Netflix,"You need to optimize video streaming quality for users with poor internet connections. What's your technical approach?",Mid,Technical Strategy,Technical Leadership & Vision,Engineering Manager,Interview
Uber,"Your team's pricing algorithm needs to balance driver earnings with rider affordability. How do you optimize this?",Senior,Technical Strategy,Strategic Planning & Decision Making,Senior Manager,Interview
Airbnb,"You need to detect and prevent fraudulent listings while maintaining user experience. What's your strategy?",Senior,Technical Strategy,Technical Leadership & Vision,Senior Manager,Interview
SpaceX,"Your team's trajectory calculation software has a minor discrepancy that could affect mission success. How do you handle this?",Staff,Technical Strategy,Strategic Planning & Decision Making,Director,Interview
General,"Your team's database is approaching capacity limits and performance is degrading. What's your scaling strategy?",Mid,Technical Strategy,Technical Leadership & Vision,Engineering Manager,Interview
General,"You need to migrate your team's monolith to microservices without disrupting service. How do you plan this transition?",Senior,Technical Strategy,Strategic Planning & Decision Making,Senior Manager,Interview
General,"Your team's API is being rate-limited by a critical third-party service. How do you architect around this constraint?",Mid,Technical Strategy,Technical Leadership & Vision,Engineering Manager,Interview
General,"A competitor is poaching your best engineers with significant salary increases. How do you retain talent?",Senior,Team Leadership,Team Management & Development,Senior Manager,Interview
General,"Your team needs to reduce technical debt while delivering new features under tight deadlines. How do you balance this?",Senior,Technical Strategy,Strategic Planning & Decision Making,Senior Manager,Interview
General,"You discover your team's caching strategy is causing data inconsistency issues. How do you redesign this?",Mid,Technical Strategy,Technical Leadership & Vision,Engineering Manager,Interview
General,"Your team's monitoring and alerting system has too many false positives. How do you improve signal-to-noise ratio?",Mid,Technical Strategy,Technical Leadership & Vision,Engineering Manager,Interview
General,"You need to onboard 5 new engineers quickly while maintaining team productivity. What's your onboarding strategy?",Mid,Technical Hiring,Technical Hiring & Talent Development,Engineering Manager,Interview
General,"Your team's feature flags system is becoming unwieldy and causing configuration drift. How do you manage this complexity?",Mid,Technical Strategy,Technical Leadership & Vision,Engineering Manager,Interview
General,"A critical team member is burning out from oncall responsibilities but is the only expert in the system. How do you address this?",Senior,Resource Allocation,Team Management & Development,Senior Manager,Interview