company,question,difficulty,question_type,skills_assessed,healthcare_consulting_level,source
IQVIA,"A biotech company's regulatory strategy for orphan drug designation needs refinement. How do you optimize the approach?",Senior,Regulatory & Compliance,Regulatory & Compliance Expertise,Principal,Interview
Huron,"A hospital's coding accuracy is impacting reimbursement. How do you improve documentation and coding processes?",Mid,Provider Operations,Healthcare Industry Knowledge,Senior Consultant,Interview
General,"How would you help a health system develop a community paramedicine program?",Mid,Population Health,Population Health & Outcomes,Senior Consultant,Interview
McKinsey Health,"A hospital's emergency department is experiencing frequent diversions. How do you address capacity constraints?",Mid,Operations Improvement,Operations Improvement & Efficiency,Senior Consultant,Interview
BCG Health,"A health technology company wants to demonstrate ROI to health systems. What value measurement framework would you develop?",Senior,Digital Health,Data Analysis & Health Economics,Manager,Interview
Bain Health,"A health plan's network management is struggling with provider contract negotiations. How do you improve strategies?",Senior,Payer Strategy,Strategic Planning & Analysis,Manager,Interview
Deloitte Health,"A pharmaceutical company faces accelerated approval pathway requirements. How do you prepare for regulatory submission?",Senior,Regulatory & Compliance,Regulatory & Compliance Expertise,Principal,Interview
PwC Health,"A hospital's environmental services scores are declining. How do you improve facility cleanliness and infection control?",Mid,Operations Improvement,Operations Improvement & Efficiency,Senior Consultant,Interview
EY Health,"A health system wants to develop a retail health strategy. What market positioning would you recommend?",Senior,Healthcare Strategy,Strategic Planning & Analysis,Manager,Interview
KPMG Health,"A hospital's financial planning process lacks predictive capabilities. How do you improve forecasting accuracy?",Mid,Operations Improvement,Data Analysis & Health Economics,Senior Consultant,Interview
Accenture Health,"A health plan wants to implement natural language processing for member communications. What use cases would you prioritize?",Senior,Digital Health,Digital Health & Technology,Manager,Interview
IQVIA,"A pharmaceutical company's patient registry data isn't supporting research objectives. How do you enhance data quality?",Senior,Healthcare Strategy,Data Analysis & Health Economics,Manager,Interview
Huron,"A hospital's medical staff credentialing database needs modernization. How do you manage the technology transition?",Mid,Operations Improvement,Digital Health & Technology,Senior Consultant,Interview
General,"How would you help a health system develop a violence prevention program in the emergency department?",Mid,Provider Operations,Population Health & Outcomes,Senior Consultant,Interview
McKinsey Health,"A specialty hospital's referral patterns show geographic concentration risks. How do you diversify patient sources?",Senior,Healthcare Strategy,Strategic Planning & Analysis,Manager,Interview
BCG Health,"A pharmaceutical company wants to develop a real-world data strategy. What partnerships and capabilities would you prioritize?",Senior,Healthcare Strategy,Data Analysis & Health Economics,Principal,Interview
Bain Health,"A health plan's member engagement in preventive care is below target. How do you increase participation?",Mid,Population Health,Population Health & Outcomes,Senior Consultant,Interview
Deloitte Health,"A medical device company needs to establish a quality management system for international markets. How do you ensure global compliance?",Senior,Regulatory & Compliance,Regulatory & Compliance Expertise,Principal,Interview
PwC Health,"A hospital's medication reconciliation process has safety concerns. How do you improve pharmaceutical management?",Mid,Provider Operations,Operations Improvement & Efficiency,Senior Consultant,Interview
EY Health,"A health system wants to optimize their imaging services across multiple locations. What consolidation strategy would you develop?",Senior,Healthcare Strategy,Operations Improvement & Efficiency,Manager,Interview
KPMG Health,"A health plan's claims processing accuracy is below industry standards. How do you improve operational quality?",Mid,Operations Improvement,Operations Improvement & Efficiency,Senior Consultant,Interview
Accenture Health,"A hospital wants to implement computer vision for radiology workflow. What implementation roadmap would you create?",Senior,Digital Health,Digital Health & Technology,Manager,Interview
IQVIA,"A biotech company's competitive intelligence capabilities need strengthening. How do you build market monitoring systems?",Senior,Healthcare Strategy,Strategic Planning & Analysis,Manager,Interview
Huron,"A hospital's physician performance feedback system isn't driving improvement. How do you redesign the approach?",Mid,Provider Operations,Change Management & Implementation,Senior Consultant,Interview
General,"How would you help a health system develop a transitional care management program?",Mid,Population Health,Population Health & Outcomes,Senior Consultant,Interview
McKinsey Health,"What factors would you analyze when a health system's patient loyalty scores are declining in their primary service area?",Junior,Provider Operations,Healthcare Industry Knowledge,Analyst,Interview
BCG Health,"How would you approach evaluating a pharmaceutical company's market entry into emerging biosimilar markets?",Senior,Healthcare Strategy,Strategic Planning & Analysis,Principal,Interview
Bain Health,"What key metrics would you track when a health plan implements a new member onboarding process?",Junior,Payer Strategy,Data Analysis & Health Economics,Consultant,Interview
Deloitte Health,"How would you help a startup medical device company prepare for their first FDA 510(k) submission?",Mid,Regulatory & Compliance,Regulatory & Compliance Expertise,Senior Consultant,Interview
PwC Health,"What operational improvements would you recommend for a hospital experiencing nursing shortage impacts?",Junior,Provider Operations,Operations Improvement & Efficiency,Consultant,Interview
EY Health,"How would you structure a market analysis for a health system considering urgent care expansion?",Junior,Healthcare Strategy,Strategic Planning & Analysis,Consultant,Interview
KPMG Health,"What revenue cycle improvements would you prioritize for a hospital with increasing bad debt?",Junior,Operations Improvement,Operations Improvement & Efficiency,Consultant,Interview
Accenture Health,"How would you assess the ROI potential of implementing AI chatbots for patient customer service?",Mid,Digital Health,Data Analysis & Health Economics,Senior Consultant,Interview
IQVIA,"What approach would you take to help a pharmaceutical company optimize their clinical trial site selection?",Mid,Operations Improvement,Strategic Planning & Analysis,Senior Consultant,Interview
Huron,"How would you design a physician engagement survey to identify satisfaction improvement opportunities?",Junior,Provider Operations,Change Management & Implementation,Analyst,Interview
General,"What framework would you use to evaluate a health system's readiness for population health management?",Mid,Population Health,Population Health & Outcomes,Senior Consultant,Interview
McKinsey Health,"How would you help a hospital system benchmark their specialty service line performance against competitors?",Mid,Provider Operations,Strategic Planning & Analysis,Senior Consultant,Interview
BCG Health,"What considerations would you include when advising a pharma company on pricing strategy for a breakthrough therapy?",Senior,Health Economics,Data Analysis & Health Economics,Principal,Interview
Bain Health,"How would you structure an analysis of a health plan's medical management effectiveness?",Mid,Payer Strategy,Data Analysis & Health Economics,Senior Consultant,Interview
Deloitte Health,"What compliance framework would you establish for a health technology company entering multiple state markets?",Mid,Regulatory & Compliance,Regulatory & Compliance Expertise,Senior Consultant,Interview
PwC Health,"How would you evaluate the business case for a hospital investing in robotic surgery capabilities?",Mid,Healthcare Strategy,Strategic Planning & Analysis,Senior Consultant,Interview
EY Health,"What factors would you analyze when helping a health system optimize their ambulatory care footprint?",Mid,Provider Operations,Strategic Planning & Analysis,Senior Consultant,Interview
KPMG Health,"How would you approach improving a hospital's supply chain management to reduce costs?",Junior,Operations Improvement,Operations Improvement & Efficiency,Consultant,Interview
Accenture Health,"What change management approach would you use for implementing electronic health records across a health system?",Mid,Digital Health,Change Management & Implementation,Senior Consultant,Interview
IQVIA,"How would you help a biotech company develop competitive intelligence for their therapeutic area?",Junior,Healthcare Strategy,Strategic Planning & Analysis,Consultant,Interview
Huron,"What methodology would you use to assess physician productivity across different specialties?",Junior,Provider Operations,Data Analysis & Health Economics,Analyst,Interview