company,question,difficulty,question_type,skills_assessed,healthcare_consulting_level,source
McKinsey Health,"A hospital system's readmission rates are 20% above national average. How do you approach this problem?",Mid,Operations Improvement,Operations Improvement & Efficiency,Senior Consultant,Interview
BCG Health,"A health plan wants to reduce medical costs by 15% without affecting quality. What's your strategy?",Senior,Payer Strategy,Strategic Planning & Analysis,Manager,Interview
Bain Health,"Your client hospital is losing $5M annually to a new competitor. How do you help them respond?",Senior,Healthcare Strategy,Strategic Planning & Analysis,Manager,Interview
Deloitte Health,"A pharmaceutical company needs to navigate new FDA regulations for digital therapeutics. How do you advise them?",Senior,Regulatory & Compliance,Regulatory & Compliance Expertise,Principal,Interview
PwC Health,"A rural health system wants to implement telemedicine but lacks technical expertise. What's your implementation plan?",Mid,Digital Health,Digital Health & Technology,Senior Consultant,Interview
EY Health,"A large employer's healthcare costs increased 25% year-over-year. How do you help them control expenses?",Mid,Health Economics,Data Analysis & Health Economics,Consultant,Interview
KPMG Health,"A hospital's emergency department has 8-hour average wait times. How do you improve patient flow?",Mid,Operations Improvement,Operations Improvement & Efficiency,Senior Consultant,Interview
Accenture Health,"A health system wants to transition from fee-for-service to value-based care. What's your roadmap?",Senior,Healthcare Strategy,Strategic Planning & Analysis,Manager,Interview
IQVIA,"A pharmaceutical company's clinical trial enrollment is 50% behind target. How do you accelerate recruitment?",Senior,Operations Improvement,Project Management & Delivery,Manager,Interview
Huron,"A hospital's physician satisfaction scores are declining rapidly. How do you address this issue?",Mid,Provider Operations,Change Management & Implementation,Senior Consultant,Interview
General,"How would you help a health system reduce their supply chain costs by $10M annually?",Senior,Operations Improvement,Operations Improvement & Efficiency,Manager,Interview
McKinsey Health,"A mental health provider network has a 3-month average wait time for appointments. What solutions do you propose?",Mid,Provider Operations,Operations Improvement & Efficiency,Senior Consultant,Interview
BCG Health,"A health plan's member satisfaction is in the bottom 10th percentile. How do you turn this around?",Senior,Payer Strategy,Client Relationship Management,Manager,Interview
Bain Health,"A regional health system is considering acquiring three smaller hospitals. How do you evaluate this opportunity?",Senior,Healthcare Strategy,Strategic Planning & Analysis,Principal,Interview
Deloitte Health,"A medical device company faces new cybersecurity regulations. How do you help them achieve compliance?",Senior,Regulatory & Compliance,Regulatory & Compliance Expertise,Manager,Interview
PwC Health,"A hospital's nursing turnover rate is 35% annually. What retention strategies would you recommend?",Mid,Provider Operations,Change Management & Implementation,Senior Consultant,Interview
EY Health,"A health plan wants to launch a Medicare Advantage product. What market entry strategy do you suggest?",Senior,Payer Strategy,Strategic Planning & Analysis,Principal,Interview
KPMG Health,"A hospital's operating margins dropped from 8% to 2% in one year. How do you restore profitability?",Senior,Healthcare Strategy,Data Analysis & Health Economics,Manager,Interview
Accenture Health,"A health system wants to implement AI for diagnostic imaging. How do you manage this transformation?",Senior,Digital Health,Digital Health & Technology,Manager,Interview
IQVIA,"A biotech company's drug launch revenue is 40% below projections. How do you investigate and address this?",Senior,Healthcare Strategy,Strategic Planning & Analysis,Principal,Interview
Huron,"A hospital's patient safety scores are declining. How do you develop an improvement plan?",Mid,Provider Operations,Operations Improvement & Efficiency,Senior Consultant,Interview
General,"How would you help a health plan design a population health management program for diabetic patients?",Mid,Population Health,Population Health & Outcomes,Senior Consultant,Interview
McKinsey Health,"A hospital system's case mix index is declining. How do you address revenue optimization?",Senior,Provider Operations,Healthcare Industry Knowledge,Manager,Interview
BCG Health,"A pharmaceutical company wants to enter the digital health market. What's your market assessment approach?",Senior,Digital Health,Strategic Planning & Analysis,Principal,Interview
Bain Health,"A health system's physician-hospital integration strategy is failing. How do you restructure the approach?",Senior,Provider Operations,Change Management & Implementation,Principal,Interview
Deloitte Health,"A health plan needs to prepare for Medicare Advantage star rating audits. How do you ensure compliance?",Mid,Regulatory & Compliance,Regulatory & Compliance Expertise,Senior Consultant,Interview
PwC Health,"A hospital's length of stay is 20% above benchmark. What operational improvements would you implement?",Mid,Operations Improvement,Operations Improvement & Efficiency,Senior Consultant,Interview
EY Health,"A health system wants to optimize their specialty care referral patterns. How do you approach this challenge?",Mid,Provider Operations,Data Analysis & Health Economics,Senior Consultant,Interview
KPMG Health,"A hospital's revenue cycle is generating significant denials. How do you improve collections?",Mid,Operations Improvement,Operations Improvement & Efficiency,Senior Consultant,Interview
Accenture Health,"A health plan wants to implement predictive analytics for member risk stratification. What's your implementation strategy?",Senior,Digital Health,Data Analysis & Health Economics,Manager,Interview
IQVIA,"A pharmaceutical company's market access strategy isn't penetrating key payer segments. How do you revise the approach?",Senior,Payer Strategy,Strategic Planning & Analysis,Manager,Interview
Huron,"A hospital's physician engagement scores are at an all-time low. How do you rebuild trust and collaboration?",Mid,Provider Operations,Change Management & Implementation,Senior Consultant,Interview
General,"How would you help a rural hospital maintain financial viability while serving an aging population?",Senior,Healthcare Strategy,Strategic Planning & Analysis,Manager,Interview
McKinsey Health,"A health system's quality metrics are inconsistent across facilities. How do you standardize performance?",Mid,Operations Improvement,Operations Improvement & Efficiency,Senior Consultant,Interview
BCG Health,"A biotech company needs to optimize their clinical development portfolio. What prioritization framework would you use?",Senior,Healthcare Strategy,Strategic Planning & Analysis,Principal,Interview
Bain Health,"A health plan's administrative costs are 15% above industry average. How do you identify efficiency opportunities?",Senior,Payer Strategy,Operations Improvement & Efficiency,Manager,Interview
Deloitte Health,"A medical device manufacturer faces new European regulations. How do you ensure global compliance?",Senior,Regulatory & Compliance,Regulatory & Compliance Expertise,Principal,Interview
PwC Health,"A hospital's emergency department boarding times exceed 4 hours. What systemic changes would you recommend?",Mid,Operations Improvement,Operations Improvement & Efficiency,Senior Consultant,Interview
EY Health,"A health system wants to launch a direct primary care model. How do you assess market feasibility?",Senior,Healthcare Strategy,Strategic Planning & Analysis,Manager,Interview
KPMG Health,"A hospital's pharmacy costs increased 30% year-over-year. How do you control pharmaceutical spending?",Mid,Operations Improvement,Operations Improvement & Efficiency,Senior Consultant,Interview
Accenture Health,"A health plan wants to improve member engagement through digital tools. What solutions would you prioritize?",Mid,Digital Health,Digital Health & Technology,Senior Consultant,Interview
IQVIA,"A pharmaceutical company's real-world evidence strategy needs strengthening. How do you build capabilities?",Senior,Healthcare Strategy,Data Analysis & Health Economics,Manager,Interview
Huron,"A hospital's physician productivity is below benchmark. How do you improve clinical efficiency?",Mid,Provider Operations,Operations Improvement & Efficiency,Senior Consultant,Interview
General,"How would you help a health system develop an accountable care organization strategy?",Senior,Healthcare Strategy,Population Health & Outcomes,Manager,Interview
McKinsey Health,"A hospital's patient experience scores rank in the bottom quartile. What improvement initiatives would you launch?",Mid,Provider Operations,Operations Improvement & Efficiency,Senior Consultant,Interview
BCG Health,"A health technology company wants to scale their platform across health systems. What go-to-market strategy do you recommend?",Senior,Digital Health,Strategic Planning & Analysis,Manager,Interview
Bain Health,"A hospital system's merger integration is behind schedule and over budget. How do you get it back on track?",Senior,Healthcare Strategy,Change Management & Implementation,Principal,Interview
Deloitte Health,"A health plan faces new state regulations on prior authorization timelines. How do you ensure operational readiness?",Mid,Regulatory & Compliance,Regulatory & Compliance Expertise,Senior Consultant,Interview
PwC Health,"A hospital's surgical utilization rates are declining. How do you analyze and address this trend?",Mid,Provider Operations,Data Analysis & Health Economics,Senior Consultant,Interview
EY Health,"A health system wants to optimize their ambulatory care network. What site selection criteria would you establish?",Senior,Healthcare Strategy,Strategic Planning & Analysis,Manager,Interview
KPMG Health,"A hospital's accounts receivable days are increasing monthly. How do you accelerate cash collection?",Mid,Operations Improvement,Operations Improvement & Efficiency,Senior Consultant,Interview
Accenture Health,"A health plan wants to implement artificial intelligence for claims processing. What implementation roadmap would you create?",Senior,Digital Health,Digital Health & Technology,Manager,Interview
IQVIA,"A pharmaceutical company's patient access programs aren't reaching target populations. How do you improve effectiveness?",Mid,Healthcare Strategy,Population Health & Outcomes,Senior Consultant,Interview
Huron,"A hospital's medical staff credentialing process takes 120 days. How do you streamline operations?",Mid,Operations Improvement,Operations Improvement & Efficiency,Senior Consultant,Interview
General,"How would you help a health system transition to a clinically integrated network model?",Senior,Healthcare Strategy,Strategic Planning & Analysis,Principal,Interview
McKinsey Health,"A mental health practice network has inconsistent clinical outcomes. How do you standardize care delivery?",Mid,Provider Operations,Operations Improvement & Efficiency,Senior Consultant,Interview
BCG Health,"A pharmaceutical company wants to develop a direct-to-consumer strategy. What market analysis would you conduct?",Senior,Healthcare Strategy,Strategic Planning & Analysis,Manager,Interview
Bain Health,"A health plan's medical loss ratio exceeds regulatory thresholds. What immediate actions would you take?",Senior,Payer Strategy,Data Analysis & Health Economics,Manager,Interview
Deloitte Health,"A medical device company needs to navigate breakthrough device designation. How do you accelerate the FDA process?",Senior,Regulatory & Compliance,Regulatory & Compliance Expertise,Principal,Interview
PwC Health,"A hospital's infection control metrics are deteriorating. How do you implement improvement protocols?",Mid,Provider Operations,Operations Improvement & Efficiency,Senior Consultant,Interview
EY Health,"A health system wants to develop a centers of excellence strategy. How do you prioritize specialties?",Senior,Healthcare Strategy,Strategic Planning & Analysis,Manager,Interview
KPMG Health,"A hospital's labor costs are 20% above benchmark. How do you optimize workforce productivity?",Mid,Operations Improvement,Operations Improvement & Efficiency,Senior Consultant,Interview
Accenture Health,"A health plan wants to launch a chronic care management program. What technology platform would you recommend?",Mid,Digital Health,Digital Health & Technology,Senior Consultant,Interview
IQVIA,"A biotech company's patient recruitment for rare disease studies is challenging. What innovative approaches would you suggest?",Senior,Operations Improvement,Strategic Planning & Analysis,Manager,Interview
Huron,"A hospital's physician documentation quality is impacting reimbursement. How do you improve clinical documentation?",Mid,Provider Operations,Healthcare Industry Knowledge,Senior Consultant,Interview
General,"How would you help a health system develop a social determinants of health intervention program?",Mid,Population Health,Population Health & Outcomes,Senior Consultant,Interview
McKinsey Health,"A hospital system's market share is declining in key service lines. How do you develop a competitive response?",Senior,Healthcare Strategy,Strategic Planning & Analysis,Manager,Interview
BCG Health,"A health technology startup wants to partner with health plans. What partnership strategy would you develop?",Senior,Digital Health,Strategic Planning & Analysis,Manager,Interview
Bain Health,"A hospital's emergency department volumes dropped 40% post-COVID. How do you restore patient confidence?",Senior,Provider Operations,Change Management & Implementation,Manager,Interview
Deloitte Health,"A pharmaceutical company faces supply chain disruptions affecting drug availability. How do you ensure continuity?",Senior,Operations Improvement,Operations Improvement & Efficiency,Manager,Interview
PwC Health,"A health system's telehealth adoption plateaued at 30%. How do you accelerate digital transformation?",Mid,Digital Health,Digital Health & Technology,Senior Consultant,Interview
EY Health,"A hospital's case management program isn't reducing readmissions. How do you redesign the approach?",Mid,Operations Improvement,Operations Improvement & Efficiency,Senior Consultant,Interview
KPMG Health,"A health plan's member churn rate increased 50% after premium increases. How do you improve retention?",Senior,Payer Strategy,Client Relationship Management,Manager,Interview
Accenture Health,"A hospital wants to implement robotic process automation in revenue cycle. What processes would you prioritize?",Mid,Digital Health,Digital Health & Technology,Senior Consultant,Interview
IQVIA,"A pharmaceutical company's health economics data isn't supporting formulary placement. How do you strengthen the value proposition?",Senior,Health Economics,Data Analysis & Health Economics,Manager,Interview
Huron,"A hospital's surgical scheduling efficiency is below 70%. How do you optimize OR utilization?",Mid,Operations Improvement,Operations Improvement & Efficiency,Senior Consultant,Interview
General,"How would you help a health system develop a community health needs assessment strategy?",Mid,Population Health,Population Health & Outcomes,Senior Consultant,Interview
McKinsey Health,"A health plan's provider network adequacy is being challenged by regulators. How do you expand access?",Senior,Payer Strategy,Regulatory & Compliance Expertise,Manager,Interview
BCG Health,"A medical device company wants to transition from product sales to value-based contracts. What's your approach?",Senior,Healthcare Strategy,Strategic Planning & Analysis,Principal,Interview
Bain Health,"A hospital system's integration with a physician practice is creating cultural conflicts. How do you manage change?",Senior,Provider Operations,Change Management & Implementation,Manager,Interview
Deloitte Health,"A health plan needs to implement new CMS risk adjustment requirements. How do you ensure compliance?",Mid,Regulatory & Compliance,Regulatory & Compliance Expertise,Senior Consultant,Interview
PwC Health,"A hospital's patient satisfaction with pain management is declining. How do you improve protocols?",Mid,Provider Operations,Operations Improvement & Efficiency,Senior Consultant,Interview
EY Health,"A health system wants to optimize their post-acute care partnerships. What evaluation criteria would you establish?",Senior,Healthcare Strategy,Strategic Planning & Analysis,Manager,Interview
KPMG Health,"A hospital's supply chain costs are 15% above benchmark. How do you identify savings opportunities?",Mid,Operations Improvement,Operations Improvement & Efficiency,Senior Consultant,Interview
Accenture Health,"A health plan wants to implement machine learning for fraud detection. What implementation strategy would you recommend?",Senior,Digital Health,Digital Health & Technology,Manager,Interview
IQVIA,"A pharmaceutical company's adherence programs aren't improving patient outcomes. How do you redesign the approach?",Mid,Population Health,Population Health & Outcomes,Senior Consultant,Interview
Huron,"A hospital's physician recruitment is taking 12 months on average. How do you accelerate the process?",Mid,Provider Operations,Operations Improvement & Efficiency,Senior Consultant,Interview
General,"How would you help a rural health system develop a sustainable financial model?",Senior,Healthcare Strategy,Strategic Planning & Analysis,Manager,Interview
McKinsey Health,"A hospital's sepsis mortality rates exceed national benchmarks. How do you implement improvement protocols?",Mid,Provider Operations,Operations Improvement & Efficiency,Senior Consultant,Interview
BCG Health,"A pharmaceutical company wants to develop a companion diagnostic strategy. What market approach would you recommend?",Senior,Healthcare Strategy,Strategic Planning & Analysis,Principal,Interview
Bain Health,"A health plan's customer service metrics are below industry standards. How do you improve member experience?",Mid,Payer Strategy,Client Relationship Management,Senior Consultant,Interview
Deloitte Health,"A medical device company faces new quality management system requirements. How do you ensure compliance?",Senior,Regulatory & Compliance,Regulatory & Compliance Expertise,Manager,Interview
PwC Health,"A hospital's readmission penalties are increasing annually. How do you develop a comprehensive reduction strategy?",Mid,Operations Improvement,Operations Improvement & Efficiency,Senior Consultant,Interview
EY Health,"A health system wants to launch an urgent care network. What market analysis would you conduct?",Senior,Healthcare Strategy,Strategic Planning & Analysis,Manager,Interview
KPMG Health,"A hospital's denied claims rate is 12% above industry average. How do you improve revenue cycle performance?",Mid,Operations Improvement,Operations Improvement & Efficiency,Senior Consultant,Interview
Accenture Health,"A health plan wants to develop a precision medicine program. What technology infrastructure would you recommend?",Senior,Digital Health,Digital Health & Technology,Principal,Interview
IQVIA,"A biotech company's clinical operations are consistently over budget. How do you optimize trial efficiency?",Senior,Operations Improvement,Project Management & Delivery,Manager,Interview
Huron,"A hospital's nursing satisfaction scores indicate burnout concerns. How do you address workforce challenges?",Mid,Provider Operations,Change Management & Implementation,Senior Consultant,Interview
General,"How would you help a health system develop a behavioral health integration strategy?",Senior,Healthcare Strategy,Strategic Planning & Analysis,Manager,Interview
McKinsey Health,"A specialty practice network has inconsistent quality metrics across locations. How do you standardize care?",Mid,Provider Operations,Operations Improvement & Efficiency,Senior Consultant,Interview
BCG Health,"A health technology company wants to expand internationally. What market entry strategy would you develop?",Senior,Digital Health,Strategic Planning & Analysis,Principal,Interview
Bain Health,"A hospital's physician-nurse communication issues are affecting patient safety. How do you improve collaboration?",Mid,Provider Operations,Change Management & Implementation,Senior Consultant,Interview
Deloitte Health,"A pharmaceutical company needs to prepare for FDA inspection. How do you ensure regulatory readiness?",Senior,Regulatory & Compliance,Regulatory & Compliance Expertise,Manager,Interview
PwC Health,"A health system's ambulatory surgery center utilization is below capacity. How do you increase volumes?",Mid,Provider Operations,Strategic Planning & Analysis,Senior Consultant,Interview
EY Health,"A hospital wants to implement value-based purchasing initiatives. What quality improvement framework would you establish?",Senior,Healthcare Strategy,Operations Improvement & Efficiency,Manager,Interview
KPMG Health,"A health plan's administrative efficiency ratio is deteriorating. How do you streamline operations?",Senior,Payer Strategy,Operations Improvement & Efficiency,Manager,Interview
Accenture Health,"A hospital wants to implement IoT devices for patient monitoring. What cybersecurity considerations would you address?",Senior,Digital Health,Digital Health & Technology,Manager,Interview
IQVIA,"A pharmaceutical company's market access team lacks payer insights. How do you build intelligence capabilities?",Mid,Payer Strategy,Strategic Planning & Analysis,Senior Consultant,Interview
Huron,"A hospital's medical staff engagement in quality initiatives is low. How do you increase participation?",Mid,Provider Operations,Change Management & Implementation,Senior Consultant,Interview
General,"How would you help a health system develop a palliative care program?",Mid,Provider Operations,Population Health & Outcomes,Senior Consultant,Interview
McKinsey Health,"A hospital system's brand perception is declining in competitive markets. How do you rebuild reputation?",Senior,Healthcare Strategy,Strategic Planning & Analysis,Manager,Interview
BCG Health,"A digital health platform wants to demonstrate clinical outcomes. What evidence generation strategy would you recommend?",Senior,Digital Health,Data Analysis & Health Economics,Manager,Interview
Bain Health,"A health plan's pharmacy benefit management costs are escalating. How do you control drug spend?",Senior,Payer Strategy,Strategic Planning & Analysis,Manager,Interview
Deloitte Health,"A medical device company faces post-market surveillance requirements. How do you establish monitoring systems?",Senior,Regulatory & Compliance,Regulatory & Compliance Expertise,Manager,Interview
PwC Health,"A hospital's discharge planning process is causing delays. How do you improve patient flow?",Mid,Operations Improvement,Operations Improvement & Efficiency,Senior Consultant,Interview
EY Health,"A health system wants to optimize their specialty pharmacy operations. What performance metrics would you establish?",Mid,Provider Operations,Operations Improvement & Efficiency,Senior Consultant,Interview
KPMG Health,"A hospital's patient access scheduling system is inefficient. How do you streamline appointment management?",Mid,Operations Improvement,Digital Health & Technology,Senior Consultant,Interview
Accenture Health,"A health plan wants to implement blockchain for claims processing. What feasibility assessment would you conduct?",Senior,Digital Health,Digital Health & Technology,Principal,Interview
IQVIA,"A pharmaceutical company's patient support programs have low enrollment. How do you improve uptake?",Mid,Population Health,Population Health & Outcomes,Senior Consultant,Interview
Huron,"A hospital's medical device utilization data shows inefficiencies. How do you optimize equipment management?",Mid,Operations Improvement,Data Analysis & Health Economics,Senior Consultant,Interview
General,"How would you help a health system develop a maternal health quality improvement program?",Mid,Population Health,Population Health & Outcomes,Senior Consultant,Interview
McKinsey Health,"A health plan's star ratings dropped significantly. What immediate improvement actions would you prioritize?",Senior,Payer Strategy,Regulatory & Compliance Expertise,Manager,Interview
BCG Health,"A pharmaceutical company wants to develop a biosimilar market strategy. How do you assess competitive positioning?",Senior,Healthcare Strategy,Strategic Planning & Analysis,Principal,Interview
Bain Health,"A hospital's employee satisfaction scores indicate leadership concerns. How do you address management effectiveness?",Mid,Provider Operations,Change Management & Implementation,Senior Consultant,Interview
Deloitte Health,"A health technology company needs FDA software validation. How do you navigate the regulatory pathway?",Senior,Regulatory & Compliance,Regulatory & Compliance Expertise,Principal,Interview
PwC Health,"A health system's referral management process is losing patients to competitors. How do you improve retention?",Mid,Provider Operations,Operations Improvement & Efficiency,Senior Consultant,Interview
EY Health,"A hospital wants to develop a population health analytics capability. What data infrastructure would you recommend?",Senior,Population Health,Data Analysis & Health Economics,Manager,Interview
KPMG Health,"A health plan's prior authorization process is creating provider friction. How do you streamline approvals?",Mid,Payer Strategy,Operations Improvement & Efficiency,Senior Consultant,Interview
Accenture Health,"A hospital wants to implement augmented reality for surgical training. What change management approach would you use?",Senior,Digital Health,Change Management & Implementation,Manager,Interview
