company,question,difficulty,question_type,skills_assessed,im_level,source
BlackRock,Your equity fund is underperforming the benchmark by 200bps this quarter. How do you address this with your largest institutional client?,Senior,Performance Analysis,Performance Measurement & Attribution,Senior PM,Interview
Vanguard,A retail client wants to withdraw their entire retirement portfolio during a 15% market downturn. What's your approach?,Mid,Client Relations,Client Relationship Management,Associate,Interview
Fidelity,You discover a material error in your fund's NAV calculation from two weeks ago. Walk me through your immediate actions.,Staff,Risk Management,Regulatory & Compliance Knowledge,Director,Interview
State Street,Your quantitative model is showing conflicting signals for European equities. How do you proceed with portfolio decisions?,Senior,Portfolio Management,Quantitative Analysis & Modeling,Portfolio Manager,Interview
PIMCO,Interest rates are rising faster than your models predicted. How do you adjust your fixed income strategy?,Senior,Asset Allocation,Asset Allocation & Strategy,Senior PM,Interview
T. Rowe Price,A key stock holding drops 25% on earnings miss but fundamentals remain strong. Do you buy more or reduce exposure?,Mid,Investment Research,Investment Analysis & Research,Associate,Interview
Wellington,Your ESG-focused fund is being pressured to divest from a profitable energy position. How do you handle this?,Senior,Portfolio Management,Portfolio Construction & Management,Portfolio Manager,Interview
Capital Group,Clients are questioning why your actively managed fund charges higher fees than passive alternatives. Your response?,Mid,Client Relations,Client Relationship Management,Associate,Interview
Invesco,You're launching a new thematic ETF but initial investor interest is lukewarm. What adjustments would you make?,Senior,Product Development,Product Development & Management,Director,Interview
Franklin Templeton,Your emerging markets fund is facing significant redemptions due to geopolitical tensions. How do you manage liquidity?,Senior,Risk Management,Risk Assessment & Management,Senior PM,Interview
BlackRock,A pension fund client wants to increase their private equity allocation from 5% to 15%. What factors do you consider?,Senior,Asset Allocation,Asset Allocation & Strategy,Senior PM,Interview
Vanguard,Your index fund is tracking error is 15bps higher than target. What steps do you take to investigate and correct this?,Mid,Performance Analysis,Performance Measurement & Attribution,Associate,Interview
Fidelity,A high-net-worth client inherited $50M and wants aggressive growth. How do you construct their portfolio?,Mid,Portfolio Management,Portfolio Construction & Management,Portfolio Manager,Interview
State Street,Your factor-based strategy is underperforming due to momentum reversals. How do you explain this to the investment committee?,Senior,Market Analysis,Market Research & Analysis,Senior PM,Interview
PIMCO,Credit spreads are tightening but you see recession signals. How do you position your credit portfolio?,Senior,Investment Research,Investment Analysis & Research,Portfolio Manager,Interview
T. Rowe Price,Your healthcare fund missed a major biotech rally. How do you prevent similar misses going forward?,Mid,Performance Analysis,Performance Measurement & Attribution,Associate,Interview
Wellington,A corporate pension client is considering liability-driven investing. Walk me through your recommendation process.,Senior,Asset Allocation,Asset Allocation & Strategy,Senior PM,Interview
Capital Group,Your team disagrees on whether to overweight tech stocks. How do you reach a consensus?,Mid,Portfolio Management,Portfolio Construction & Management,Portfolio Manager,Interview
Invesco,Regulatory changes require new reporting for your alternative investment products. How do you ensure compliance?,Senior,Risk Management,Regulatory & Compliance Knowledge,Director,Interview
Franklin Templeton,Your global equity fund has significant currency exposure. How do you decide on hedging strategies?,Senior,Risk Management,Risk Assessment & Management,Portfolio Manager,Interview
General,You notice unusual trading volume in one of your holdings before earnings. How do you investigate and respond?,Mid,Risk Management,Risk Assessment & Management,Associate,Interview
General,A client's risk tolerance has changed after a major life event. How do you adjust their investment strategy?,Mid,Client Relations,Client Relationship Management,Associate,Interview
General,Your sector rotation model is suggesting a move from growth to value. How do you implement this transition?,Senior,Portfolio Management,Portfolio Construction & Management,Senior PM,Interview
General,Performance attribution shows your stock selection added value but sector allocation detracted. What's your next move?,Mid,Performance Analysis,Performance Measurement & Attribution,Associate,Interview
General,Interest rate volatility is affecting your bond duration strategy. How do you adapt your approach?,Senior,Risk Management,Risk Assessment & Management,Portfolio Manager,Interview
BlackRock,Your iShares ETF is experiencing tracking error due to sampling methodology. How do you address this?,Senior,Product Development,Product Development & Management,Director,Interview
Vanguard,A client questions why your fund holds cash during a bull market. How do you justify this position?,Junior,Portfolio Management,Portfolio Construction & Management,Analyst,Interview
Fidelity,Your sector fund is heavily concentrated in five stocks. How do you manage concentration risk?,Mid,Risk Management,Risk Assessment & Management,Associate,Interview
State Street,Asset flows into your SPDR are accelerating. How do you manage the cash deployment efficiently?,Mid,Portfolio Management,Portfolio Construction & Management,Associate,Interview
PIMCO,Your total return strategy needs to adapt to a prolonged low-rate environment. What changes do you make?,Senior,Asset Allocation,Asset Allocation & Strategy,Senior PM,Interview
T. Rowe Price,A growth stock you own is becoming a value stock. Do you hold or sell based on your mandate?,Mid,Portfolio Management,Portfolio Construction & Management,Portfolio Manager,Interview
Wellington,Your long-only equity fund wants exposure to a secular decline theme. How do you implement this?,Senior,Investment Research,Investment Analysis & Research,Portfolio Manager,Interview
Capital Group,Client assets are growing faster than your research team. How do you maintain investment quality?,Senior,Portfolio Management,Portfolio Construction & Management,Director,Interview
Invesco,Your smart beta strategy is underperforming traditional cap-weighted indices. How do you communicate this?,Mid,Client Relations,Client Relationship Management,Associate,Interview
Franklin Templeton,Emerging market currencies are under pressure. How does this affect your local currency bond strategy?,Senior,Market Analysis,Market Research & Analysis,Senior PM,Interview
General,Your quantitative model shows a buy signal but your fundamental analysis disagrees. How do you decide?,Senior,Investment Research,Investment Analysis & Research,Portfolio Manager,Interview
General,A major client wants monthly performance reporting instead of quarterly. How do you accommodate this?,Junior,Client Relations,Client Relationship Management,Analyst,Interview
General,Your fund's Sharpe ratio is declining despite positive returns. What factors are you examining?,Mid,Performance Analysis,Performance Measurement & Attribution,Associate,Interview
General,Risk parity principles suggest reducing equity exposure but you're bullish on stocks. Your approach?,Senior,Asset Allocation,Asset Allocation & Strategy,Senior PM,Interview
General,A compliance audit reveals minor trade reporting discrepancies. How do you address and prevent recurrence?,Mid,Risk Management,Regulatory & Compliance Knowledge,Associate,Interview
BlackRock,Your target-date fund glide path is being questioned by plan sponsors. How do you defend your methodology?,Senior,Product Development,Product Development & Management,Director,Interview
Vanguard,Cost pressures require reducing your fund's expense ratio. Where do you look for savings without compromising performance?,Senior,Portfolio Management,Portfolio Construction & Management,Director,Interview
Fidelity,Your international fund is facing headwinds from dollar strength. How do you position for various currency scenarios?,Senior,Market Analysis,Market Research & Analysis,Portfolio Manager,Interview
State Street,Institutional clients want more customized indexing solutions. How do you develop these capabilities?,Senior,Product Development,Product Development & Management,Director,Interview
PIMCO,Your macro outlook differs significantly from consensus. How do you express this view in your portfolio?,Senior,Investment Research,Investment Analysis & Research,Senior PM,Interview
T. Rowe Price,A key analyst is leaving your team during a critical investment period. How do you manage this transition?,Mid,Portfolio Management,Portfolio Construction & Management,Portfolio Manager,Interview
Wellington,Your private wealth clients want access to institutional strategies. How do you adapt these for smaller accounts?,Senior,Product Development,Product Development & Management,Director,Interview
Capital Group,Performance fees are under regulatory scrutiny. How would you modify your fee structure?,Senior,Client Relations,Regulatory & Compliance Knowledge,Director,Interview
Invesco,Your thematic investing approach needs validation with academic research. How do you build this credibility?,Senior,Investment Research,Investment Analysis & Research,Senior PM,Interview
Franklin Templeton,Geopolitical events are creating volatility in your regional strategies. How do you manage client expectations?,Mid,Client Relations,Client Relationship Management,Associate,Interview
General,Your benchmark is changing next quarter. How do you prepare your portfolio and communicate to clients?,Mid,Portfolio Management,Portfolio Construction & Management,Associate,Interview
General,A new ESG regulation affects 40% of your holdings. What's your implementation timeline?,Senior,Risk Management,Regulatory & Compliance Knowledge,Portfolio Manager,Interview
General,Your five-year track record shows strong performance but recent results are weak. How do you frame this narrative?,Mid,Client Relations,Performance Measurement & Attribution,Associate,Interview
General,Machine learning models suggest a factor you've never used. How do you evaluate and potentially implement it?,Senior,Investment Research,Quantitative Analysis & Modeling,Senior PM,Interview
General,Client demand is shifting toward sustainable investing. How do you evolve your product lineup?,Senior,Product Development,Product Development & Management,Director,Interview
BlackRock,Your Aladdin risk system shows elevated portfolio risk. How do you interpret and act on these signals?,Senior,Risk Management,Risk Assessment & Management,Portfolio Manager,Interview
Vanguard,Index methodology changes will affect three of your funds. How do you manage the transition?,Mid,Portfolio Management,Portfolio Construction & Management,Associate,Interview
Fidelity,Your active share is declining while tracking error remains constant. What does this tell you about your strategy?,Senior,Performance Analysis,Performance Measurement & Attribution,Portfolio Manager,Interview
State Street,A major pension fund wants you to overlay their liability data with your asset management. Your approach?,Senior,Asset Allocation,Asset Allocation & Strategy,Senior PM,Interview
PIMCO,Your duration positioning profited from rate moves but credit selection lost money. How do you rebalance these sources of return?,Senior,Portfolio Management,Performance Measurement & Attribution,Senior PM,Interview
T. Rowe Price,Small-cap stocks are experiencing a liquidity crunch. How does this affect your investment and redemption policies?,Senior,Risk Management,Risk Assessment & Management,Portfolio Manager,Interview
Wellington,Your long-term investment horizon conflicts with quarterly performance pressures. How do you manage this tension?,Senior,Client Relations,Client Relationship Management,Senior PM,Interview
Capital Group,Multiple portfolio managers have different views on the same stock. How do you reconcile these for a unified position?,Senior,Portfolio Management,Portfolio Construction & Management,Director,Interview
Invesco,Your factor exposure analysis shows unintended bets. How do you identify the source and correct them?,Senior,Risk Management,Quantitative Analysis & Modeling,Portfolio Manager,Interview
Franklin Templeton,Currency hedging costs are impacting your international fund returns. When do you accept this cost versus the risk?,Senior,Risk Management,Risk Assessment & Management,Portfolio Manager,Interview
General,Your investment thesis on a major holding is proving wrong. At what point do you admit the mistake and exit?,Mid,Investment Research,Investment Analysis & Research,Associate,Interview
General,A client wants to time the market based on their political views. How do you counsel them?,Junior,Client Relations,Client Relationship Management,Analyst,Interview
General,Your portfolio construction process is taking too long in volatile markets. How do you balance speed versus thorough analysis?,Mid,Portfolio Management,Portfolio Construction & Management,Associate,Interview
General,Risk budgeting shows you're using too much risk on one position. How do you reallocate effectively?,Senior,Risk Management,Risk Assessment & Management,Portfolio Manager,Interview
General,Your performance attribution system shows style drift. How do you investigate and address this?,Mid,Performance Analysis,Performance Measurement & Attribution,Associate,Interview
BlackRock,ETF creation and redemption flows are affecting your underlying portfolio management. How do you optimize this process?,Senior,Portfolio Management,Product Development & Management,Portfolio Manager,Interview
Vanguard,Your admiral shares fund is approaching capacity constraints. What options do you consider?,Senior,Product Development,Portfolio Construction & Management,Director,Interview
Fidelity,Technology disruption is affecting multiple holdings in your portfolio. How do you assess which companies will survive?,Senior,Investment Research,Investment Analysis & Research,Portfolio Manager,Interview
State Street,Your multi-asset strategy needs rebalancing but transaction costs are high. How do you optimize the timing?,Mid,Portfolio Management,Portfolio Construction & Management,Associate,Interview
PIMCO,Your unconstrained bond strategy is being compared to traditional benchmarks. How do you communicate its unique value?,Mid,Client Relations,Product Development & Management,Associate,Interview
T. Rowe Price,Demographic trends are shifting in favor of your target-date funds. How do you scale operations to meet demand?,Senior,Product Development,Portfolio Construction & Management,Director,Interview
Wellington,Your institutional client wants to modify their investment guidelines mid-cycle. How do you evaluate and implement this?,Senior,Client Relations,Portfolio Construction & Management,Senior PM,Interview
Capital Group,Cross-trading opportunities exist between your different fund strategies. How do you ensure fair allocation?,Senior,Risk Management,Regulatory & Compliance Knowledge,Portfolio Manager,Interview
Invesco,Your PowerShares merger requires consolidating overlapping strategies. How do you manage this transition?,Senior,Product Development,Portfolio Construction & Management,Director,Interview
Franklin Templeton,Your emerging markets debt strategy faces local political instability. How do you adjust country weightings?,Senior,Market Analysis,Risk Assessment & Management,Portfolio Manager,Interview
General,Your sector allocation model suggests overweighting a declining industry. How do you reconcile this signal?,Mid,Investment Research,Market Research & Analysis,Associate,Interview
General,A key supplier to multiple portfolio companies faces bankruptcy. How do you assess the downstream impact?,Senior,Investment Research,Risk Assessment & Management,Portfolio Manager,Interview
General,Your fund's tax efficiency is being challenged by increased turnover. How do you balance performance with tax considerations?,Senior,Portfolio Management,Portfolio Construction & Management,Portfolio Manager,Interview
General,Alternative data sources conflict with traditional fundamental analysis. How do you weight these different inputs?,Senior,Investment Research,Quantitative Analysis & Modeling,Senior PM,Interview
General,Client flows are becoming more volatile and harder to predict. How do you adjust your liquidity management?,Senior,Risk Management,Risk Assessment & Management,Portfolio Manager,Interview
BlackRock,Your factor ETF lineup needs expansion but the market is crowded. How do you identify white space opportunities?,Senior,Product Development,Market Research & Analysis,Director,Interview
Vanguard,Cost competition is intensifying in passive management. How do you maintain margins while staying competitive?,Senior,Product Development,Portfolio Construction & Management,Director,Interview
Fidelity,Your sector research team identifies a disruptive technology trend. How do you translate this into investable strategies?,Senior,Investment Research,Product Development & Management,Senior PM,Interview
State Street,Fiduciary rule changes affect how you can communicate with retirement plan participants. How do you adapt?,Senior,Client Relations,Regulatory & Compliance Knowledge,Director,Interview
PIMCO,Your macro research suggests a regime change in monetary policy. How do you position your entire fixed income platform?,Staff,Asset Allocation,Asset Allocation & Strategy,Managing Director,Interview
T. Rowe Price,International expansion requires adapting your investment process to different regulatory environments. Your approach?,Senior,Product Development,Regulatory & Compliance Knowledge,Director,Interview
Wellington,Your client advisory board suggests product modifications that conflict with your investment philosophy. How do you respond?,Senior,Client Relations,Portfolio Construction & Management,Senior PM,Interview
Capital Group,Multiple generations of the same family have different investment preferences. How do you serve both?,Senior,Client Relations,Asset Allocation & Strategy,Senior PM,Interview
Invesco,Your QQQ ETF faces competition from similar products with lower fees. How do you defend market share?,Senior,Product Development,Client Relationship Management,Director,Interview
Franklin Templeton,Your global equity strategy shows home country bias despite international mandate. How do you address this?,Mid,Portfolio Management,Portfolio Construction & Management,Associate,Interview
General,Behavioral finance research suggests your clients are making suboptimal decisions. How do you guide them without being paternalistic?,Mid,Client Relations,Client Relationship Management,Associate,Interview
General,Your investment committee is split on a major allocation decision. How do you build consensus or make a tie-breaking decision?,Senior,Portfolio Management,Portfolio Construction & Management,Director,Interview
General,Regulatory stress testing reveals vulnerabilities in your portfolio under extreme scenarios. What's your response plan?,Senior,Risk Management,Risk Assessment & Management,Portfolio Manager,Interview
General,Your fund's marketing materials need updating to reflect performance changes. How do you ensure accuracy while maintaining appeal?,Mid,Client Relations,Performance Measurement & Attribution,Associate,Interview
General,Environmental factors are affecting companies in ways traditional analysis doesn't capture. How do you evolve your research process?,Senior,Investment Research,Investment Analysis & Research,Portfolio Manager,Interview
BlackRock,Your multi-manager platform needs better risk oversight across different investment styles. How do you implement this?,Senior,Risk Management,Risk Assessment & Management,Director,Interview
Vanguard,Index fund shareholders want more say in proxy voting decisions. How do you balance efficiency with engagement?,Senior,Product Development,Regulatory & Compliance Knowledge,Director,Interview
Fidelity,Your target-date fund series needs customization for different plan demographics. How do you approach this segmentation?,Senior,Product Development,Asset Allocation & Strategy,Director,Interview
State Street,Your custody and investment management businesses have conflicting client interests. How do you manage these tensions?,Staff,Client Relations,Regulatory & Compliance Knowledge,Managing Director,Interview
PIMCO,Your total return fund strategy needs to evolve for a post-QE environment. What fundamental changes do you consider?,Staff,Asset Allocation,Asset Allocation & Strategy,Managing Director,Interview
T. Rowe Price,Direct indexing technology allows for more customization but increases complexity. How do you evaluate this trade-off?,Senior,Product Development,Portfolio Construction & Management,Director,Interview
Wellington,Your long-term partnership structure affects how you compete for institutional mandates. How do you leverage this differentiator?,Senior,Client Relations,Client Relationship Management,Director,Interview
Capital Group,The American Funds distribution model faces pressure from fee-based advisors. How do you adapt?,Senior,Product Development,Client Relationship Management,Director,Interview
Invesco,Your real estate investment platform needs expansion but faces rising interest rate headwinds. Your strategic approach?,Senior,Product Development,Market Research & Analysis,Director,Interview
Franklin Templeton,Your fixed income franchise needs to compete with both passive and alternative strategies. How do you position this?,Senior,Product Development,Asset Allocation & Strategy,Director,Interview
General,Your firm is considering entering the private markets space. How do you evaluate this strategic decision?,Staff,Product Development,Market Research & Analysis,Managing Director,Interview
General,Artificial intelligence is changing investment research. How do you integrate these tools while maintaining investment discipline?,Senior,Investment Research,Quantitative Analysis & Modeling,Senior PM,Interview
General,Your star portfolio manager wants to leave to start a hedge fund. How do you manage this transition and retain assets?,Senior,Client Relations,Portfolio Construction & Management,Director,Interview
General,Cross-border regulatory compliance is increasing costs. How do you maintain global investment capabilities efficiently?,Senior,Risk Management,Regulatory & Compliance Knowledge,Director,Interview
General,Your investment philosophy worked well for 20 years but recent performance lags. When do you consider fundamental changes?,Staff,Investment Research,Portfolio Construction & Management,Managing Director,Interview
BlackRock,Your Aladdin technology platform faces competition from fintech startups. How do you maintain your technological edge?,Staff,Product Development,Quantitative Analysis & Modeling,Managing Director,Interview
Vanguard,Your mutual ownership structure affects decision-making speed compared to public competitors. How do you optimize this?,Staff,Product Development,Portfolio Construction & Management,Managing Director,Interview
Fidelity,Your retail brokerage and asset management businesses have synergies but also conflicts. How do you manage both?,Staff,Client Relations,Product Development & Management,Managing Director,Interview
State Street,Your institutional focus limits retail market share growth. How do you evaluate expansion opportunities?,Staff,Product Development,Market Research & Analysis,Managing Director,Interview
PIMCO,Your fixed income expertise needs to expand into other asset classes. How do you build credibility in new markets?,Staff,Product Development,Investment Analysis & Research,Managing Director,Interview
General,The investment management industry is consolidating. How do you position your firm for long-term competitiveness?,Staff,Product Development,Market Research & Analysis,Managing Director,Interview
General,Your clients want more transparency but also competitive advantages. How do you balance these conflicting demands?,Senior,Client Relations,Client Relationship Management,Director,Interview
General,Environmental and social factors are becoming financially material. How do you integrate these into traditional investment analysis?,Senior,Investment Research,Investment Analysis & Research,Portfolio Manager,Interview
General,Your younger analysts have different perspectives on market structure than senior portfolio managers. How do you leverage this diversity?,Mid,Portfolio Management,Portfolio Construction & Management,Associate,Interview
General,Technology is enabling more frequent portfolio rebalancing but also increasing transaction costs. How do you optimize this trade-off?,Senior,Portfolio Management,Quantitative Analysis & Modeling,Portfolio Manager,Interview
BlackRock,Your passive strategies need to incorporate ESG factors without sacrificing tracking efficiency. How do you approach this challenge?,Senior,Product Development,Portfolio Construction & Management,Director,Interview
Vanguard,Your low-cost strategy is being challenged by zero-fee competitors. How do you maintain your value proposition?,Senior,Product Development,Client Relationship Management,Director,Interview
Fidelity,Your active management approach needs to justify fees in an increasingly passive world. What's your differentiation strategy?,Senior,Product Development,Performance Measurement & Attribution,Director,Interview
