company,question,difficulty,question_type,skills_assessed,im_level,source
State Street,Your ETF business competes with your index fund business for the same assets. How do you manage this internal competition?,Senior,Product Development,Portfolio Construction & Management,Director,Interview
PIMCO,Your bond strategies face pressure from both passive indexing and private credit. How do you position your active approach?,Senior,Product Development,Asset Allocation & Strategy,Director,Interview
T. Rowe Price,Your growth-oriented investment style faces headwinds in a value-favoring market. How do you maintain client confidence?,Senior,Client Relations,Performance Measurement & Attribution,Senior PM,Interview
Wellington,Your partnership model affects recruitment and retention of top talent. How do you compete with higher-paying alternatives?,Senior,Portfolio Management,Client Relationship Management,Director,Interview
Capital Group,Your multi-manager approach requires coordination across different investment teams. How do you ensure consistency?,Senior,Portfolio Management,Portfolio Construction & Management,Director,Interview
Invesco,Your factor-based strategies need to differentiate from increasingly commoditized smart beta offerings. Your approach?,Senior,Product Development,Quantitative Analysis & Modeling,Director,Interview
Franklin Templeton,Your international emerging markets expertise faces home market bias from U.S. investors. How do you address this?,Senior,Client Relations,Market Research & Analysis,Director,Interview
General,Your investment committee process slows decision-making in fast-moving markets. How do you balance governance with agility?,Senior,Portfolio Management,Portfolio Construction & Management,Director,Interview
General,Your fund company is considering launching cryptocurrency products. How do you evaluate the risks and opportunities?,Senior,Product Development,Risk Assessment & Management,Director,Interview
General,Your traditional long-only strategies face competition from long-short and alternative approaches. How do you evolve your offerings?,Senior,Product Development,Asset Allocation & Strategy,Director,Interview
General,Your performance measurement systems need upgrading to handle alternative investments. What capabilities do you prioritize?,Senior,Performance Analysis,Quantitative Analysis & Modeling,Director,Interview
General,Your client base is aging and starting to withdraw assets. How do you adjust your business model for this demographic shift?,Senior,Client Relations,Asset Allocation & Strategy,Director,Interview
BlackRock,Your index methodology faces criticism for concentration in mega-cap stocks. How do you address these concerns?,Senior,Product Development,Risk Assessment & Management,Director,Interview
Vanguard,Your advisor-sold funds compete with your direct-to-consumer offerings. How do you manage these different distribution channels?,Senior,Product Development,Client Relationship Management,Director,Interview
Fidelity,Your workplace retirement platform needs integration with your investment management capabilities. How do you optimize this synergy?,Senior,Product Development,Portfolio Construction & Management,Director,Interview
State Street,Your global footprint requires consistent investment processes across different regulatory jurisdictions. Your implementation approach?,Senior,Risk Management,Regulatory & Compliance Knowledge,Director,Interview
PIMCO,Your macro-driven approach requires forecasting skills that may not persist across market cycles. How do you manage this dependency?,Senior,Investment Research,Risk Assessment & Management,Senior PM,Interview
T. Rowe Price,Your fundamental research process needs to incorporate alternative data sources. How do you maintain research quality while innovating?,Senior,Investment Research,Quantitative Analysis & Modeling,Senior PM,Interview
Wellington,Your client relationships span multiple generations and market cycles. How do you maintain consistency while adapting to changes?,Senior,Client Relations,Client Relationship Management,Senior PM,Interview
Capital Group,Your bottom-up stock selection needs to consider top-down macro factors. How do you integrate these different approaches?,Senior,Portfolio Management,Investment Analysis & Research,Portfolio Manager,Interview
Invesco,Your ETF innovation requires balancing complexity with investor understanding. How do you launch sophisticated products successfully?,Senior,Product Development,Client Relationship Management,Director,Interview
Franklin Templeton,Your value investment approach needs adaptation for markets dominated by intangible assets. How do you evolve your methodology?,Senior,Investment Research,Investment Analysis & Research,Portfolio Manager,Interview
General,Your risk management systems need to account for climate-related financial risks. How do you incorporate these long-term uncertainties?,Senior,Risk Management,Risk Assessment & Management,Portfolio Manager,Interview
General,Your investment team culture affects decision-making quality. How do you foster productive debate while maintaining team cohesion?,Mid,Portfolio Management,Portfolio Construction & Management,Associate,Interview
General,Your client advisory process reveals conflicting feedback about product needs. How do you prioritize development resources?,Senior,Product Development,Client Relationship Management,Director,Interview
General,Your competitive analysis shows gaps in your product lineup versus rivals. How do you decide which gaps to fill first?,Senior,Product Development,Market Research & Analysis,Director,Interview
General,Your investment philosophy emphasizes long-term thinking but clients want quarterly explanations. How do you bridge this gap?,Mid,Client Relations,Client Relationship Management,Associate,Interview
BlackRock,Your factor model shows style drift in what should be a neutral strategy. How do you diagnose and correct this issue?,Senior,Risk Management,Quantitative Analysis & Modeling,Portfolio Manager,Interview
Vanguard,Your index fund needs to handle a large merger in its benchmark. How do you manage the transition efficiently?,Mid,Portfolio Management,Portfolio Construction & Management,Associate,Interview
Fidelity,Your sector fund methodology requires updates to reflect industry evolution. How do you implement changes without disrupting performance?,Senior,Portfolio Management,Product Development & Management,Portfolio Manager,Interview
State Street,Your institutional client wants custom benchmark creation for their unique liability profile. Your development approach?,Senior,Product Development,Asset Allocation & Strategy,Senior PM,Interview
PIMCO,Your unconstrained strategy has freedom to invest globally but clients want regional allocations explained. How do you communicate this?,Mid,Client Relations,Portfolio Construction & Management,Associate,Interview
T. Rowe Price,Your emerging markets strategy needs to address governance concerns without sacrificing return potential. Your framework?,Senior,Investment Research,Risk Assessment & Management,Portfolio Manager,Interview
Wellington,Your equity income strategy faces yield pressure in a low-rate environment. How do you maintain income while managing risk?,Senior,Portfolio Management,Asset Allocation & Strategy,Portfolio Manager,Interview
Capital Group,Your international strategy needs currency hedging decisions that affect multiple underlying managers. How do you coordinate this?,Senior,Risk Management,Portfolio Construction & Management,Senior PM,Interview
Invesco,Your momentum factor strategy faces criticism during reversals. How do you explain the temporary underperformance to clients?,Mid,Client Relations,Performance Measurement & Attribution,Associate,Interview
Franklin Templeton,Your municipal bond strategy needs to address credit concerns in certain states. How do you adjust geographic exposure?,Senior,Risk Management,Investment Analysis & Research,Portfolio Manager,Interview
General,Your small-cap strategy shows capacity constraints as assets grow. At what point do you close the fund to new investors?,Senior,Portfolio Management,Risk Assessment & Management,Portfolio Manager,Interview
General,Your international developed markets fund needs to address concentration in a few large companies. Your diversification approach?,Mid,Risk Management,Portfolio Construction & Management,Associate,Interview
General,Your multi-asset strategy requires coordination between different asset class specialists. How do you ensure optimal allocation decisions?,Senior,Portfolio Management,Asset Allocation & Strategy,Senior PM,Interview
General,Your investment process documentation needs updating for regulatory requirements. How do you maintain consistency during this transition?,Mid,Risk Management,Regulatory & Compliance Knowledge,Associate,Interview
General,Your performance reporting needs enhancement to meet sophisticated institutional client demands. What capabilities do you add first?,Senior,Performance Analysis,Performance Measurement & Attribution,Director,Interview
BlackRock,Your target-date series needs customization for different plan sponsor preferences while maintaining economies of scale. Your solution?,Senior,Product Development,Asset Allocation & Strategy,Director,Interview
Vanguard,Your balanced fund approach requires regular rebalancing that affects tax efficiency. How do you optimize this trade-off?,Mid,Portfolio Management,Portfolio Construction & Management,Associate,Interview
Fidelity,Your technology sector fund needs to address disruption risks while maintaining growth exposure. Your risk management approach?,Senior,Risk Management,Investment Analysis & Research,Portfolio Manager,Interview
State Street,Your SPDR brand faces competition from lower-cost alternatives. How do you defend market share while maintaining profitability?,Senior,Product Development,Client Relationship Management,Director,Interview
PIMCO,Your global bond strategy requires duration positioning across different yield curves. How do you coordinate these decisions?,Senior,Portfolio Management,Risk Assessment & Management,Portfolio Manager,Interview
General,Your responsible investing strategy needs measurement frameworks that go beyond traditional financial metrics. Your approach?,Senior,Investment Research,Performance Measurement & Attribution,Portfolio Manager,Interview
General,Your liquid alternatives strategy must explain why it's better than traditional hedge funds. How do you articulate this value proposition?,Senior,Product Development,Client Relationship Management,Director,Interview
General,Your retirement income strategy needs to balance longevity risk with sequence of returns risk. How do you optimize this?,Senior,Asset Allocation,Risk Assessment & Management,Senior PM,Interview
General,Your factor investing approach requires explaining why certain factors work better in different market environments. Your framework?,Senior,Investment Research,Quantitative Analysis & Modeling,Portfolio Manager,Interview
General,Your direct indexing platform needs to balance customization with operational efficiency. How do you scale this effectively?,Senior,Product Development,Portfolio Construction & Management,Director,Interview