company,question,difficulty,question_type,skills_assessed,mfg_ops_level,source
General,"Rapid market changes require manufacturing flexibility you don't currently possess. How do you build this capability?",Staff,Production Planning,Operations Optimization & Efficiency,VP Operations,Industry Knowledge
General,"Your plant's competitive position erodes due to lower-cost international competitors. How do you respond strategically?",Staff,Cost Management,Operations Optimization & Efficiency,VP Operations,Industry Knowledge
General,"Industry 4.0 technologies promise transformation but your workforce lacks digital skills. How do you address this gap?",Senior,Automation & Technology,Workforce Management & Leadership,Plant Manager,Industry Knowledge
General,"Your manufacturing strategy must align with corporate sustainability goals requiring operational changes. How do you integrate these?",Staff,Operations Optimization,Operations Optimization & Efficiency,VP Operations,Industry Knowledge
Tesla,"Your Supercharger manufacturing line shows 60% efficiency due to new connector design complexity. How do you improve this?",Mid,Production Planning,Production Planning & Scheduling,Operations Manager,Industry Knowledge
Toyota,"Your hybrid battery pack assembly requires 100% quality with zero defects. How do you achieve this level of perfection?",Senior,Operations Optimization,Performance Metrics & Analytics,Plant Manager,Industry Knowledge
Ford,"Your electric vehicle plant startup faces integration challenges between legacy and new technologies. How do you manage this?",Staff,Automation & Technology,Automation & Technology Integration,VP Operations,Industry Knowledge
Boeing,"Your composite wing manufacturing shows 30% cycle time variation between identical parts. How do you standardize this?",Senior,Lean Manufacturing,Lean Manufacturing & Continuous Improvement,Senior Manager,Industry Knowledge
Intel,"Your advanced node semiconductor process requires 99.9% uptime. How do you achieve this level of reliability?",Staff,Equipment Management,Equipment Management & Maintenance,VP Operations,Industry Knowledge