company,question,difficulty,question_type,skills_assessed,mfg_ops_level,source
Tesla,"Your Model 3 production line is hitting 80% of target due to battery pack assembly bottlenecks. How do you resolve this?",Senior,Production Planning,Production Planning & Scheduling,Plant Manager,Industry Knowledge
Tesla,"Gigafactory workers report repetitive strain injuries are increasing with the new assembly process. What's your immediate response?",Mid,Safety & Compliance,Safety Management & Compliance,Operations Manager,Industry Knowledge
Tesla,"Battery cell suppliers just delayed shipments by 2 weeks during peak production quarter. How do you maintain delivery targets?",Staff,Operations Optimization,Supply Chain Coordination,VP Operations,Industry Knowledge
Tesla,"Your quality team finds 5% defect rate in new 4680 battery cells affecting performance. How do you handle this crisis?",Senior,Equipment Management,Performance Metrics & Analytics,Senior Manager,Industry Knowledge
Tesla,"Elon pushes for 24/7 production but your maintenance team says equipment needs downtime. How do you balance this?",Staff,Workforce Management,Equipment Management & Maintenance,VP Operations,Industry Knowledge
Toyota,"Your just-in-time system breaks down when a key supplier faces a natural disaster. What's your contingency plan?",Senior,Operations Optimization,Supply Chain Coordination,Plant Manager,Industry Knowledge
Toyota,"Line workers suggest a kaizen improvement that could save 30 seconds per vehicle but requires $2M investment. How do you evaluate this?",Mid,Lean Manufacturing,Lean Manufacturing & Continuous Improvement,Operations Manager,Industry Knowledge
Toyota,"Quality circles identify a recurring paint defect affecting 3% of vehicles. How do you implement a permanent solution?",Senior,Operations Optimization,Performance Metrics & Analytics,Senior Manager,Industry Knowledge
Toyota,"Your Prius production line must switch to new hybrid technology while maintaining current output. How do you manage this transition?",Staff,Automation & Technology,Automation & Technology Integration,VP Operations,Industry Knowledge
Toyota,"Cultural resistance emerges when implementing Toyota Production System at a newly acquired plant. How do you address this?",Staff,Workforce Management,Workforce Management & Leadership,VP Operations,Industry Knowledge
General Motors,"Your Chevy Silverado line faces a 40% efficiency drop after automation upgrade. How do you diagnose and fix this?",Senior,Automation & Technology,Automation & Technology Integration,Plant Manager,Industry Knowledge
General Motors,"Union representatives reject overtime during peak truck demand season. How do you meet production targets?",Senior,Workforce Management,Workforce Management & Leadership,Senior Manager,Industry Knowledge
General Motors,"A critical stamping press fails during high-demand period with 4-week repair timeline. What's your approach?",Mid,Equipment Management,Equipment Management & Maintenance,Operations Manager,Industry Knowledge
General Motors,"Cost pressures require 15% reduction in manufacturing expenses without affecting quality. How do you achieve this?",Staff,Cost Management,Cost Control & Budget Management,VP Operations,Industry Knowledge
General Motors,"Your electric vehicle battery assembly shows inconsistent performance in quality testing. How do you resolve this?",Senior,Production Planning,Performance Metrics & Analytics,Plant Manager,Industry Knowledge
Ford,"F-150 Lightning production ramp-up faces semiconductor shortages affecting 30% of planned output. How do you adapt?",Staff,Operations Optimization,Supply Chain Coordination,VP Operations,Industry Knowledge
Ford,"Your Rouge plant workers report safety concerns with new aluminum body welding process. How do you respond?",Mid,Safety & Compliance,Safety Management & Compliance,Operations Manager,Industry Knowledge
Ford,"Mustang production line needs retooling for new model while maintaining current production. How do you plan this?",Senior,Production Planning,Production Planning & Scheduling,Senior Manager,Industry Knowledge
Ford,"Quality metrics show increasing warranty claims from your Kansas City plant. How do you investigate and improve?",Senior,Operations Optimization,Performance Metrics & Analytics,Plant Manager,Industry Knowledge
Ford,"Supplier quality issues force you to increase incoming inspection by 300%. How do you manage this without delays?",Mid,Equipment Management,Supply Chain Coordination,Operations Manager,Industry Knowledge
Boeing,"787 Dreamliner assembly faces delays due to supplier part quality issues. How do you recover the schedule?",Staff,Operations Optimization,Supply Chain Coordination,VP Operations,Industry Knowledge
Boeing,"Your composite manufacturing process shows 15% scrap rate increase. How do you identify and eliminate root causes?",Senior,Lean Manufacturing,Lean Manufacturing & Continuous Improvement,Plant Manager,Industry Knowledge
Boeing,"FAA inspection reveals non-compliance in your quality control process. How do you address this immediately?",Staff,Safety & Compliance,Safety Management & Compliance,VP Operations,Industry Knowledge
Boeing,"Commercial aircraft demand drops 50% requiring production adjustment. How do you manage workforce and capacity?",Staff,Workforce Management,Workforce Management & Leadership,VP Operations,Industry Knowledge
Boeing,"Your final assembly line efficiency drops due to increased customization requests. How do you optimize this?",Senior,Production Planning,Production Planning & Scheduling,Senior Manager,Industry Knowledge
General Electric,"Your jet engine manufacturing cell shows declining productivity after lean implementation. How do you troubleshoot?",Senior,Lean Manufacturing,Lean Manufacturing & Continuous Improvement,Plant Manager,Industry Knowledge
General Electric,"Critical turbine blade inspection equipment fails during peak production. How do you maintain quality and output?",Mid,Equipment Management,Equipment Management & Maintenance,Operations Manager,Industry Knowledge
General Electric,"New additive manufacturing process for engine components shows 20% defect rate. How do you improve this?",Senior,Automation & Technology,Automation & Technology Integration,Senior Manager,Industry Knowledge
General Electric,"Customer complaints about turbine reliability force production halt for investigation. How do you manage this crisis?",Staff,Operations Optimization,Performance Metrics & Analytics,VP Operations,Industry Knowledge
General Electric,"Your skilled machinists are retiring and new hires lack experience. How do you maintain production quality?",Senior,Workforce Management,Workforce Management & Leadership,Plant Manager,Industry Knowledge
Intel,"Your semiconductor fab line yields drop to 60% after process change. How do you restore performance quickly?",Staff,Operations Optimization,Performance Metrics & Analytics,VP Operations,Industry Knowledge
Intel,"Cleanroom contamination shuts down production for 48 hours. How do you minimize impact and prevent recurrence?",Senior,Safety & Compliance,Safety Management & Compliance,Plant Manager,Industry Knowledge
Intel,"New chip architecture requires equipment upgrades costing $500M. How do you justify and plan this investment?",Staff,Cost Management,Cost Control & Budget Management,VP Operations,Industry Knowledge
Intel,"Your photolithography tools show increasing variation affecting chip performance. How do you solve this?",Senior,Equipment Management,Equipment Management & Maintenance,Senior Manager,Industry Knowledge
Intel,"Advanced packaging line automation fails frequently, reducing output by 25%. How do you improve reliability?",Senior,Automation & Technology,Automation & Technology Integration,Plant Manager,Industry Knowledge
Apple,"iPhone assembly partner reports 30% efficiency drop after design change. How do you support improvement?",Senior,Operations Optimization,Operations Optimization & Efficiency,Senior Manager,Industry Knowledge
Apple,"Quality audits reveal inconsistent standards across three supplier facilities. How do you standardize processes?",Mid,Operations Optimization,Performance Metrics & Analytics,Operations Manager,Industry Knowledge
Apple,"Your premium product launch faces component shortages 2 weeks before release. How do you ensure on-time delivery?",Staff,Supply Chain Coordination,Supply Chain Coordination,VP Operations,Industry Knowledge
Apple,"Supplier factory workers strike during peak production season. How do you maintain supply continuity?",Senior,Workforce Management,Workforce Management & Leadership,Plant Manager,Industry Knowledge
Apple,"New manufacturing process for latest iPhone shows 40% longer cycle time. How do you optimize this?",Senior,Lean Manufacturing,Lean Manufacturing & Continuous Improvement,Senior Manager,Industry Knowledge
Samsung,"Your memory chip fab experiences yield issues after equipment upgrade. How do you restore performance?",Senior,Automation & Technology,Automation & Technology Integration,Plant Manager,Industry Knowledge
Samsung,"Display panel production shows quality variations between shifts. How do you standardize performance?",Mid,Operations Optimization,Performance Metrics & Analytics,Operations Manager,Industry Knowledge
Samsung,"New smartphone model requires production line reconfiguration in 30 days. How do you plan this transition?",Senior,Production Planning,Production Planning & Scheduling,Senior Manager,Industry Knowledge
Samsung,"Chemical leak in semiconductor facility forces evacuation. How do you manage crisis response and recovery?",Staff,Safety & Compliance,Safety Management & Compliance,VP Operations,Industry Knowledge
Samsung,"Your battery manufacturing costs are 20% above target. How do you reduce expenses while maintaining quality?",Senior,Cost Management,Cost Control & Budget Management,Plant Manager,Industry Knowledge
Foxconn,"iPhone assembly line shows declining efficiency during night shifts. How do you diagnose and improve performance?",Mid,Workforce Management,Performance Metrics & Analytics,Operations Manager,Industry Knowledge
Foxconn,"New automation equipment reduces labor needs by 40%. How do you manage workforce transition?",Senior,Automation & Technology,Workforce Management & Leadership,Senior Manager,Industry Knowledge
Foxconn,"Quality rejection rates increase to 8% after process change. How do you quickly identify and fix root causes?",Senior,Operations Optimization,Lean Manufacturing & Continuous Improvement,Plant Manager,Industry Knowledge
Foxconn,"Peak season demand requires 50% production increase. How do you scale operations effectively?",Staff,Production Planning,Production Planning & Scheduling,VP Operations,Industry Knowledge
Foxconn,"Repetitive motion injuries increase 30% with new assembly process. How do you address this safety concern?",Mid,Safety & Compliance,Safety Management & Compliance,Operations Manager,Industry Knowledge
3M,"Your adhesive manufacturing process shows batch-to-batch variation affecting customer performance. How do you solve this?",Senior,Operations Optimization,Performance Metrics & Analytics,Plant Manager,Industry Knowledge
3M,"New environmental regulations require process changes costing $10M. How do you implement while maintaining production?",Staff,Safety & Compliance,Cost Control & Budget Management,VP Operations,Industry Knowledge
3M,"R&D requests rapid prototyping of new product requiring manufacturing line modifications. How do you support this?",Senior,Production Planning,Automation & Technology Integration,Senior Manager,Industry Knowledge
3M,"Your tape manufacturing equipment shows declining performance after 5 years. How do you optimize maintenance strategy?",Mid,Equipment Management,Equipment Management & Maintenance,Operations Manager,Industry Knowledge
3M,"Customer complaints about product consistency force quality investigation. How do you improve process control?",Senior,Lean Manufacturing,Performance Metrics & Analytics,Plant Manager,Industry Knowledge
Caterpillar,"Excavator assembly line faces supply chain disruptions affecting hydraulic components. How do you maintain production?",Senior,Operations Optimization,Supply Chain Coordination,Plant Manager,Industry Knowledge
Caterpillar,"Your engine manufacturing cell shows 25% efficiency decline after lean implementation. How do you course-correct?",Senior,Lean Manufacturing,Lean Manufacturing & Continuous Improvement,Senior Manager,Industry Knowledge
Caterpillar,"Heavy machinery testing reveals reliability issues requiring design changes. How do you manage production impact?",Staff,Operations Optimization,Performance Metrics & Analytics,VP Operations,Industry Knowledge
Caterpillar,"Skilled welders are in short supply affecting production quality. How do you address this workforce challenge?",Mid,Workforce Management,Workforce Management & Leadership,Operations Manager,Industry Knowledge
Caterpillar,"New emission standards require engine modifications costing $50M. How do you plan this transition?",Staff,Cost Management,Automation & Technology Integration,VP Operations,Industry Knowledge
General,"Your manufacturing line efficiency drops 30% after implementing new safety protocols. How do you optimize both?",Senior,Safety & Compliance,Safety Management & Compliance,Plant Manager,Industry Knowledge
General,"A key supplier files bankruptcy during your peak production season. How do you ensure continuity?",Staff,Operations Optimization,Supply Chain Coordination,VP Operations,Industry Knowledge
General,"Your newest automation equipment has 40% uptime due to frequent breakdowns. How do you improve reliability?",Senior,Equipment Management,Equipment Management & Maintenance,Senior Manager,Industry Knowledge
General,"Workers resist new lean manufacturing processes citing increased workload. How do you address this?",Mid,Lean Manufacturing,Workforce Management & Leadership,Operations Manager,Industry Knowledge
General,"Quality defects increase 15% after cost reduction initiatives. How do you balance cost and quality?",Senior,Cost Management,Performance Metrics & Analytics,Plant Manager,Industry Knowledge
General,"Your plant must reduce energy consumption by 25% while maintaining output. What's your strategy?",Senior,Operations Optimization,Operations Optimization & Efficiency,Senior Manager,Industry Knowledge
General,"A critical production machine requires emergency repair costing $500K with no budget approval. How do you proceed?",Mid,Equipment Management,Cost Control & Budget Management,Operations Manager,Industry Knowledge
General,"New environmental compliance requires production changes affecting delivery schedules. How do you manage this?",Staff,Safety & Compliance,Production Planning & Scheduling,VP Operations,Industry Knowledge
General,"Your day shift consistently outperforms night shift by 20%. How do you standardize performance?",Mid,Workforce Management,Performance Metrics & Analytics,Operations Manager,Industry Knowledge
General,"Customer demands require 50% capacity increase within 90 days. How do you scale operations?",Staff,Production Planning,Production Planning & Scheduling,VP Operations,Industry Knowledge
General,"Your preventive maintenance program shows equipment failures are still increasing. How do you improve strategy?",Senior,Equipment Management,Equipment Management & Maintenance,Plant Manager,Industry Knowledge
General,"Union negotiations result in work rule changes affecting production efficiency. How do you adapt?",Senior,Workforce Management,Workforce Management & Leadership,Senior Manager,Industry Knowledge
General,"Raw material costs increase 30% forcing price negotiations with customers. How do you manage operations impact?",Staff,Cost Management,Supply Chain Coordination,VP Operations,Industry Knowledge
General,"Your continuous improvement program shows diminishing returns after 2 years. How do you reinvigorate it?",Senior,Lean Manufacturing,Lean Manufacturing & Continuous Improvement,Plant Manager,Industry Knowledge
General,"New automation technology promises 40% efficiency gains but requires $20M investment. How do you evaluate this?",Staff,Automation & Technology,Cost Control & Budget Management,VP Operations,Industry Knowledge
General,"Product liability lawsuit forces production halt for investigation. How do you manage crisis response?",Staff,Safety & Compliance,Performance Metrics & Analytics,VP Operations,Industry Knowledge
General,"Your plant safety record deteriorates with 3 incidents in one month. How do you address this immediately?",Mid,Safety & Compliance,Safety Management & Compliance,Operations Manager,Industry Knowledge
General,"Key production supervisors leave for competitors taking institutional knowledge. How do you prevent disruption?",Senior,Workforce Management,Workforce Management & Leadership,Senior Manager,Industry Knowledge
General,"Customer audit reveals non-conformances in your quality system. How do you address findings quickly?",Senior,Operations Optimization,Performance Metrics & Analytics,Plant Manager,Industry Knowledge
General,"Your inventory levels increase 40% while service levels remain constant. How do you optimize this?",Mid,Production Planning,Supply Chain Coordination,Operations Manager,Industry Knowledge
General,"New product introduction requires cross-training 200 workers in 60 days. How do you execute this?",Senior,Workforce Management,Production Planning & Scheduling,Senior Manager,Industry Knowledge
General,"Equipment utilization metrics show declining performance across all lines. How do you investigate root causes?",Senior,Equipment Management,Performance Metrics & Analytics,Plant Manager,Industry Knowledge
General,"Your plant faces shutdown threat due to profitability concerns. How do you demonstrate value and improve performance?",Staff,Cost Management,Operations Optimization & Efficiency,VP Operations,Industry Knowledge
General,"Digital transformation initiative shows slow adoption among experienced workers. How do you accelerate change?",Senior,Automation & Technology,Workforce Management & Leadership,Senior Manager,Industry Knowledge
General,"Supply chain visibility gaps cause frequent stockouts affecting production schedules. How do you improve coordination?",Mid,Production Planning,Supply Chain Coordination,Operations Manager,Industry Knowledge
General,"Your lean implementation reduces waste but increases worker stress and turnover. How do you balance these?",Senior,Lean Manufacturing,Workforce Management & Leadership,Plant Manager,Industry Knowledge
General,"Regulatory inspection finds safety violations requiring immediate corrective action. How do you respond?",Mid,Safety & Compliance,Safety Management & Compliance,Operations Manager,Industry Knowledge
General,"Customer complaints about delivery reliability increase despite meeting internal metrics. How do you improve?",Senior,Operations Optimization,Performance Metrics & Analytics,Senior Manager,Industry Knowledge
General,"Your manufacturing cells show wide performance variation despite standardized processes. How do you reduce this?",Senior,Operations Optimization,Lean Manufacturing & Continuous Improvement,Plant Manager,Industry Knowledge
General,"Budget cuts require 20% reduction in maintenance spending. How do you maintain equipment reliability?",Mid,Equipment Management,Cost Control & Budget Management,Operations Manager,Industry Knowledge
General,"New ERP system implementation disrupts production planning for 6 weeks. How do you minimize impact?",Senior,Automation & Technology,Production Planning & Scheduling,Senior Manager,Industry Knowledge
General,"Your plant's carbon footprint must reduce 40% within 2 years. How do you achieve this while maintaining output?",Staff,Operations Optimization,Operations Optimization & Efficiency,VP Operations,Industry Knowledge
General,"Key customer threatens to switch suppliers due to quality concerns. How do you recover this relationship?",Staff,Operations Optimization,Performance Metrics & Analytics,VP Operations,Industry Knowledge
General,"Your workforce demographics show 60% of experienced workers retiring in 5 years. How do you prepare?",Senior,Workforce Management,Workforce Management & Leadership,Plant Manager,Industry Knowledge
General,"Production planning system recommends conflicting priorities between efficiency and customer service. How do you resolve?",Mid,Production Planning,Production Planning & Scheduling,Operations Manager,Industry Knowledge
General,"Your plant's overall equipment effectiveness (OEE) drops below 65%. How do you systematically improve this?",Senior,Equipment Management,Performance Metrics & Analytics,Senior Manager,Industry Knowledge
General,"Competitor launches superior product forcing you to accelerate improvement timeline by 50%. How do you respond?",Staff,Operations Optimization,Lean Manufacturing & Continuous Improvement,VP Operations,Industry Knowledge
General,"Your manufacturing footprint optimization study recommends closing one of three plants. How do you evaluate this?",Staff,Cost Management,Operations Optimization & Efficiency,VP Operations,Industry Knowledge
General,"Cybersecurity breach affects manufacturing systems requiring offline operation for 72 hours. How do you manage this?",Senior,Automation & Technology,Operations Optimization & Efficiency,Plant Manager,Industry Knowledge
General,"Your continuous improvement culture stagnates with declining suggestion participation. How do you reinvigorate engagement?",Senior,Lean Manufacturing,Workforce Management & Leadership,Senior Manager,Industry Knowledge
General,"New trade regulations affect 40% of your raw material supply base. How do you adapt procurement and production?",Staff,Operations Optimization,Supply Chain Coordination,VP Operations,Industry Knowledge
General,"Quality management system audit reveals systematic process control weaknesses. How do you address these findings?",Senior,Operations Optimization,Performance Metrics & Analytics,Plant Manager,Industry Knowledge
General,"Your plant faces community opposition to expansion plans due to environmental concerns. How do you address this?",Staff,Safety & Compliance,Operations Optimization & Efficiency,VP Operations,Industry Knowledge
General,"Manufacturing execution system shows data integrity issues affecting production decisions. How do you resolve this?",Senior,Automation & Technology,Performance Metrics & Analytics,Senior Manager,Industry Knowledge
General,"Your supplier development program shows inconsistent results across different vendors. How do you improve effectiveness?",Mid,Operations Optimization,Supply Chain Coordination,Operations Manager,Industry Knowledge
General,"Energy costs increase 50% forcing operational changes to maintain profitability. What's your optimization strategy?",Senior,Cost Management,Operations Optimization & Efficiency,Plant Manager,Industry Knowledge
General,"Your predictive maintenance program shows false positives leading to unnecessary downtime. How do you calibrate this?",Senior,Equipment Management,Automation & Technology Integration,Senior Manager,Industry Knowledge
General,"Multi-generational workforce shows communication gaps affecting teamwork and productivity. How do you bridge these?",Mid,Workforce Management,Workforce Management & Leadership,Operations Manager,Industry Knowledge
General,"Your value stream mapping reveals hidden waste consuming 25% of capacity. How do you systematically eliminate this?",Senior,Lean Manufacturing,Operations Optimization & Efficiency,Plant Manager,Industry Knowledge
General,"Customer demand volatility increases requiring more flexible manufacturing capabilities. How do you develop this agility?",Staff,Production Planning,Operations Optimization & Efficiency,VP Operations,Industry Knowledge
General,"Your plant's innovation pipeline lacks breakthrough improvements despite continuous investment. How do you accelerate this?",Staff,Lean Manufacturing,Automation & Technology Integration,VP Operations,Industry Knowledge
General,"Manufacturing cost structure shows labor representing 60% of expenses in high-wage region. How do you optimize this?",Staff,Cost Management,Workforce Management & Leadership,VP Operations,Industry Knowledge
General,"Your quality costs (prevention, appraisal, failure) are increasing despite improvement efforts. How do you reduce these?",Senior,Operations Optimization,Performance Metrics & Analytics,Plant Manager,Industry Knowledge
General,"Digital twin technology implementation shows promise but requires significant cultural change. How do you drive adoption?",Senior,Automation & Technology,Workforce Management & Leadership,Senior Manager,Industry Knowledge
General,"Your manufacturing network optimization reveals opportunities for consolidation saving $50M annually. How do you execute this?",Staff,Operations Optimization,Cost Control & Budget Management,VP Operations,Industry Knowledge
General,"Sustainability requirements force evaluation of entire supply chain environmental impact. How do you implement changes?",Staff,Operations Optimization,Supply Chain Coordination,VP Operations,Industry Knowledge
General,"Your operational excellence program plateaus after initial gains. How do you achieve breakthrough performance?",Staff,Lean Manufacturing,Operations Optimization & Efficiency,VP Operations,Industry Knowledge
General,"Manufacturing data analytics reveals productivity patterns you hadn't noticed. How do you act on these insights?",Senior,Automation & Technology,Performance Metrics & Analytics,Senior Manager,Industry Knowledge
General,"Your apprenticeship program struggles to attract young talent to manufacturing careers. How do you improve recruitment?",Mid,Workforce Management,Workforce Management & Leadership,Operations Manager,Industry Knowledge
