Google,How would you implement distributed data mesh governance across cloud regions?,Staff,Data Quality & Governance,"Data Quality & Governance,Cloud Data Platform Architecture,Data Security & Privacy",Staff DE,DataCamp
Meta,Design a data pipeline for AR/VR spatial analytics at scale,Staff,Streaming & Real-time Processing,"Streaming & Real-time Processing,Big Data Technologies & Frameworks,Data Pipeline Design & Architecture",Staff DE,DataCamp
Amazon,How would you optimize cross-region data replication for global analytics?,Senior,Cloud Data Platforms,"Cloud Data Platform Architecture,Performance Optimization & Tuning,Data Pipeline Design & Architecture",Senior DE,DataCamp
Apple,Design a privacy-preserving analytics platform for health data,Staff,Data Security & Privacy,"Data Security & Privacy,Data Quality & Governance,Cloud Data Platform Architecture",Staff DE,DataCamp
Netflix,How would you handle real-time content personalization data at 200M+ users?,Staff,Streaming & Real-time Processing,"Streaming & Real-time Processing,Performance Optimization & Tuning,Big Data Technologies & Frameworks",Staff DE,DataCamp
Microsoft,Design a hybrid cloud data architecture for enterprise customers,Senior,Cloud Data Platforms,"Cloud Data Platform Architecture,Data Warehouse & Lake Architecture,Technology Selection & Trade-offs",Senior DE,DataCamp
Tesla,How would you implement vehicle-to-grid data analytics infrastructure?,Senior,Streaming & Real-time Processing,"Streaming & Real-time Processing,Data Pipeline Design & Architecture,Data Quality & Governance",Senior DE,DataCamp
Uber,Design a multi-modal transportation data integration platform,Senior,Data Pipeline Architecture,"Data Pipeline Design & Architecture,Big Data Technologies & Frameworks,Business Requirements Analysis",Senior DE,DataCamp
Airbnb,How would you handle guest safety data pipeline with real-time alerting?,Senior,Streaming & Real-time Processing,"Streaming & Real-time Processing,Data Quality & Governance,Ethics & Responsible AI",Senior DE,DataCamp
LinkedIn,Design a data architecture for global talent marketplace analytics,Senior,Data Warehouse Design,"Data Warehouse & Lake Architecture,Data Pipeline Design & Architecture,Business Requirements Analysis",Senior DE,DataCamp
Salesforce,How would you implement customer data platform with Einstein Analytics?,Senior,Cloud Data Platforms,"Cloud Data Platform Architecture,Feature Engineering & Data Strategy,Data Pipeline Design & Architecture",Senior DE,DataCamp
Adobe,Design a real-time creative collaboration data pipeline,Senior,Streaming & Real-time Processing,"Streaming & Real-time Processing,Data Pipeline Design & Architecture,Performance Optimization & Tuning",Senior DE,DataCamp
Spotify,How would you handle podcast content analytics across multiple languages?,Senior,Data Pipeline Architecture,"Data Pipeline Design & Architecture,Big Data Technologies & Frameworks,Feature Engineering & Data Strategy",Senior DE,DataCamp
Snowflake,Explain auto-clustering and search optimization services,Senior,Performance Optimization,"Performance Optimization & Tuning,Cloud Data Platform Architecture,Data Modeling & Design",Senior DE,DataInterview
Databricks,How would you implement Delta Sharing for secure data collaboration?,Senior,Data Security & Privacy,"Data Security & Privacy,Cloud Data Platform Architecture,Data Quality & Governance",Senior DE,DataCamp
MongoDB,Design a data pipeline for real-time collaborative document editing,Senior,Streaming & Real-time Processing,"Streaming & Real-time Processing,Data Pipeline Design & Architecture,Performance Optimization & Tuning",Senior DE,DataCamp
Elastic,How would you optimize machine learning inference on search results?,Senior,Performance Optimization,"Performance Optimization & Tuning,Feature Engineering & Data Strategy,Big Data Technologies & Frameworks",Senior DE,DataCamp
Confluent,Design a data streaming architecture for financial market data,Senior,Streaming & Real-time Processing,"Streaming & Real-time Processing,Data Security & Privacy,Performance Optimization & Tuning",Senior DE,DataCamp
Palantir,How would you implement graph-based analytics for network analysis?,Staff,Big Data Technologies,"Big Data Technologies & Frameworks,Data Modeling & Design,Data Security & Privacy",Staff DE,DataCamp
Splunk,Design a data pipeline for industrial IoT predictive maintenance,Senior,Streaming & Real-time Processing,"Streaming & Real-time Processing,Data Pipeline Design & Architecture,Business Requirements Analysis",Senior DE,DataCamp
Stripe,How would you handle compliance data for international payment processing?,Senior,Data Security & Privacy,"Data Security & Privacy,Data Quality & Governance,ETL/ELT Development & Optimization",Senior DE,DataCamp
Shopify,Design a data architecture for global e-commerce tax compliance,Senior,Data Warehouse Design,"Data Warehouse & Lake Architecture,Data Security & Privacy,Business Requirements Analysis",Senior DE,DataCamp
DoorDash,How would you implement real-time delivery optimization analytics?,Senior,Streaming & Real-time Processing,"Streaming & Real-time Processing,Data Pipeline Design & Architecture,Performance Optimization & Tuning",Senior DE,DataCamp
Instacart,Design a data pipeline for nutrition analysis and dietary tracking,Senior,Data Pipeline Architecture,"Data Pipeline Design & Architecture,Data Quality & Governance,Feature Engineering & Data Strategy",Senior DE,DataCamp
Robinhood,How would you handle cryptocurrency staking rewards analytics?,Senior,Data Pipeline Architecture,"Data Pipeline Design & Architecture,Data Security & Privacy,Big Data Technologies & Frameworks",Senior DE,DataCamp
Coinbase,Design a data warehouse for DeFi protocol risk assessment,Senior,Data Warehouse Design,"Data Warehouse & Lake Architecture,Data Security & Privacy,Big Data Technologies & Frameworks",Senior DE,DataCamp
Discord,How would you implement community health metrics data pipeline?,Senior,Streaming & Real-time Processing,"Streaming & Real-time Processing,Data Quality & Governance,Ethics & Responsible AI",Senior DE,DataCamp
OpenAI,Design a data architecture for multi-modal AI model training,Staff,Big Data Technologies,"Big Data Technologies & Frameworks,Cloud Data Platform Architecture,Performance Optimization & Tuning",Staff DE,DataCamp
Anthropic,How would you implement AI safety evaluation data pipelines?,Staff,Data Quality & Governance,"Data Quality & Governance,Ethics & Responsible AI,Data Pipeline Design & Architecture",Staff DE,DataCamp
Google,Design a data pipeline for Google Photos facial recognition analytics,Senior,Streaming & Real-time Processing,"Streaming & Real-time Processing,Data Security & Privacy,Big Data Technologies & Frameworks",Senior DE,DataCamp
Meta,How would you handle cross-platform advertising analytics data?,Senior,Data Pipeline Architecture,"Data Pipeline Design & Architecture,Data Quality & Governance,Business Requirements Analysis",Senior DE,DataCamp
Amazon,Design a data architecture for Prime membership analytics,Senior,Data Warehouse Design,"Data Warehouse & Lake Architecture,Data Pipeline Design & Architecture,Business Requirements Analysis",Senior DE,DataCamp
Apple,How would you implement iMessage analytics with privacy preservation?,Senior,Data Security & Privacy,"Data Security & Privacy,Streaming & Real-time Processing,Data Quality & Governance",Senior DE,DataCamp
Netflix,Design a data pipeline for content production cost optimization,Senior,Data Pipeline Architecture,"Data Pipeline Design & Architecture,Business Requirements Analysis,Performance Optimization & Tuning",Senior DE,DataCamp
Microsoft,How would you optimize Azure Cosmos DB for analytics workloads?,Senior,Cloud Data Platforms,"Cloud Data Platform Architecture,Performance Optimization & Tuning,Data Modeling & Design",Senior DE,DataCamp
Tesla,Design a data architecture for autonomous fleet coordination,Staff,Streaming & Real-time Processing,"Streaming & Real-time Processing,Big Data Technologies & Frameworks,Data Pipeline Design & Architecture",Staff DE,DataCamp
Uber,How would you handle driver behavior analytics for safety optimization?,Senior,Streaming & Real-time Processing,"Streaming & Real-time Processing,Data Quality & Governance,Ethics & Responsible AI",Senior DE,DataCamp
Airbnb,Design a data pipeline for property valuation model features,Senior,Feature Engineering & Data Strategy,"Feature Engineering & Data Strategy,Data Pipeline Design & Architecture,Business Requirements Analysis",Senior DE,DataCamp
LinkedIn,How would you implement professional skills trending analytics?,Senior,Streaming & Real-time Processing,"Streaming & Real-time Processing,Feature Engineering & Data Strategy,Business Requirements Analysis",Senior DE,DataCamp
Salesforce,Design a data architecture for omnichannel marketing attribution,Senior,Data Warehouse Design,"Data Warehouse & Lake Architecture,Data Pipeline Design & Architecture,Business Requirements Analysis",Senior DE,DataCamp
Adobe,How would you handle creative asset version control in data pipelines?,Senior,Data Quality & Governance,"Data Quality & Governance,Data Pipeline Design & Architecture,Data Modeling & Design",Senior DE,DataCamp
Spotify,Design a data pipeline for live concert streaming analytics,Senior,Streaming & Real-time Processing,"Streaming & Real-time Processing,Data Pipeline Design & Architecture,Performance Optimization & Tuning",Senior DE,DataCamp
Snowflake,How would you implement data clean rooms for privacy-safe analytics?,Staff,Data Security & Privacy,"Data Security & Privacy,Cloud Data Platform Architecture,Data Quality & Governance",Staff DE,DataInterview
Databricks,Design a lakehouse architecture for real-time and batch analytics,Staff,Data Warehouse Design,"Data Warehouse & Lake Architecture,Cloud Data Platform Architecture,Streaming & Real-time Processing",Staff DE,DataCamp
MongoDB,How would you optimize aggregation pipelines for time-series data?,Senior,Performance Optimization,"Performance Optimization & Tuning,Data Modeling & Design,Big Data Technologies & Frameworks",Senior DE,DataCamp
Elastic,Design a data pipeline for enterprise knowledge management,Senior,Data Pipeline Architecture,"Data Pipeline Design & Architecture,Big Data Technologies & Frameworks,Feature Engineering & Data Strategy",Senior DE,DataCamp
Confluent,How would you implement exactly-once processing with Kafka Streams?,Senior,Streaming & Real-time Processing,"Streaming & Real-time Processing,Big Data Technologies & Frameworks,Data Quality & Governance",Senior DE,DataCamp
Palantir,Design a data fusion platform for multi-intelligence sources,Staff,Data Pipeline Architecture,"Data Pipeline Design & Architecture,Data Security & Privacy,Big Data Technologies & Frameworks",Staff DE,DataCamp
Splunk,How would you handle security event correlation at enterprise scale?,Senior,Streaming & Real-time Processing,"Streaming & Real-time Processing,Data Security & Privacy,Performance Optimization & Tuning",Senior DE,DataCamp
Stripe,Design a data architecture for payment processor analytics,Senior,Data Warehouse Design,"Data Warehouse & Lake Architecture,Data Security & Privacy,Performance Optimization & Tuning",Senior DE,DataCamp
Shopify,How would you implement real-time inventory synchronization?,Senior,Streaming & Real-time Processing,"Streaming & Real-time Processing,Data Quality & Governance,Performance Optimization & Tuning",Senior DE,DataCamp
DoorDash,Design a data pipeline for carbon footprint tracking,Senior,Data Pipeline Architecture,"Data Pipeline Design & Architecture,Business Requirements Analysis,Data Quality & Governance",Senior DE,DataCamp
Instacart,How would you handle peak demand surge analytics?,Senior,Streaming & Real-time Processing,"Streaming & Real-time Processing,Performance Optimization & Tuning,Business Requirements Analysis",Senior DE,DataCamp
Robinhood,Design a data architecture for regulatory audit trails,Senior,Data Security & Privacy,"Data Security & Privacy,Data Quality & Governance,ETL/ELT Development & Optimization",Senior DE,DataCamp
Coinbase,How would you implement blockchain analytics data ingestion?,Senior,Big Data Technologies,"Big Data Technologies & Frameworks,Data Pipeline Design & Architecture,Data Security & Privacy",Senior DE,DataCamp
Discord,Design a data pipeline for voice channel quality monitoring,Senior,Streaming & Real-time Processing,"Streaming & Real-time Processing,Data Quality & Governance,Performance Optimization & Tuning",Senior DE,DataCamp
OpenAI,How would you optimize data preprocessing for large language models?,Staff,Big Data Technologies,"Big Data Technologies & Frameworks,Performance Optimization & Tuning,Cloud Data Platform Architecture",Staff DE,DataCamp
Anthropic,Design a data governance framework for AI alignment research,Staff,Data Quality & Governance,"Data Quality & Governance,Ethics & Responsible AI,Data Security & Privacy",Staff DE,DataCamp
Google,How would you implement federated analytics across Google services?,Staff,Cloud Data Platforms,"Cloud Data Platform Architecture,Data Security & Privacy,Data Quality & Governance",Staff DE,DataCamp
Meta,Design a data pipeline for virtual reality social interactions,Senior,Streaming & Real-time Processing,"Streaming & Real-time Processing,Big Data Technologies & Frameworks,Data Pipeline Design & Architecture",Senior DE,DataCamp
Amazon,How would you optimize data lake storage costs using intelligent tiering?,Senior,Cloud Data Platforms,"Cloud Data Platform Architecture,Performance Optimization & Tuning,Technology Selection & Trade-offs",Senior DE,DataCamp
Apple,Design a data architecture for App Store review sentiment analysis,Senior,Data Pipeline Architecture,"Data Pipeline Design & Architecture,Feature Engineering & Data Strategy,Business Requirements Analysis",Senior DE,DataCamp
Netflix,How would you handle content rights management data across regions?,Senior,Data Security & Privacy,"Data Security & Privacy,Data Quality & Governance,Business Requirements Analysis",Senior DE,DataCamp
Microsoft,Design a data pipeline for GitHub code analytics,Senior,Data Pipeline Architecture,"Data Pipeline Design & Architecture,Big Data Technologies & Frameworks,Feature Engineering & Data Strategy",Senior DE,DataCamp
Tesla,How would you implement predictive maintenance for charging infrastructure?,Senior,Streaming & Real-time Processing,"Streaming & Real-time Processing,Data Pipeline Design & Architecture,Business Requirements Analysis",Senior DE,DataCamp
Uber,Design a data architecture for autonomous vehicle simulation,Staff,Big Data Technologies,"Big Data Technologies & Frameworks,Performance Optimization & Tuning,Data Pipeline Design & Architecture",Staff DE,DataCamp
Airbnb,How would you handle host performance analytics across markets?,Senior,Data Pipeline Architecture,"Data Pipeline Design & Architecture,Business Requirements Analysis,Performance Optimization & Tuning",Senior DE,DataCamp
LinkedIn,Design a data pipeline for professional networking insights,Senior,Feature Engineering & Data Strategy,"Feature Engineering & Data Strategy,Data Pipeline Design & Architecture,Business Requirements Analysis",Senior DE,DataCamp
Salesforce,How would you implement customer success prediction analytics?,Senior,Data Pipeline Architecture,"Data Pipeline Design & Architecture,Feature Engineering & Data Strategy,Business Requirements Analysis",Senior DE,DataCamp
Adobe,Design a data architecture for digital marketing performance,Senior,Data Warehouse Design,"Data Warehouse & Lake Architecture,Data Pipeline Design & Architecture,Business Requirements Analysis",Senior DE,DataCamp
Spotify,How would you handle audio quality analytics for streaming?,Senior,Streaming & Real-time Processing,"Streaming & Real-time Processing,Data Quality & Governance,Performance Optimization & Tuning",Senior DE,DataCamp
Snowflake,Explain row access policies and column-level security,Senior,Data Security & Privacy,"Data Security & Privacy,Cloud Data Platform Architecture,Data Quality & Governance",Senior DE,DataInterview
Databricks,How would you implement collaborative notebooks data lineage?,Senior,Data Quality & Governance,"Data Quality & Governance,Feature Engineering & Data Strategy,Cloud Data Platform Architecture",Senior DE,DataCamp
MongoDB,Design a data pipeline for geospatial analytics optimization,Senior,Big Data Technologies,"Big Data Technologies & Frameworks,Data Pipeline Design & Architecture,Performance Optimization & Tuning",Senior DE,DataCamp
Elastic,How would you optimize search performance for multi-tenant systems?,Senior,Performance Optimization,"Performance Optimization & Tuning,Big Data Technologies & Frameworks,Data Security & Privacy",Senior DE,DataCamp
Confluent,Design a streaming architecture for supply chain visibility,Senior,Streaming & Real-time Processing,"Streaming & Real-time Processing,Data Pipeline Design & Architecture,Business Requirements Analysis",Senior DE,DataCamp
Palantir,How would you implement privacy-preserving data analytics?,Staff,Data Security & Privacy,"Data Security & Privacy,Data Quality & Governance,Technical Communication",Staff DE,DataCamp
Splunk,Design a data pipeline for DevOps metrics and monitoring,Senior,Data Pipeline Architecture,"Data Pipeline Design & Architecture,Streaming & Real-time Processing,Business Requirements Analysis",Senior DE,DataCamp
Stripe,How would you handle international tax calculation analytics?,Senior,Data Pipeline Architecture,"Data Pipeline Design & Architecture,Data Security & Privacy,Business Requirements Analysis",Senior DE,DataCamp
Shopify,Design a data architecture for merchant success analytics,Senior,Data Warehouse Design,"Data Warehouse & Lake Architecture,Data Pipeline Design & Architecture,Business Requirements Analysis",Senior DE,DataCamp
DoorDash,How would you implement ghost kitchen performance analytics?,Senior,Data Pipeline Architecture,"Data Pipeline Design & Architecture,Business Requirements Analysis,Performance Optimization & Tuning",Senior DE,DataCamp
Instacart,Design a data pipeline for shopper efficiency optimization,Senior,Streaming & Real-time Processing,"Streaming & Real-time Processing,Data Pipeline Design & Architecture,Feature Engineering & Data Strategy",Senior DE,DataCamp
Robinhood,How would you handle social trading influence analytics?,Senior,Streaming & Real-time Processing,"Streaming & Real-time Processing,Data Quality & Governance,Ethics & Responsible AI",Senior DE,DataCamp
Coinbase,Design a data warehouse for institutional crypto analytics,Senior,Data Warehouse Design,"Data Warehouse & Lake Architecture,Data Security & Privacy,Big Data Technologies & Frameworks",Senior DE,DataCamp
Discord,How would you implement server load balancing analytics?,Senior,Streaming & Real-time Processing,"Streaming & Real-time Processing,Performance Optimization & Tuning,Data Pipeline Design & Architecture",Senior DE,DataCamp
OpenAI,Design a data architecture for prompt engineering research,Staff,Data Pipeline Architecture,"Data Pipeline Design & Architecture,Feature Engineering & Data Strategy,Data Quality & Governance",Staff DE,DataCamp
Anthropic,How would you implement human feedback data quality assurance?,Staff,Data Quality & Governance,"Data Quality & Governance,Ethics & Responsible AI,Feature Engineering & Data Strategy",Staff DE,DataCamp
Google,Design a data pipeline for YouTube creator analytics,Senior,Data Pipeline Architecture,"Data Pipeline Design & Architecture,Business Requirements Analysis,Performance Optimization & Tuning",Senior DE,DataCamp
Meta,How would you handle Instagram shopping analytics at scale?,Senior,Streaming & Real-time Processing,"Streaming & Real-time Processing,Data Pipeline Design & Architecture,Business Requirements Analysis",Senior DE,DataCamp
Amazon,Design a data architecture for Twitch streaming analytics,Senior,Streaming & Real-time Processing,"Streaming & Real-time Processing,Big Data Technologies & Frameworks,Performance Optimization & Tuning",Senior DE,DataCamp
Apple,How would you implement CarPlay usage analytics with privacy?,Senior,Data Security & Privacy,"Data Security & Privacy,Streaming & Real-time Processing,Data Quality & Governance",Senior DE,DataCamp
Netflix,Design a data pipeline for content accessibility analytics,Senior,Data Pipeline Architecture,"Data Pipeline Design & Architecture,Data Quality & Governance,Ethics & Responsible AI",Senior DE,DataCamp
Microsoft,How would you optimize LinkedIn learning analytics?,Senior,Data Pipeline Architecture,"Data Pipeline Design & Architecture,Feature Engineering & Data Strategy,Business Requirements Analysis",Senior DE,DataCamp
Tesla,Design a data architecture for solar panel performance analytics,Senior,Streaming & Real-time Processing,"Streaming & Real-time Processing,Data Pipeline Design & Architecture,Data Quality & Governance",Senior DE,DataCamp
Uber,How would you handle multi-city pricing analytics?,Senior,Data Pipeline Architecture,"Data Pipeline Design & Architecture,Business Requirements Analysis,Data Quality & Governance",Senior DE,DataCamp
Airbnb,Design a data pipeline for neighborhood gentrification tracking,Senior,Data Pipeline Architecture,"Data Pipeline Design & Architecture,Ethics & Responsible AI,Feature Engineering & Data Strategy",Senior DE,DataCamp
LinkedIn,How would you implement diversity and inclusion analytics?,Senior,Data Quality & Governance,"Data Quality & Governance,Ethics & Responsible AI,Business Requirements Analysis",Senior DE,DataCamp
Salesforce,Design a data architecture for AI-powered sales insights,Senior,Feature Engineering & Data Strategy,"Feature Engineering & Data Strategy,Cloud Data Platform Architecture,Data Pipeline Design & Architecture",Senior DE,DataCamp
Adobe,How would you handle creative workflow optimization analytics?,Senior,Data Pipeline Architecture,"Data Pipeline Design & Architecture,Business Requirements Analysis,Performance Optimization & Tuning",Senior DE,DataCamp
Spotify,Design a data pipeline for artist development insights,Senior,Data Pipeline Architecture,"Data Pipeline Design & Architecture,Feature Engineering & Data Strategy,Business Requirements Analysis",Senior DE,DataCamp
Snowflake,How would you implement data marketplace monetization?,Staff,Cloud Data Platforms,"Cloud Data Platform Architecture,Business Requirements Analysis,Data Security & Privacy",Staff DE,DataInterview
Databricks,Design a unified analytics platform for multi-cloud,Staff,Cloud Data Platforms,"Cloud Data Platform Architecture,Data Warehouse & Lake Architecture,Technology Selection & Trade-offs",Staff DE,DataCamp
MongoDB,How would you optimize change streams for real-time analytics?,Senior,Streaming & Real-time Processing,"Streaming & Real-time Processing,Performance Optimization & Tuning,Data Pipeline Design & Architecture",Senior DE,DataCamp
Elastic,Design a data pipeline for enterprise compliance monitoring,Senior,Data Quality & Governance,"Data Quality & Governance,Data Security & Privacy,Data Pipeline Design & Architecture",Senior DE,DataCamp
Confluent,How would you implement cross-cluster data replication?,Senior,Big Data Technologies,"Big Data Technologies & Frameworks,Performance Optimization & Tuning,Data Quality & Governance",Senior DE,DataCamp
Palantir,Design a data architecture for predictive intelligence analysis,Staff,Data Pipeline Architecture,"Data Pipeline Design & Architecture,Big Data Technologies & Frameworks,Ethics & Responsible AI",Staff DE,DataCamp
Splunk,How would you handle machine data analytics at petabyte scale?,Staff,Big Data Technologies,"Big Data Technologies & Frameworks,Performance Optimization & Tuning,Cloud Data Platform Architecture",Staff DE,DataCamp
Stripe,Design a data pipeline for payment ecosystem analytics,Senior,Data Pipeline Architecture,"Data Pipeline Design & Architecture,Data Security & Privacy,Business Requirements Analysis",Senior DE,DataCamp
Shopify,How would you implement headless commerce analytics?,Senior,Data Pipeline Architecture,"Data Pipeline Design & Architecture,Technology Selection & Trade-offs,Business Requirements Analysis",Senior DE,DataCamp
DoorDash,Design a data architecture for autonomous delivery testing,Staff,Streaming & Real-time Processing,"Streaming & Real-time Processing,Big Data Technologies & Frameworks,Data Pipeline Design & Architecture",Staff DE,DataCamp
Instacart,How would you handle sustainable sourcing analytics?,Senior,Data Pipeline Architecture,"Data Pipeline Design & Architecture,Data Quality & Governance,Business Requirements Analysis",Senior DE,DataCamp
Robinhood,Design a data pipeline for crypto yield farming analytics,Senior,Big Data Technologies,"Big Data Technologies & Frameworks,Data Security & Privacy,Data Pipeline Design & Architecture",Senior DE,DataCamp
Coinbase,How would you implement Web3 protocol analytics?,Senior,Big Data Technologies,"Big Data Technologies & Frameworks,Data Warehouse & Lake Architecture,Data Security & Privacy",Senior DE,DataCamp
Discord,Design a data architecture for virtual event analytics,Senior,Streaming & Real-time Processing,"Streaming & Real-time Processing,Data Pipeline Design & Architecture,Business Requirements Analysis",Senior DE,DataCamp
OpenAI,How would you optimize distributed training data pipelines?,Staff,Big Data Technologies,"Big Data Technologies & Frameworks,Performance Optimization & Tuning,Cloud Data Platform Architecture",Staff DE,DataCamp
Anthropic,Design a data governance framework for responsible AI research,Staff,Data Quality & Governance,"Data Quality & Governance,Ethics & Responsible AI,Data Security & Privacy",Staff DE,DataCamp
Google,How would you implement quantum computing simulation analytics?,Staff,Big Data Technologies,"Big Data Technologies & Frameworks,Cloud Data Platform Architecture,Performance Optimization & Tuning",Staff DE,DataCamp
