Meta,Design a data pipeline for neural interface research,Staff,Data Security & Privacy,"Data Security & Privacy,Ethics & Responsible AI,Streaming & Real-time Processing",Staff DE,DataCamp
Amazon,How would you optimize space mission data analytics?,Staff,Streaming & Real-time Processing,"Streaming & Real-time Processing,Big Data Technologies & Frameworks,Cloud Data Platform Architecture",Staff DE,DataCamp
Apple,Design a data architecture for augmented reality analytics,Senior,Streaming & Real-time Processing,"Streaming & Real-time Processing,Big Data Technologies & Frameworks,Data Pipeline Design & Architecture",Senior DE,DataCamp
Netflix,How would you handle interactive content analytics?,Senior,Streaming & Real-time Processing,"Streaming & Real-time Processing,Data Pipeline Design & Architecture,Feature Engineering & Data Strategy",Senior DE,DataCamp
Microsoft,Design a data pipeline for edge computing analytics,Senior,Cloud Data Platforms,"Cloud Data Platform Architecture,Streaming & Real-time Processing,Performance Optimization & Tuning",Senior DE,DataCamp
Tesla,How would you implement robotics fleet data analytics?,Staff,Streaming & Real-time Processing,"Streaming & Real-time Processing,Big Data Technologies & Frameworks,Data Pipeline Design & Architecture",Staff DE,DataCamp
Uber,Design a data architecture for urban air mobility,Staff,Streaming & Real-time Processing,"Streaming & Real-time Processing,Big Data Technologies & Frameworks,Data Pipeline Design & Architecture",Staff DE,DataCamp
Airbnb,How would you handle virtual tour engagement analytics?,Senior,Streaming & Real-time Processing,"Streaming & Real-time Processing,Data Pipeline Design & Architecture,Feature Engineering & Data Strategy",Senior DE,DataCamp
LinkedIn,Design a data pipeline for AI-assisted hiring analytics,Senior,Feature Engineering & Data Strategy,"Feature Engineering & Data Strategy,Data Pipeline Design & Architecture,Ethics & Responsible AI",Senior DE,DataCamp
Salesforce,How would you implement autonomous customer service analytics?,Staff,Feature Engineering & Data Strategy,"Feature Engineering & Data Strategy,Cloud Data Platform Architecture,Ethics & Responsible AI",Staff DE,DataCamp
Adobe,Design a data architecture for generative AI analytics,Senior,Data Pipeline Architecture,"Data Pipeline Design & Architecture,Feature Engineering & Data Strategy,Data Quality & Governance",Senior DE,DataCamp
Spotify,How would you handle immersive audio experience analytics?,Senior,Streaming & Real-time Processing,"Streaming & Real-time Processing,Data Pipeline Design & Architecture,Big Data Technologies & Frameworks",Senior DE,DataCamp
Snowflake,Design a cross-cloud data sharing architecture,Staff,Cloud Data Platforms,"Cloud Data Platform Architecture,Data Security & Privacy,Technology Selection & Trade-offs",Staff DE,DataInterview
Databricks,How would you implement real-time feature engineering at scale?,Staff,Feature Engineering & Data Strategy,"Feature Engineering & Data Strategy,Streaming & Real-time Processing,Cloud Data Platform Architecture",Staff DE,DataCamp
MongoDB,Design a data pipeline for edge AI analytics,Senior,Streaming & Real-time Processing,"Streaming & Real-time Processing,Big Data Technologies & Frameworks,Data Pipeline Design & Architecture",Senior DE,DataCamp
Elastic,How would you handle multi-modal enterprise search?,Senior,Big Data Technologies,"Big Data Technologies & Frameworks,Feature Engineering & Data Strategy,Data Pipeline Design & Architecture",Senior DE,DataCamp
Confluent,Design a streaming platform for smart city analytics,Staff,Streaming & Real-time Processing,"Streaming & Real-time Processing,Big Data Technologies & Frameworks,Data Pipeline Design & Architecture",Staff DE,DataCamp
Palantir,How would you implement ethical AI surveillance systems?,Staff,Ethics & Responsible AI,"Ethics & Responsible AI,Data Security & Privacy,Data Quality & Governance",Staff DE,DataCamp
Splunk,Design a data pipeline for climate monitoring analytics,Senior,Streaming & Real-time Processing,"Streaming & Real-time Processing,Data Pipeline Design & Architecture,Big Data Technologies & Frameworks",Senior DE,DataCamp
Stripe,How would you handle digital currency analytics?,Staff,Data Security & Privacy,"Data Security & Privacy,Big Data Technologies & Frameworks,Data Pipeline Design & Architecture",Staff DE,DataCamp
Shopify,Design a data architecture for metaverse commerce,Staff,Streaming & Real-time Processing,"Streaming & Real-time Processing,Data Warehouse & Lake Architecture,Big Data Technologies & Frameworks",Staff DE,DataCamp
DoorDash,How would you implement drone delivery optimization analytics?,Staff,Streaming & Real-time Processing,"Streaming & Real-time Processing,Big Data Technologies & Frameworks,Data Pipeline Design & Architecture",Staff DE,DataCamp
Instacart,Design a data pipeline for vertical farming optimization,Senior,Streaming & Real-time Processing,"Streaming & Real-time Processing,Data Pipeline Design & Architecture,Data Quality & Governance",Senior DE,DataCamp
Robinhood,How would you handle algorithmic trading transparency?,Senior,Data Quality & Governance,"Data Quality & Governance,Ethics & Responsible AI,Data Security & Privacy",Senior DE,DataCamp
Coinbase,Design a data warehouse for DAO governance analytics,Staff,Big Data Technologies,"Big Data Technologies & Frameworks,Data Warehouse & Lake Architecture,Data Security & Privacy",Staff DE,DataCamp
Discord,How would you implement metaverse social analytics?,Senior,Streaming & Real-time Processing,"Streaming & Real-time Processing,Data Pipeline Design & Architecture,Feature Engineering & Data Strategy",Senior DE,DataCamp
OpenAI,Design a data architecture for AGI safety monitoring,Staff,Data Quality & Governance,"Data Quality & Governance,Ethics & Responsible AI,Big Data Technologies & Frameworks",Staff DE,DataCamp
Anthropic,How would you implement value alignment evaluation pipelines?,Staff,Ethics & Responsible AI,"Ethics & Responsible AI,Data Quality & Governance,Feature Engineering & Data Strategy",Staff DE,DataCamp
Google,Design a data pipeline for neuromorphic computing research,Staff,Big Data Technologies,"Big Data Technologies & Frameworks,Cloud Data Platform Architecture,Performance Optimization & Tuning",Staff DE,DataCamp
Meta,How would you handle brain-computer interface data ethics?,Staff,Data Security & Privacy,"Data Security & Privacy,Ethics & Responsible AI,Data Quality & Governance",Staff DE,DataCamp
Amazon,Design a data architecture for interplanetary communications,Staff,Streaming & Real-time Processing,"Streaming & Real-time Processing,Big Data Technologies & Frameworks,Cloud Data Platform Architecture",Staff DE,DataCamp
Apple,How would you implement privacy-preserving health research analytics?,Staff,Data Security & Privacy,"Data Security & Privacy,Data Quality & Governance,Technical Communication",Staff DE,DataCamp
Netflix,Design a data pipeline for personalized content generation,Staff,Feature Engineering & Data Strategy,"Feature Engineering & Data Strategy,Data Pipeline Design & Architecture,Ethics & Responsible AI",Staff DE,DataCamp
Microsoft,How would you optimize quantum-classical hybrid computing analytics?,Staff,Big Data Technologies,"Big Data Technologies & Frameworks,Cloud Data Platform Architecture,Performance Optimization & Tuning",Staff DE,DataCamp
Tesla,Design a data architecture for human-robot collaboration,Staff,Streaming & Real-time Processing,"Streaming & Real-time Processing,Ethics & Responsible AI,Data Pipeline Design & Architecture",Staff DE,DataCamp
Uber,How would you handle hyperloop transportation analytics?,Staff,Streaming & Real-time Processing,"Streaming & Real-time Processing,Big Data Technologies & Frameworks,Data Pipeline Design & Architecture",Staff DE,DataCamp
Airbnb,Design a data pipeline for space tourism analytics,Staff,Data Pipeline Architecture,"Data Pipeline Design & Architecture,Data Security & Privacy,Business Requirements Analysis",Staff DE,DataCamp
LinkedIn,How would you implement bias detection in recruitment analytics?,Staff,Ethics & Responsible AI,"Ethics & Responsible AI,Data Quality & Governance,Feature Engineering & Data Strategy",Staff DE,DataCamp
Salesforce,Design a data architecture for autonomous CRM analytics,Staff,Feature Engineering & Data Strategy,"Feature Engineering & Data Strategy,Cloud Data Platform Architecture,Ethics & Responsible AI",Staff DE,DataCamp
Adobe,How would you handle synthetic media detection analytics?,Senior,Data Quality & Governance,"Data Quality & Governance,Feature Engineering & Data Strategy,Ethics & Responsible AI",Senior DE,DataCamp
Spotify,Design a data pipeline for AI-generated music analytics,Senior,Feature Engineering & Data Strategy,"Feature Engineering & Data Strategy,Data Pipeline Design & Architecture,Ethics & Responsible AI",Senior DE,DataCamp
Snowflake,How would you implement privacy-preserving collaborative analytics?,Staff,Data Security & Privacy,"Data Security & Privacy,Cloud Data Platform Architecture,Data Quality & Governance",Staff DE,DataInterview
Databricks,Design an automated data product creation platform,Staff,Data Quality & Governance,"Data Quality & Governance,Cloud Data Platform Architecture,Feature Engineering & Data Strategy",Staff DE,DataCamp
MongoDB,How would you implement autonomous database optimization?,Senior,Performance Optimization,"Performance Optimization & Tuning,Data Pipeline Design & Architecture,Big Data Technologies & Frameworks",Senior DE,DataCamp
Elastic,Design a real-time knowledge graph analytics system,Staff,Big Data Technologies,"Big Data Technologies & Frameworks,Streaming & Real-time Processing,Data Pipeline Design & Architecture",Staff DE,DataCamp
Confluent,How would you handle digital consciousness analytics?,Staff,Streaming & Real-time Processing,"Streaming & Real-time Processing,Ethics & Responsible AI,Big Data Technologies & Frameworks",Staff DE,DataCamp
Palantir,Design an ethical AI governance platform,Staff,Ethics & Responsible AI,"Ethics & Responsible AI,Data Security & Privacy,Data Quality & Governance",Staff DE,DataCamp
Splunk,How would you implement planetary defense analytics?,Staff,Streaming & Real-time Processing,"Streaming & Real-time Processing,Big Data Technologies & Frameworks,Data Pipeline Design & Architecture",Staff DE,DataCamp
Stripe,Design a data pipeline for universal basic income distribution,Staff,Data Security & Privacy,"Data Security & Privacy,Data Quality & Governance,Business Requirements Analysis",Staff DE,DataCamp
Shopify,How would you handle post-scarcity economy analytics?,Staff,Data Warehouse Design,"Data Warehouse & Lake Architecture,Business Requirements Analysis,Ethics & Responsible AI",Staff DE,DataCamp
DoorDash,Design a data architecture for teleportation logistics,Staff,Data Pipeline Architecture,"Data Pipeline Design & Architecture,Big Data Technologies & Frameworks,Performance Optimization & Tuning",Staff DE,DataCamp
Instacart,How would you implement lab-grown food analytics?,Senior,Data Quality & Governance,"Data Quality & Governance,Data Pipeline Design & Architecture,Business Requirements Analysis",Senior DE,DataCamp
Robinhood,Design a time-travel paradox prevention system,Staff,Ethics & Responsible AI,"Ethics & Responsible AI,Data Quality & Governance,Technical Communication",Staff DE,DataCamp
Coinbase,How would you handle multiverse currency analytics?,Staff,Big Data Technologies,"Big Data Technologies & Frameworks,Data Warehouse & Lake Architecture,Data Security & Privacy",Staff DE,DataCamp
Discord,Design a data pipeline for telepathic communication,Staff,Data Security & Privacy,"Data Security & Privacy,Ethics & Responsible AI,Streaming & Real-time Processing",Staff DE,DataCamp
OpenAI,How would you implement AGI emergence detection?,Staff,Ethics & Responsible AI,"Ethics & Responsible AI,Data Quality & Governance,Big Data Technologies & Frameworks",Staff DE,DataCamp
Anthropic,Design an existential risk assessment framework,Staff,Ethics & Responsible AI,"Ethics & Responsible AI,Data Quality & Governance,Data Security & Privacy",Staff DE,DataCamp
Google,How would you optimize data pipelines for quantum supremacy?,Staff,Big Data Technologies,"Big Data Technologies & Frameworks,Performance Optimization & Tuning,Cloud Data Platform Architecture",Staff DE,DataCamp
Meta,Design a data architecture for collective consciousness analytics,Staff,Ethics & Responsible AI,"Ethics & Responsible AI,Data Security & Privacy,Big Data Technologies & Frameworks",Staff DE,DataCamp
Amazon,How would you handle galactic commerce data analytics?,Staff,Data Warehouse Design,"Data Warehouse & Lake Architecture,Big Data Technologies & Frameworks,Performance Optimization & Tuning",Staff DE,DataCamp
Apple,Design a data pipeline for consciousness transfer analytics,Staff,Data Security & Privacy,"Data Security & Privacy,Ethics & Responsible AI,Data Quality & Governance",Staff DE,DataCamp
Netflix,How would you implement reality synthesis analytics?,Staff,Feature Engineering & Data Strategy,"Feature Engineering & Data Strategy,Ethics & Responsible AI,Data Pipeline Design & Architecture",Staff DE,DataCamp
Microsoft,Design a data architecture for universe simulation,Staff,Big Data Technologies,"Big Data Technologies & Frameworks,Performance Optimization & Tuning,Cloud Data Platform Architecture",Staff DE,DataCamp
Tesla,How would you handle time manipulation analytics?,Staff,Ethics & Responsible AI,"Ethics & Responsible AI,Data Quality & Governance,Performance Optimization & Tuning",Staff DE,DataCamp
Uber,Design a data pipeline for dimensional travel logistics,Staff,Data Pipeline Architecture,"Data Pipeline Design & Architecture,Big Data Technologies & Frameworks,Ethics & Responsible AI",Staff DE,DataCamp
Airbnb,How would you implement cosmic hospitality analytics?,Staff,Data Warehouse Design,"Data Warehouse & Lake Architecture,Business Requirements Analysis,Ethics & Responsible AI",Staff DE,DataCamp
LinkedIn,Design a data architecture for universal knowledge sharing,Staff,Feature Engineering & Data Strategy,"Feature Engineering & Data Strategy,Ethics & Responsible AI,Data Quality & Governance",Staff DE,DataCamp
Salesforce,How would you handle omniscient customer relationship management?,Staff,Ethics & Responsible AI,"Ethics & Responsible AI,Data Quality & Governance,Business Requirements Analysis",Staff DE,DataCamp
Adobe,Design a data pipeline for reality creation analytics,Staff,Feature Engineering & Data Strategy,"Feature Engineering & Data Strategy,Ethics & Responsible AI,Data Pipeline Design & Architecture",Staff DE,DataCamp
Spotify,How would you implement universal harmony analytics?,Staff,Ethics & Responsible AI,"Ethics & Responsible AI,Data Quality & Governance,Feature Engineering & Data Strategy",Staff DE,DataCamp
Snowflake,Design a data architecture for infinite scalability,Staff,Performance Optimization,"Performance Optimization & Tuning,Cloud Data Platform Architecture,Big Data Technologies & Frameworks",Staff DE,DataInterview
Databricks,How would you handle self-aware data systems?,Staff,Ethics & Responsible AI,"Ethics & Responsible AI,Data Quality & Governance,Big Data Technologies & Frameworks",Staff DE,DataCamp
MongoDB,Design a data pipeline for conscious data evolution,Staff,Ethics & Responsible AI,"Ethics & Responsible AI,Performance Optimization & Tuning,Data Quality & Governance",Staff DE,DataCamp
Elastic,How would you implement omniscient search analytics?,Staff,Big Data Technologies,"Big Data Technologies & Frameworks,Ethics & Responsible AI,Performance Optimization & Tuning",Staff DE,DataCamp
Confluent,Design a streaming platform for cosmic consciousness,Staff,Streaming & Real-time Processing,"Streaming & Real-time Processing,Ethics & Responsible AI,Big Data Technologies & Frameworks",Staff DE,DataCamp
Palantir,How would you handle universal truth analytics?,Staff,Ethics & Responsible AI,"Ethics & Responsible AI,Data Quality & Governance,Data Security & Privacy",Staff DE,DataCamp
Splunk,Design a data architecture for multiverse monitoring,Staff,Big Data Technologies,"Big Data Technologies & Frameworks,Performance Optimization & Tuning,Ethics & Responsible AI",Staff DE,DataCamp
Stripe,How would you implement infinite economic optimization?,Staff,Ethics & Responsible AI,"Ethics & Responsible AI,Business Requirements Analysis,Data Quality & Governance",Staff DE,DataCamp
Shopify,Design a data pipeline for transcendent commerce,Staff,Ethics & Responsible AI,"Ethics & Responsible AI,Data Warehouse & Lake Architecture,Business Requirements Analysis",Staff DE,DataCamp
DoorDash,How would you handle instant matter materialization analytics?,Staff,Ethics & Responsible AI,"Ethics & Responsible AI,Performance Optimization & Tuning,Data Pipeline Design & Architecture",Staff DE,DataCamp
Instacart,Design a data architecture for universal sustenance,Staff,Ethics & Responsible AI,"Ethics & Responsible AI,Data Quality & Governance,Business Requirements Analysis",Staff DE,DataCamp
Robinhood,How would you implement omniscient financial optimization?,Staff,Ethics & Responsible AI,"Ethics & Responsible AI,Data Security & Privacy,Business Requirements Analysis",Staff DE,DataCamp
Coinbase,Design a data pipeline for infinite value creation,Staff,Ethics & Responsible AI,"Ethics & Responsible AI,Big Data Technologies & Frameworks,Data Quality & Governance",Staff DE,DataCamp
Discord,How would you handle universal communication analytics?,Staff,Ethics & Responsible AI,"Ethics & Responsible AI,Streaming & Real-time Processing,Data Quality & Governance",Staff DE,DataCamp
OpenAI,Design a data architecture for supreme intelligence,Staff,Ethics & Responsible AI,"Ethics & Responsible AI,Big Data Technologies & Frameworks,Data Quality & Governance",Staff DE,DataCamp
Anthropic,How would you implement perfect ethical analytics?,Staff,Ethics & Responsible AI,"Ethics & Responsible AI,Data Quality & Governance,Data Security & Privacy",Staff DE,DataCamp