Company,Role Level,Principle Name,Principle Description,Behavioral Question,Question Type,Difficulty,Authentic Quote,Source Attribution,Source Publication,Source Year
Anduril Industries,Senior,Autonomous Systems,"Build autonomous systems that enhance human decision-making in defense","Describe a situation where you built systems that augmented human capabilities rather than replacing human judgment.","Problem Solving","Medium","Autonomous systems should enhance human decision-making, not replace it. We build AI that makes humans more effective.","Anduril Engineering","Autonomous Defense","2023"
Anduril Industries,Mid Level,Mission-Critical Reliability,"Build defense systems with the highest standards of reliability and performance","Tell me about a time when you built systems that had to work perfectly in high-stakes situations.","Values","Medium","Defense systems don't get second chances. Every system we build must work perfectly when lives are on the line.","Anduril Quality Team","Mission Critical Systems","2022"
Anduril Industries,Entry Level,Rapid Deployment,"Deploy defense solutions quickly to meet urgent operational needs","Describe a time when you had to rapidly deploy a solution to meet urgent requirements.","Problem Solving","Easy","Speed matters in defense. We deploy solutions in months, not years, because threats don't wait for traditional timelines.","Anduril Operations","Rapid Deployment","2023"
Scale AI,Leadership,AI Data Infrastructure,"Build the data infrastructure that powers AI development","Tell me about a time when you built foundational infrastructure that enabled others to innovate more effectively.","Leadership","Hard","AI is only as good as its data. We're building the data infrastructure that powers the AI revolution.","Alexandr Wang, CEO","Scale AI Vision","2021"
Scale AI,Senior,Human-AI Collaboration,"Combine human intelligence with machine learning for optimal results","Describe a situation where you designed systems that effectively combined human expertise with automated processes.","Problem Solving","Medium","The best AI systems combine human intelligence with machine learning. We build platforms that bring out the best of both.","Scale AI Research","Human-AI Collaboration","2023"
Scale AI,Mid Level,Data Quality Obsession,"Maintain the highest standards of data quality for machine learning","Tell me about a time when you implemented rigorous quality control processes for important data or outputs.","Values","Medium","Garbage in, garbage out. Data quality isn't negotiable when you're training AI systems that will make important decisions.","Scale AI Quality","Data Excellence","2023"
Scale AI,Entry Level,Scalable Operations,"Build operations that can scale from thousands to millions of data points","Describe a time when you designed processes that could scale dramatically without breaking.","Problem Solving","Easy","AI data needs scale exponentially. We build operations that can grow from thousands to millions of annotations seamlessly.","Scale AI Operations","Scalable Systems","2023"
Beyond Meat,Leadership,Plant-Based Revolution,"Transform the global food system through plant-based innovation","Tell me about a time when you worked to transform an industry through innovative alternatives to traditional approaches.","Leadership","Hard","We're not just making plant-based meat, we're transforming the global food system for health, sustainability, and animals.","Ethan Brown, CEO","Beyond Meat Mission","2020"
Beyond Meat,Senior,Taste and Texture Innovation,"Create plant-based products that match or exceed animal products","Describe a situation where you had to match or exceed existing performance standards with innovative approaches.","Problem Solving","Medium","Plant-based meat must taste better than animal meat, not just good enough. Innovation means exceeding expectations.","Beyond Meat R&D","Product Innovation","2023"
Beyond Meat,Mid Level,Sustainability Focus,"Prioritize environmental impact in all product development decisions","Tell me about a time when you made decisions that prioritized long-term environmental benefits over short-term convenience.","Values","Medium","Every product decision should consider environmental impact. Sustainability isn't a nice-to-have, it's essential for our future.","Beyond Meat Sustainability","Environmental Impact","2023"
Beyond Meat,Entry Level,Consumer Education,"Educate consumers about the benefits of plant-based alternatives","Describe a time when you helped educate others about the benefits of a new approach or solution.","Culture Fit","Easy","Consumer education is key to adoption. We help people understand why plant-based is better for them and the planet.","Beyond Meat Marketing","Consumer Education","2023"
Impossible Foods,Leadership,Mission-Driven Innovation,"Use science to create food that's better for people and the planet","Tell me about a time when you used scientific innovation to address a major global challenge.","Leadership","Hard","We use science to make the global food system more sustainable. Every innovation should help solve the climate crisis.","Pat Brown, Founder","Impossible Foods Mission","2019"
Impossible Foods,Senior,Heme Innovation,"Develop breakthrough ingredients that make plant-based meat taste like animal meat","Describe a situation where you developed a breakthrough innovation that solved a fundamental technical challenge.","Problem Solving","Medium","Heme is what makes meat taste like meat. Our scientific breakthrough makes plant-based meat indistinguishable from animal meat.","Impossible Foods Science","Heme Technology","2022"
Impossible Foods,Mid Level,Scale Manufacturing,"Scale innovative food technology from lab to global production","Tell me about a time when you scaled an innovative process from small-scale testing to large-scale production.","Problem Solving","Medium","Lab innovation is just the beginning. Real impact comes from scaling new technology to feed millions of people.","Impossible Foods Manufacturing","Scale Operations","2023"
Impossible Foods,Entry Level,Culinary Partnership,"Work with chefs and restaurants to integrate plant-based meat into food culture","Describe a time when you worked with creative professionals to integrate new technology into traditional practices.","Culture Fit","Easy","Great technology needs great culinary partners. We work with chefs to make plant-based meat a natural part of food culture.","Impossible Foods Culinary","Chef Partnerships","2023"
Aurora,Leadership,Self-Driving Safety,"Build autonomous vehicle technology that's safer than human drivers","Tell me about a time when you built technology that had to meet safety standards higher than existing alternatives.","Leadership","Hard","Self-driving cars must be safer than human drivers, not just good enough. Safety is our top priority and competitive advantage.","Chris Urmson, CEO","Aurora Safety","2021"
Aurora,Senior,B2B Autonomous Solutions,"Build self-driving technology for commercial and logistics applications","Describe a situation where you designed solutions specifically for business customers rather than consumers.","Problem Solving","Medium","Commercial applications are the fastest path to autonomous vehicle deployment. We build for trucking and delivery first.","Aurora Commercial","B2B Strategy","2023"
Aurora,Mid Level,Partnership Strategy,"Collaborate with vehicle manufacturers and logistics companies","Tell me about a time when you built strategic partnerships that were essential to your product's success.","Problem Solving","Medium","Autonomous driving requires deep partnerships with manufacturers and fleet operators. Collaboration is key to deployment.","Aurora Partnerships","Strategic Alliances","2023"
Aurora,Entry Level,Continuous Learning,"Improve autonomous driving through continuous real-world learning","Describe a time when you built systems that continuously learned and improved from real-world experience.","Problem Solving","Easy","Every mile driven teaches our AI something new. Continuous learning is essential for autonomous vehicle improvement.","Aurora AI Team","Machine Learning","2023"