Company,Role Level,Principle Name,Principle Description,Behavioral Question,Question Type,Difficulty,Authentic Quote,Source Attribution,Source Publication,Source Year
Palantir,Mid Level,Data-Driven Decision Making,"Use data and evidence to guide important decisions","Tell me about a time when you used data analysis to challenge conventional wisdom or popular assumptions.","Problem Solving","Medium","Opinions are cheap. Data is expensive. We make decisions based on evidence, not intuition.","Palantir Analytics Team","Data Science Methodology","2023"
Palantir,Entry Level,Complex Systems Thinking,"Approach problems by understanding interconnected systems and relationships","Describe a time when you solved a problem by understanding how different parts of a system connected to each other.","Problem Solving","Easy","Real-world problems exist in complex systems. Understanding connections and relationships is crucial to solving them.","Palantir Engineering","Systems Thinking Guide","2023"
DoorDash,Leadership,Customer Obsession,"Every decision should benefit customers, dashers, or merchants in our marketplace","Tell me about a time when you made a decision that prioritized long-term customer value over short-term business metrics.","Leadership","Hard","Our customers are our compass. Every product decision, every feature, every policy should make their experience better.","Tony Xu, CEO","DoorDash Values","2022"
DoorDash,Senior,Logistics Innovation,"Continuously innovate in last-mile delivery and logistics optimization","Describe a situation where you optimized a complex logistics or operational process to improve efficiency.","Problem Solving","Medium","Logistics is our competitive advantage. Every minute saved, every mile optimized, every delivery improved matters.","DoorDash Operations","Logistics Innovation","2023"
DoorDash,Mid Level,Marketplace Balance,"Balance the needs of customers, drivers, and restaurants in our three-sided marketplace","Tell me about a time when you had to balance competing interests from multiple stakeholder groups.","Problem Solving","Medium","We succeed when all sides of our marketplace succeed. Balancing needs isn't easy, but it's essential.","DoorDash Product Team","Marketplace Strategy","2023"
DoorDash,Entry Level,Hustle and Grit,"Execute with urgency and persistence in competitive markets","Describe a time when you had to execute quickly and persistently despite significant obstacles or competition.","Culture Fit","Easy","This is a competitive market where execution speed matters. Hustle and grit separate winners from everyone else.","DoorDash Early Team","Startup Culture","2020"
Instacart,Leadership,Groceries for Everyone,"Make fresh groceries accessible to everyone, everywhere","Tell me about a time when you worked to make an essential service more accessible to underserved communities.","Leadership","Hard","Fresh groceries shouldn't be a luxury. We're building technology to make nutritious food accessible to everyone.","Fidji Simo, CEO","Instacart Mission","2022"
Instacart,Senior,Shopper Empowerment,"Enable personal shoppers to build flexible, profitable work opportunities","Describe a situation where you created opportunities for others to build income and develop skills.","Values","Medium","Our shoppers are the heart of our service. We build tools and opportunities that help them succeed financially.","Instacart Shopper Success","Shopper Experience","2023"
Instacart,Mid Level,Retail Innovation,"Transform how people discover, shop for, and receive groceries","Tell me about a time when you innovated within a traditional industry by introducing new technology or processes.","Problem Solving","Medium","Grocery is a traditional industry ready for innovation. We're reimagining every step of the shopping experience.","Instacart Product Innovation","Retail Technology","2023"
Instacart,Entry Level,Quality and Freshness,"Ensure customers receive the highest quality groceries in perfect condition","Describe a time when you maintained high quality standards despite pressure to compromise or move faster.","Values","Easy","Quality isn't negotiable when it comes to food. Every order should meet the standard we'd want for our own families.","Instacart Quality Team","Quality Standards","2023"
Stripe,Leadership,Internet Infrastructure,"Build the financial infrastructure for the internet economy","Tell me about a time when you built foundational systems or infrastructure that enabled others to succeed.","Leadership","Hard","We're building the economic infrastructure of the internet. Every API, every feature should enable more businesses to succeed online.","Patrick Collison, CEO","Stripe Mission","2021"
Stripe,Senior,Developer Experience,"Create tools that developers love to use and integrate","Describe a situation where you designed a technical product or system with exceptional user experience for technical users.","Problem Solving","Medium","Great developer experience isn't accidental. Every API, every SDK, every piece of documentation should delight developers.","Stripe Engineering","Developer Experience","2023"
Stripe,Mid Level,Global Commerce,"Enable businesses to accept payments and operate globally from day one","Tell me about a time when you built solutions that worked across different countries, currencies, or regulatory environments.","Problem Solving","Medium","Commerce is global, but payments are local. We abstract away complexity so businesses can focus on their customers.","Stripe Global Team","International Expansion","2022"
Stripe,Entry Level,Trust and Security,"Build payment systems with the highest standards of security and reliability","Describe a time when you implemented security measures that protected sensitive information or transactions.","Values","Easy","We handle people's money and businesses' livelihoods. Security and reliability aren't features, they're foundations.","Stripe Security Team","Payment Security","2023"
Zoom,Leadership,Frictionless Communications,"Make video communications as easy as using the telephone","Tell me about a time when you simplified a complex process to make it accessible to non-technical users.","Leadership","Hard","Video conferencing used to be complicated and expensive. We made it simple, reliable, and accessible to everyone.","Eric Yuan, CEO","Zoom Philosophy","2019"
Zoom,Senior,Remote Work Enablement,"Build tools that make remote work as effective as in-person collaboration","Describe a situation where you created solutions that enabled effective remote collaboration or productivity.","Problem Solving","Medium","Remote work isn't just possible, it can be better than in-person when you have the right tools.","Zoom Product Team","Remote Work Solutions","2022"
Zoom,Mid Level,Platform Extensibility,"Create platforms that enable third-party developers and integrations","Tell me about a time when you built systems that allowed others to extend or customize your solution.","Problem Solving","Medium","The best platforms enable innovation we never imagined. We build extensible systems that our ecosystem can build upon.","Zoom Developer Platform","API Strategy","2023"
Zoom,Entry Level,Reliability First,"Ensure consistent, high-quality experience across all devices and networks","Describe a time when you prioritized reliability and consistency over adding new features.","Values","Easy","When people depend on you for important conversations, reliability isn't optional. Quality first, features second.","Zoom Engineering","Quality Standards","2023"
Canva,Leadership,Design Democratization,"Make design accessible to everyone, not just professionals","Tell me about a time when you took expert-level capabilities and made them accessible to beginners.","Leadership","Hard","Design should be accessible to everyone, not just people with years of training. We democratize creativity.","Melanie Perkins, CEO","Canva Mission","2020"
Canva,Senior,Template Innovation,"Create templates and tools that inspire creativity while maintaining usability","Describe a situation where you balanced creative freedom with ease of use in a product or system.","Problem Solving","Medium","Great templates inspire creativity while maintaining simplicity. We make complex design principles accessible through intuitive tools.","Canva Design Team","Template Philosophy","2023"
Canva,Mid Level,Global Accessibility,"Build design tools that work across languages, cultures, and skill levels","Tell me about a time when you created solutions that worked effectively for diverse global audiences.","Culture Fit","Medium","Design is universal, but preferences are cultural. We build tools that respect both similarity and diversity.","Canva International","Global Design","2022"
Canva,Entry Level,Collaborative Creation,"Enable teams to create and collaborate on designs together","Describe a time when you facilitated effective collaboration on a creative or design project.","Culture Fit","Easy","The best designs come from collaboration. We build tools that make team creativity natural and fun.","Canva Collaboration","Team Features","2023"
Discord,Leadership,Community Building,"Create technology that helps people form and maintain communities","Tell me about a time when you built tools or systems that brought people together around shared interests.","Leadership","Hard","We're not just building chat software, we're building the infrastructure for human connection and community.","Jason Citron, CEO","Discord Vision","2021"
Discord,Senior,Gaming-First Culture,"Design experiences optimized for gamers and gaming communities","Describe a situation where you designed solutions specifically for a niche community's unique needs.","Culture Fit","Medium","We started with gamers because they have the highest standards for communication tools. Gaming-first design makes everything better.","Discord Product Team","Gaming Community","2022"
Discord,Mid Level,Voice and Text Integration,"Seamlessly blend voice chat, text messaging, and community features","Tell me about a time when you integrated multiple communication channels into a cohesive user experience.","Problem Solving","Medium","Communication isn't just voice or just text - it's both, flowing naturally as people need different ways to connect.","Discord Engineering","Communication Design","2023"
Discord,Entry Level,Server Customization,"Give communities powerful tools to customize their experience","Describe a time when you provided customization options that allowed users to tailor a system to their specific needs.","Problem Solving","Easy","Every community is unique. We give server owners the tools to create exactly the experience their community needs.","Discord Community Success","Server Management","2023"
Shopify,Leadership,Entrepreneurship Enablement,"Empower entrepreneurs to start, run, and grow businesses","Tell me about a time when you created tools or opportunities that enabled others to start or grow their businesses.","Leadership","Hard","We believe entrepreneurship is a force for good. Every feature we build should help someone start or grow their business.","Tobias Ltke, CEO","Shopify Mission","2021"
Shopify,Senior,Commerce Innovation,"Continuously innovate in e-commerce technology and merchant tools","Describe a situation where you innovated within traditional commerce by introducing new technology or processes.","Problem Solving","Medium","Commerce is evolving rapidly. We build tools that help merchants stay ahead of changes and opportunities.","Shopify Product Innovation","Commerce Technology","2023"
Shopify,Mid Level,Merchant Success,"Measure success by the success of merchants using our platform","Tell me about a time when you aligned your success metrics with your customers' success outcomes.","Values","Medium","We succeed when merchants succeed. Every decision should help them sell more, operate better, and grow faster.","Shopify Merchant Success","Platform Strategy","2022"
Shopify,Entry Level,Plus Merchant Focus,"Build enterprise-grade solutions for growing businesses","Describe a time when you built solutions that could scale from small businesses to enterprise needs.","Problem Solving","Easy","Growing businesses need tools that grow with them. We build platforms that scale from startup to enterprise.","Shopify Plus Team","Enterprise Solutions","2023"
Slack,Leadership,Transform Work Communication,"Make work communication more efficient, transparent, and enjoyable","Tell me about a time when you transformed how a team or organization communicated and collaborated.","Leadership","Hard","Email is broken for modern work. We're building communication tools that make work more human and more productive.","Stewart Butterfield, Former CEO","Slack Philosophy","2019"
Slack,Senior,Channel-Based Organization,"Organize work communication around projects, topics, and teams","Describe a situation where you organized complex information or workflows into clear, logical structures.","Problem Solving","Medium","Channels organize conversations like folders organize files. Structure creates clarity in complex work environments.","Slack Product Team","Channel Strategy","2022"
Slack,Mid Level,Integration Ecosystem,"Connect all work tools through seamless integrations","Tell me about a time when you created connections between different systems to improve overall workflow efficiency.","Problem Solving","Medium","Work happens across many tools. We create the connective tissue that makes all your tools work better together.","Slack Platform Team","Integration Platform","2023"
Slack,Entry Level,Transparency and Inclusion,"Make work communication more transparent and inclusive for all team members","Describe a time when you designed processes that increased transparency and inclusion in team communication.","Culture Fit","Easy","Great communication is transparent and inclusive. Everyone should have access to the information they need to do their best work.","Slack Culture Team","Inclusive Communication","2023"
Twilio,Leadership,Software Communication Revolution,"Enable every developer to build communication into their applications","Tell me about a time when you built tools or platforms that enabled others to create things you hadn't imagined.","Leadership","Hard","We democratize communications. Every developer should be able to add voice, text, and video to their applications with simple APIs.","Jeff Lawson, Former CEO","Twilio Mission","2020"
Twilio,Senior,API-First Design,"Build communication primitives that developers can combine in infinite ways","Describe a situation where you designed flexible building blocks that could be combined to solve diverse problems.","Problem Solving","Medium","We don't build applications, we build primitives. APIs should be like Lego blocks - simple, powerful, infinitely combinable.","Twilio Engineering","API Design Philosophy","2022"
Twilio,Mid Level,Customer Success Engineering,"Engineer solutions that directly solve customer communication challenges","Tell me about a time when you engineered a technical solution that directly addressed specific customer pain points.","Problem Solving","Medium","We're not just building technology, we're solving communication challenges for real businesses with real customers.","Twilio Solutions Engineering","Customer Success","2023"
Twilio,Entry Level,Reliable Communications,"Ensure communication APIs work consistently across global infrastructure","Describe a time when you prioritized reliability and consistency in a system that others depended on.","Values","Easy","When our APIs fail, our customers' customers can't communicate. Reliability isn't just important, it's existential.","Twilio Infrastructure","Platform Reliability","2023"
Datadog,Leadership,Observability for All,"Make application and infrastructure monitoring accessible to every developer","Tell me about a time when you took complex technical capabilities and made them accessible to a broader audience.","Leadership","Hard","Every developer should understand how their code performs in production. We democratize observability.","Olivier Pomel, CEO","Datadog Vision","2021"
Datadog,Senior,Full-Stack Monitoring,"Provide comprehensive visibility across applications, infrastructure, and business metrics","Describe a situation where you created systems that provided comprehensive visibility into complex processes.","Problem Solving","Medium","Modern applications are complex systems. You need visibility across every layer to understand what's really happening.","Datadog Engineering","Monitoring Strategy","2023"
Datadog,Mid Level,Real-Time Analytics,"Process and analyze massive amounts of operational data in real-time","Tell me about a time when you built systems that could process and analyze large amounts of data quickly.","Problem Solving","Medium","In production, yesterday's data is too late. Real-time analytics enable real-time problem solving.","Datadog Analytics Team","Real-Time Processing","2022"
Datadog,Entry Level,Alert Optimization,"Create intelligent alerting that reduces noise while catching real issues","Describe a time when you designed notification or alerting systems that balanced thoroughness with usability.","Problem Solving","Easy","Alert fatigue is real. Intelligent alerting means getting the right information to the right people at the right time.","Datadog Alerts Team","Alert Strategy","2023"
MongoDB,Leadership,Modern Application Data,"Build database technology for modern application development","Tell me about a time when you built technology specifically designed for emerging use cases rather than existing patterns.","Leadership","Hard","Relational databases were built for a different era. We build data platforms for modern applications and modern developers.","Dev Ittycheria, CEO","MongoDB Vision","2020"
MongoDB,Senior,Developer Experience Focus,"Make database technology that developers love to use","Describe a situation where you prioritized developer experience and usability in technical architecture decisions.","Problem Solving","Medium","The best database is the one developers want to use. Developer experience drives adoption and innovation.","MongoDB Developer Relations","Developer Experience","2023"
MongoDB,Mid Level,Flexible Data Models,"Enable applications to evolve their data structures without painful migrations","Tell me about a time when you designed systems that could adapt to changing requirements without major restructuring.","Problem Solving","Medium","Applications evolve constantly. Data platforms should evolve with them, not constrain them.","MongoDB Product Team","Schema Flexibility","2022"
MongoDB,Entry Level,Atlas Cloud Platform,"Provide fully managed database services that scale automatically","Describe a time when you automated complex operational tasks to improve reliability and reduce manual work.","Problem Solving","Easy","Developers want to build applications, not manage databases. We automate operations so they can focus on innovation.","MongoDB Atlas Team","Cloud Operations","2023"
Snowflake,Leadership,Data Cloud Vision,"Build the infrastructure for data-driven organizations","Tell me about a time when you built foundational infrastructure that enabled others to make better decisions.","Leadership","Hard","We're building the data cloud that powers the modern enterprise. Every organization should be able to harness their data.","Frank Slootman, CEO","Snowflake Vision","2021"
Snowflake,Senior,Cloud-Native Architecture,"Design database technology specifically for cloud computing environments","Describe a situation where you architected solutions specifically for cloud environments rather than adapting legacy approaches.","Problem Solving","Medium","Cloud-native isn't just running in the cloud, it's being designed for the cloud from the ground up.","Snowflake Engineering","Cloud Architecture","2022"
Snowflake,Mid Level,Data Sharing Economy,"Enable secure data sharing and collaboration between organizations","Tell me about a time when you created systems that enabled secure collaboration between different organizations or teams.","Problem Solving","Medium","Data silos limit innovation. We build technology that enables secure data sharing while maintaining governance.","Snowflake Data Sharing","Collaboration Platform","2023"
Snowflake,Entry Level,Performance and Scale,"Provide consistent performance as data and workloads scale","Describe a time when you optimized systems to maintain performance under increasing load or complexity.","Problem Solving","Easy","Scale shouldn't mean sacrifice. Performance should be consistent whether you're analyzing gigabytes or petabytes.","Snowflake Performance","Scale Optimization","2023"
Okta,Leadership,Identity for Everyone,"Make secure identity management accessible to every organization","Tell me about a time when you made enterprise-grade security accessible to smaller organizations or teams.","Leadership","Hard","Identity is the foundation of security. Every organization deserves enterprise-grade identity management.","Todd McKinnon, CEO","Okta Mission","2020"
Okta,Senior,Zero Trust Security,"Build identity systems that never assume trust and always verify","Describe a situation where you implemented security measures that verified trust rather than assuming it.","Values","Medium","Never trust, always verify. Modern security requires identity verification at every step.","Okta Security Team","Zero Trust Strategy","2023"
Okta,Mid Level,Integration Platform,"Connect identity with every application and service in the enterprise","Tell me about a time when you created integration solutions that connected diverse systems seamlessly.","Problem Solving","Medium","Identity should work everywhere. We build the connections between people and all their applications.","Okta Integration Team","Platform Strategy","2022"
Okta,Entry Level,User Experience Security,"Make security convenient and user-friendly rather than burdensome","Describe a time when you made a security or compliance process more user-friendly without compromising protection.","Culture Fit","Easy","Security that's hard to use doesn't get used. We make secure identity as easy as possible for everyone.","Okta UX Team","Security Experience","2023"
Zscaler,Leadership,Zero Trust Network,"Build security architecture that trusts no one and verifies everyone","Tell me about a time when you implemented security measures that required verification at every level rather than assuming trust.","Leadership","Hard","Trust nothing, verify everything. The traditional network perimeter is dead. Zero trust is the future of cybersecurity.","Jay Chaudhry, CEO","Zscaler Zero Trust","2021"
Zscaler,Senior,Cloud-First Security,"Design security solutions specifically for cloud and mobile-first organizations","Describe a situation where you designed solutions specifically for mobile and cloud environments rather than traditional networks.","Problem Solving","Medium","The world has gone mobile and cloud-first. Security architectures must be built for this new reality.","Zscaler Engineering","Cloud Security","2023"
Zscaler,Mid Level,User Experience Security,"Make security invisible to users while maintaining protection","Tell me about a time when you improved security while making the user experience more seamless.","Problem Solving","Medium","The best security is invisible to users. Strong protection shouldn't create friction for legitimate activities.","Zscaler Product Team","Security UX","2023"
Zscaler,Entry Level,Threat Intelligence,"Use real-time threat intelligence to prevent attacks before they happen","Describe a time when you used data and intelligence to prevent problems before they occurred.","Problem Solving","Easy","Prevention is better than detection. Real-time threat intelligence helps us stop attacks before they start.","Zscaler ThreatLabz","Threat Research","2023"
Palo Alto Networks,Leadership,Cybersecurity Platform,"Build integrated security platforms rather than point solutions","Tell me about a time when you chose to build an integrated solution rather than using multiple separate tools.","Leadership","Hard","Cybersecurity is too important for point solutions. Integrated platforms provide better protection and simpler management.","Nikesh Arora, CEO","Platform Strategy","2022"
Palo Alto Networks,Senior,AI-Powered Security,"Use artificial intelligence to enhance cybersecurity effectiveness","Describe a situation where you used AI or machine learning to improve system performance or decision-making.","Problem Solving","Medium","AI isn't just a buzzword in security, it's essential. Machine learning helps us stay ahead of evolving threats.","Palo Alto AI Team","AI Security","2023"
Palo Alto Networks,Mid Level,Prevention-First Approach,"Focus on preventing cyberattacks rather than just detecting them","Tell me about a time when you focused on preventing problems rather than just responding to them after they occurred.","Values","Medium","Detection is important, but prevention is better. We build security that stops attacks, not just finds them.","Palo Alto Security Research","Prevention Strategy","2023"
Palo Alto Networks,Entry Level,Security Automation,"Automate security responses to reduce human error and response time","Describe a time when you automated manual processes to improve speed and accuracy.","Problem Solving","Easy","Human response time isn't fast enough for modern threats. Automation helps us respond at machine speed.","Palo Alto Automation","Security Operations","2023"
Anduril Industries,Leadership,Defense Innovation,"Bring Silicon Valley innovation to national defense and security","Tell me about a time when you brought innovative approaches to a traditional industry or conservative environment.","Leadership","Hard","American defense needs Silicon Valley speed and innovation. We're building the future of defense technology.","Palmer Luckey, Founder","Anduril Mission","2020"
