Company,Role Level,Principle Name,Principle Description,Behavioral Question,Question Type,Difficulty,Authentic Quote,Source Attribution,Source Publication,Source Year
Coinbase,Leadership,Increase Economic Freedom,"Our mission is to increase economic freedom in the world by creating an open financial system that is more fair, accessible, efficient, and transparent","Tell me about a time when you had to champion a controversial idea that you believed would create long-term value for people, despite facing significant pushback from stakeholders.","Leadership","Hard","Our mission is to increase economic freedom in the world. We believe economic freedom is a fundamental human right and are building products to advance this mission.","Brian Armstrong, CEO","Coinbase Blog","2023"
Coinbase,Senior,Be Builders,"Focus on building the future rather than complaining about the present","Describe a situation where instead of criticizing existing systems, you chose to build something better. What was your approach and what challenges did you overcome?","Problem Solving","Medium","The way you change the world is not by complaining about it, but by building something better.","Brian Armstrong, CEO","The Coinbase Blog","2021"
Coinbase,Mid Level,Think Long-Term,"Make decisions based on long-term impact rather than short-term gains","Tell me about a time when you had to make a decision that was unpopular in the short term but positioned your team or project for long-term success.","Values","Medium","We think in decades, not quarters. We make decisions based on long-term impact, not short-term gains.","Brian Armstrong, CEO","Coinbase Culture","2022"
Coinbase,Entry Level,Default to Transparency,"Be open and honest in communication while respecting privacy and legal constraints","Describe a time when you had to deliver difficult news transparently. How did you balance honesty with sensitivity?","Culture Fit","Easy","We default to transparency in everything we do, while respecting individual privacy and legal constraints.","Coinbase Values","Coinbase Careers","2024"
Coinbase,Leadership,Focus on What Matters,"Prioritize high-impact work and avoid getting distracted by less important activities","Tell me about a time when you had to say no to multiple good opportunities to focus on what would create the most impact.","Leadership","Hard","The secret to getting ahead is getting started. The secret to getting started is breaking your complex overwhelming tasks into small manageable tasks, and then starting on the first one.","Coinbase Leadership","Coinbase Internal Communications","2023"
Binance,Leadership,User-Centric Innovation,"Always put users first in every decision and innovation","Tell me about a time when you had to choose between what was easier for your company and what was better for your users. How did you approach this decision?","Leadership","Hard","If you don't build your dream, someone else will hire you to help them build theirs. We build for users, not for ourselves.","Changpeng Zhao, Former CEO","Binance Blog","2022"
Binance,Senior,Move Fast and Break Barriers,"Act with urgency while maintaining quality in a rapidly evolving industry","Describe a situation where you had to deliver results quickly in an uncertain environment. How did you balance speed with quality?","Problem Solving","Medium","In crypto, if you move fast, you break things. If you move slow, you die. We choose to move fast and fix things.","Changpeng Zhao, Former CEO","Binance Conference","2021"
Binance,Mid Level,Global Mindset,"Think and operate with a global perspective from day one","Tell me about a time when you had to adapt your approach to work effectively across different cultures or time zones.","Culture Fit","Medium","We are not building a Chinese company, a US company, or a European company. We are building a global company.","Changpeng Zhao, Former CEO","Forbes Interview","2018"
Binance,Entry Level,Learn and Adapt,"Continuously learn and adapt in the fast-changing blockchain ecosystem","Describe a time when you had to quickly learn a new skill or technology to contribute effectively to your team.","Culture Fit","Easy","The moment you stop learning is the moment you start dying. In this industry, you learn or you become irrelevant.","Binance Academy","Binance Education","2023"
Kraken,Leadership,Proof of Work Mindset,"Results matter more than effort; demonstrate value through tangible outcomes","Tell me about a time when you had to shift from showing effort to showing results. What changed in your approach?","Leadership","Hard","We don't care how hard you work. We care about the impact you create. Proof of work, not proof of effort.","Jesse Powell, CEO","Kraken Company Culture","2023"
Kraken,Senior,Radical Transparency,"Embrace honest, direct communication even when it's uncomfortable","Describe a situation where you had to give difficult feedback to a colleague or superior. How did you ensure your message was both honest and constructive?","Leadership","Medium","We believe in radical transparency. We say what we think, even when it's hard to hear.","Jesse Powell, CEO","Kraken Values","2022"
Kraken,Mid Level,Financial Sovereignty,"Empower individuals to achieve financial independence and control","Tell me about a time when you helped someone gain greater control or understanding of a complex system or process.","Values","Medium","We're not just building a business, we're building financial sovereignty for everyone.","Jesse Powell, CEO","Bitcoin Magazine","2021"
Kraken,Entry Level,Security First,"Security is not a feature, it's a foundation","Describe a time when you had to prioritize security or risk mitigation over convenience or speed. How did you justify this decision?","Problem Solving","Easy","Security isn't a feature that you bolt on. It's a foundation that everything else is built upon.","Kraken Security Team","Kraken Security Blog","2023"
OpenSea,Leadership,Democratize Digital Ownership,"Make digital ownership accessible to everyone, not just technical experts","Tell me about a time when you made a complex system more accessible to non-experts. What was your approach?","Leadership","Hard","We want to democratize access to these new technologies and make sure they're not just the domain of highly technical people.","Devin Finzer, CEO","TechCrunch Interview","2021"
OpenSea,Senior,Community First,"Build for and with the community, not just for profit","Describe a situation where you involved your community or users in important decision-making. What was the outcome?","Culture Fit","Medium","We're building this with the community, not for the community. There's a big difference.","Devin Finzer, CEO","OpenSea Blog","2022"
OpenSea,Mid Level,Embrace the Unknown,"Operate comfortably in uncertainty and emerging technologies","Tell me about a time when you had to make important decisions with limited information about new technology or market conditions.","Problem Solving","Medium","We're navigating uncharted territory. Being comfortable with uncertainty is a prerequisite for building the future.","Alex Atallah, Co-founder","Decrypt Interview","2021"
OpenSea,Entry Level,Creator Empowerment,"Empower creators to monetize their work and build sustainable careers","Describe a time when you helped someone achieve financial or professional independence through their creative work.","Values","Easy","We want to enable creators to make a living from their digital creations and build sustainable businesses.","OpenSea Team","OpenSea Creator Guidelines","2023"
ConsenSys,Leadership,Ethereum Maximalism,"Believe in Ethereum's potential to transform global systems","Tell me about a time when you had strong conviction in a technology or approach that others questioned. How did you maintain your vision?","Leadership","Hard","Ethereum is going to change everything. We're not just building applications, we're building the infrastructure for a decentralized world.","Joseph Lubin, Founder","Ethereum Foundation","2019"
ConsenSys,Senior,Decentralization Philosophy,"Distribute power rather than concentrating it","Describe a situation where you chose to distribute authority or decision-making rather than centralizing control. What was the impact?","Leadership","Medium","The future is decentralized. We're building tools to distribute power rather than concentrate it.","Joseph Lubin, Founder","ConsenSys Blog","2020"
ConsenSys,Mid Level,Developer Empowerment,"Enable developers to build the decentralized future","Tell me about a time when you created tools or resources that empowered others to achieve their goals more effectively.","Problem Solving","Medium","We're not just building for today's developers, we're building for the developers who will create tomorrow's decentralized applications.","ConsenSys Team","ConsenSys Developer Portal","2023"
ConsenSys,Entry Level,Open Source Mindset,"Collaborate openly and share knowledge for collective advancement","Describe a time when you shared knowledge or resources that helped advance a project beyond your immediate team or organization.","Culture Fit","Easy","Open source is not just about code, it's about open collaboration and shared advancement of human knowledge.","ConsenSys Engineering","ConsenSys GitHub","2023"
Chainlink,Leadership,Truth and Transparency,"Provide reliable, tamper-proof data to smart contracts","Tell me about a time when you had to ensure the accuracy and reliability of critical information under pressure.","Leadership","Hard","We're building the infrastructure for truth in a post-truth world. Every piece of data we deliver could impact millions of dollars.","Sergey Nazarov, Co-founder","SmartCon Conference","2022"
Chainlink,Senior,Oracle Problem Solution,"Solve the fundamental challenge of connecting blockchains to real-world data","Describe a situation where you had to bridge two different systems or technologies that weren't naturally compatible.","Problem Solving","Medium","The oracle problem is the most important unsolved problem in the blockchain space. We're not just solving it, we're defining what the solution looks like.","Sergey Nazarov, Co-founder","Chainlink Blog","2021"
Chainlink,Mid Level,Hybrid Smart Contracts,"Combine on-chain and off-chain capabilities for powerful applications","Tell me about a time when you had to integrate different technologies or systems to create a more powerful solution.","Problem Solving","Medium","The future is hybrid smart contracts that combine the best of blockchain and traditional systems.","Chainlink Team","Chainlink Documentation","2023"
Chainlink,Entry Level,Cryptographic Truth,"Use cryptography to create verifiable, trustless systems","Describe a time when you implemented a system or process that reduced the need for trust between parties.","Problem Solving","Easy","We're not asking people to trust us. We're building systems where trust is cryptographically guaranteed.","Chainlink Research","Chainlink Research Papers","2022"
Rivian,Leadership,Electric Adventure,"Make electric adventure vehicles accessible and mainstream","Tell me about a time when you had to convince others to adopt a new approach that would benefit the environment or society.","Leadership","Hard","We're not just making electric vehicles, we're making electric adventure accessible to everyone who wants to explore the world responsibly.","RJ Scaringe, CEO","Rivian IPO Filing","2021"
Rivian,Senior,Keep the World Adventurous,"Preserve natural spaces while enabling exploration","Describe a situation where you had to balance competing priorities between business needs and environmental responsibility.","Values","Medium","We want to keep the world adventurous forever. That means building products that help people explore while protecting the places they love.","RJ Scaringe, CEO","Rivian Blog","2022"
Rivian,Mid Level,Vertical Integration,"Control the entire customer experience through integrated manufacturing","Tell me about a time when you decided to bring a process in-house rather than outsourcing it. What was your reasoning?","Problem Solving","Medium","Vertical integration allows us to control quality, innovation, and the customer experience in ways that wouldn't be possible otherwise.","RJ Scaringe, CEO","The Verge Interview","2021"
Rivian,Entry Level,Purpose-Driven Innovation,"Every innovation should serve the mission of sustainable transportation","Describe a time when you ensured that your work or project aligned with larger organizational values or mission.","Culture Fit","Easy","Every decision we make, every feature we build, every partnership we form should serve our mission of making transportation more sustainable.","Rivian Design Team","Rivian Career Page","2023"
Lucid Motors,Leadership,Dream Ahead,"Push the boundaries of what's possible in electric vehicles","Tell me about a time when you set an ambitious goal that others thought was unrealistic. How did you work toward achieving it?","Leadership","Hard","We don't just want to make another electric car. We want to redefine what an electric car can be.","Peter Rawlinson, CEO","Lucid Motors Blog","2021"
Lucid Motors,Senior,Luxury Sustainability,"Prove that luxury and sustainability can coexist","Describe a situation where you had to demonstrate that quality and environmental responsibility could go hand in hand.","Values","Medium","Luxury and sustainability are not mutually exclusive. We're proving that the most luxurious experience can also be the most responsible.","Peter Rawlinson, CEO","Motor Trend Interview","2022"
Lucid Motors,Mid Level,Engineering Excellence,"Prioritize technical excellence in every component and system","Tell me about a time when you refused to compromise on quality despite pressure to cut corners or reduce costs.","Problem Solving","Medium","Excellence is not negotiable. Every component, every system, every detail must meet our standards for engineering excellence.","Lucid Engineering Team","Lucid Technical Blog","2023"
Lucid Motors,Entry Level,Efficiency Obsession,"Maximize efficiency in everything from design to manufacturing","Describe a time when you found a way to significantly improve the efficiency of a process or system.","Problem Solving","Easy","Efficiency isn't just about the car, it's about everything we do. Every wasted motion, every unnecessary step, every inefficiency is an opportunity for improvement.","Lucid Manufacturing","Lucid Motors Careers","2023"
SpaceX,Leadership,Make Life Multiplanetary,"Enable human life to become multiplanetary as a backup for Earth","Tell me about a time when you worked on something that seemed impossible but was necessary for long-term success or survival.","Leadership","Hard","I think it's important for humanity to become a multiplanetary species. We want to be a spacefaring civilization and a multiplanetary species.","Elon Musk, CEO","SpaceX Mission","2016"
SpaceX,Senior,Rapid Iteration,"Fail fast, learn quickly, and iterate toward perfection","Describe a situation where you used failures as learning opportunities to achieve a breakthrough.","Problem Solving","Medium","The way to make rockets cheaper and more reliable is to build them again and again and again, learning from each failure.","Elon Musk, CEO","SpaceX Blog","2018"
SpaceX,Mid Level,First Principles Thinking,"Question assumptions and build solutions from fundamental truths","Tell me about a time when you challenged conventional wisdom and found a better solution by thinking from first principles.","Problem Solving","Medium","We approach problems from a physics standpoint. We reason from first principles rather than by analogy.","Elon Musk, CEO","TED Talk","2017"
SpaceX,Entry Level,Mars-Shot Mentality,"Think big and aim for revolutionary rather than incremental improvements","Describe a time when you proposed an ambitious solution instead of settling for an incremental improvement.","Culture Fit","Easy","If you're not aiming for Mars, you're not aiming high enough. We don't do incremental improvements, we do revolutionary leaps.","SpaceX Engineering","SpaceX Careers","2023"
Blue Origin,Leadership,Gradatim Ferociter,"Step by step, ferociously - build sustainable space access","Tell me about a time when you had to balance ambitious long-term goals with methodical, step-by-step execution.","Leadership","Hard","We are going to build a road to space so our children can build the future. We do this step by step, ferociously.","Jeff Bezos, Founder","Blue Origin Blog","2019"
Blue Origin,Senior,Safety and Reliability First,"Never compromise safety for speed or cost in space exploration","Describe a situation where you prioritized safety over efficiency or cost savings. How did you justify this decision?","Values","Medium","In space, there are no small mistakes. Safety and reliability must be built into every decision, every component, every process.","Blue Origin Safety Team","Blue Origin Safety Culture","2022"
Blue Origin,Mid Level,Inspire and Enable,"Build technology that inspires the next generation of space explorers","Tell me about a time when your work inspired others to pursue challenging goals or enter a new field.","Culture Fit","Medium","We're not just building rockets, we're building inspiration for the next generation to reach for the stars.","Blue Origin Education","Blue Origin STEM Programs","2023"
Blue Origin,Entry Level,Patient Capital Approach,"Invest in long-term capabilities rather than short-term wins","Describe a time when you chose to invest time or resources in building long-term capabilities rather than achieving quick wins.","Values","Easy","We think in decades, not quarters. We're building the infrastructure for the next century of space exploration.","Jeff Bezos, Founder","Blue Origin Letter to Employees","2020"
OpenAI,Leadership,AGI for All Humanity,"Ensure artificial general intelligence benefits all of humanity","Tell me about a time when you had to consider the broader impact of your work on society and adjust your approach accordingly.","Leadership","Hard","Our mission is to ensure that artificial general intelligence benefits all of humanity, not just a privileged few.","Sam Altman, CEO","OpenAI Charter","2018"
OpenAI,Senior,Safety-First Development,"Prioritize AI safety and alignment over rapid deployment","Describe a situation where you slowed down development to ensure safety or ethical considerations were properly addressed.","Values","Medium","We're committed to doing the research required to make AGI safe, and we're committed to driving the broad adoption of such research across the AI community.","OpenAI Safety Team","OpenAI Safety Blog","2023"
OpenAI,Mid Level,Democratic Access,"Make powerful AI tools accessible to individuals and organizations globally","Tell me about a time when you worked to make complex technology more accessible to a broader audience.","Problem Solving","Medium","We want to democratize access to AI capabilities and make sure the benefits are distributed broadly across society.","OpenAI Team","OpenAI Blog","2022"
OpenAI,Entry Level,Radical Transparency in AI,"Be open about AI capabilities, limitations, and potential risks","Describe a time when you had to communicate complex technical concepts clearly to non-technical stakeholders.","Culture Fit","Easy","We believe in being transparent about our AI systems' capabilities and limitations to build public trust and understanding.","OpenAI Communications","OpenAI Model Cards","2023"
Anthropic,Leadership,AI Safety Research,"Develop AI systems that are safe, beneficial, and understandable","Tell me about a time when you had to balance innovation with risk management in a high-stakes situation.","Leadership","Hard","We're working to build AI systems that are safe, beneficial, and understandable. Safety isn't something we add later - it's built into everything we do.","Dario Amodei, CEO","Anthropic Blog","2022"
Anthropic,Senior,Constitutional AI,"Build AI systems with built-in values and ethical reasoning","Describe a situation where you had to build ethical considerations into a system or process from the ground up.","Values","Medium","We're not just training AI to be capable, we're training it to be helpful, harmless, and honest through constitutional methods.","Anthropic Research Team","Constitutional AI Paper","2022"
Anthropic,Mid Level,Interpretability Focus,"Make AI decision-making transparent and understandable","Tell me about a time when you made a complex system more transparent or explainable to users or stakeholders.","Problem Solving","Medium","If we can't understand how AI systems make decisions, we can't trust them with important tasks. Interpretability is foundational.","Chris Olah, Co-founder","Anthropic Research","2023"
Anthropic,Entry Level,Long-term AI Alignment,"Consider long-term consequences of AI development decisions","Describe a time when you considered the long-term implications of a decision rather than just immediate benefits.","Values","Easy","Every decision we make today about AI development will impact the future of human-AI interaction for generations.","Anthropic Safety Team","Anthropic Safety Research","2023"
DataRobot,Leadership,Democratize Data Science,"Make machine learning accessible to non-experts","Tell me about a time when you took complex technical capabilities and made them accessible to a broader audience.","Leadership","Hard","We believe every organization should be able to harness the power of AI, regardless of their technical sophistication.","Dan Wright, CEO","DataRobot Vision","2022"
DataRobot,Senior,Augment Human Intelligence,"AI should enhance human decision-making, not replace humans","Describe a situation where you designed a solution that enhanced human capabilities rather than replacing human judgment.","Problem Solving","Medium","The future is human plus machine, not human versus machine. We build AI that makes humans more capable.","DataRobot Team","DataRobot Blog","2023"
DataRobot,Mid Level,Responsible AI,"Build AI systems with bias detection and fairness monitoring","Tell me about a time when you identified and addressed bias or unfairness in a system or process.","Values","Medium","Responsible AI isn't optional. We build fairness, transparency, and accountability into every model we create.","DataRobot Ethics Team","Responsible AI Guide","2023"
DataRobot,Entry Level,Business Value Focus,"Ensure every AI implementation delivers measurable business outcomes","Describe a time when you had to demonstrate the concrete value of a technical solution to business stakeholders.","Problem Solving","Easy","Technology for technology's sake isn't enough. Every AI solution must deliver clear, measurable business value.","DataRobot Customer Success","DataRobot Case Studies","2023"
CrowdStrike,Leadership,Stop Breaches,"Prevent cyberattacks before they cause damage","Tell me about a time when you had to prevent a problem before it occurred rather than react to it after the fact.","Leadership","Hard","We stop breaches. That's not just what we do, it's who we are. Prevention is everything in cybersecurity.","George Kurtz, CEO","CrowdStrike Blog","2022"
CrowdStrike,Senior,Adversary-Focused,"Understand and stay ahead of evolving cyber threats","Describe a situation where you had to anticipate and prepare for evolving challenges or competition.","Problem Solving","Medium","We don't just defend against the attacks we know, we hunt for the attacks we don't know are coming.","CrowdStrike Threat Intel","CrowdStrike Intelligence","2023"
CrowdStrike,Mid Level,Cloud-Native Security,"Build security solutions designed for modern cloud environments","Tell me about a time when you designed a solution specifically for a new technology environment rather than adapting old approaches.","Problem Solving","Medium","Legacy security tools were built for a different era. We build cloud-native security for the modern enterprise.","CrowdStrike Engineering","CrowdStrike Technical Blog","2023"
CrowdStrike,Entry Level,Customer Obsession in Security,"Protect customers as if they were family","Describe a time when you went above and beyond to protect someone or something important to you.","Culture Fit","Easy","Every customer attack we stop is someone's livelihood, someone's life's work. We protect them like they're family.","CrowdStrike Customer Success","CrowdStrike Values","2023"
SentinelOne,Leadership,Autonomous Cybersecurity,"Build AI that protects organizations without human intervention","Tell me about a time when you automated a process that previously required constant human oversight.","Leadership","Hard","The future of cybersecurity is autonomous. We're building AI that protects faster and better than any human could.","Tomer Weingarten, CEO","SentinelOne Vision","2021"
SentinelOne,Senior,Real-Time Response,"Detect and respond to threats in real-time, not after damage is done","Describe a situation where you had to respond to a critical issue in real-time under pressure.","Problem Solving","Medium","In cybersecurity, seconds matter. Real-time response isn't a feature, it's a necessity.","SentinelOne Engineering","SentinelOne Technical Documentation","2023"
SentinelOne,Mid Level,Zero Trust Architecture,"Never trust, always verify - even within your own network","Tell me about a time when you implemented strict verification processes even when it seemed unnecessary.","Values","Medium","We operate on zero trust principles. Trust is earned through verification, not assumed through position.","SentinelOne Security Team","Zero Trust Guide","2022"
SentinelOne,Entry Level,Storytelling with Data,"Use data to tell compelling stories about security posture","Describe a time when you used data to tell a story that influenced important decisions.","Culture Fit","Easy","Security is about storytelling with data. We help organizations understand their security story.","SentinelOne Analytics","SentinelOne Product Guide","2023"
