Company,Role Level,Principle Name,Principle Description,Behavioral Question,Question Type,Difficulty,Authentic Quote,Source Attribution,Source Publication,Source Year
Waymo,Leadership,Safe Self-Driving for Everyone,"Make transportation safer through autonomous vehicle technology","Tell me about a time when you worked on a project that prioritized public safety over commercial considerations.","Leadership","Hard","Our mission is to make it safe and easy for people and things to move around. Safety is our top priority, not our marketing message.","John Krafcik, Former CEO","Waymo Blog","2020"
Waymo,Senior,AI Safety in Mobility,"Apply rigorous safety standards to AI systems in transportation","Describe a situation where you implemented multiple layers of safety checks for a critical system.","Values","Medium","We don't just test our AI in simulations, we validate it in the real world with billions of miles of experience.","Waymo Safety Team","Waymo Safety Report","2023"
Waymo,Mid Level,Iterative Testing,"Continuously test and improve through real-world data","Tell me about a time when you used iterative testing to improve a system's performance and reliability.","Problem Solving","Medium","Every mile we drive teaches us something new. We iterate based on real-world experience, not theoretical models.","Waymo Engineering","Waymo Technical Blog","2022"
Waymo,Entry Level,Accessibility Through Automation,"Make transportation accessible to people who cannot drive","Describe a time when you worked on a solution that improved accessibility for people with limitations or challenges.","Culture Fit","Easy","Self-driving technology isn't just convenient, it's life-changing for people who can't drive traditional vehicles.","Waymo Community","Waymo Impact Stories","2023"
Cruise,Leadership,Safer Streets Through Technology,"Use autonomous vehicles to eliminate traffic deaths","Tell me about a time when you worked on a technology solution to address a serious safety problem.","Leadership","Hard","We're not just building self-driving cars, we're building a future where traffic deaths are a thing of the past.","Kyle Vogt, Former CEO","Cruise Blog","2021"
Cruise,Senior,Urban Mobility Focus,"Solve transportation challenges in complex city environments","Describe a situation where you had to solve problems in a complex, dynamic environment with many variables.","Problem Solving","Medium","Cities are the ultimate test for autonomous vehicles. If we can solve urban mobility, we can solve transportation anywhere.","Cruise Engineering","Cruise Technical Papers","2022"
Cruise,Mid Level,Responsible Deployment,"Deploy technology gradually and responsibly","Tell me about a time when you chose a gradual rollout approach over a faster deployment to ensure quality and safety.","Values","Medium","We deploy responsibly, learning at each step. Moving fast and breaking things isn't acceptable when public safety is involved.","Cruise Safety Team","Cruise Safety Framework","2023"
Cruise,Entry Level,Electric and Autonomous,"Combine environmental sustainability with transportation innovation","Describe a time when you found a solution that addressed multiple important problems simultaneously.","Problem Solving","Easy","Electric plus autonomous isn't just better technology, it's better for cities, better for the environment, and better for people.","Cruise Sustainability","Cruise Environmental Impact","2023"
Epic Games,Leadership,Metaverse Pioneer,"Build the foundation for the metaverse and virtual worlds","Tell me about a time when you had to build infrastructure for something that didn't exist yet but you knew would be important.","Leadership","Hard","We're not just making games, we're building the infrastructure for the metaverse. We're creating the foundation for how people will interact in virtual spaces.","Tim Sweeney, CEO","Epic Games Vision","2021"
Epic Games,Senior,Developer Empowerment,"Give creators powerful tools to build amazing experiences","Describe a situation where you created tools or platforms that enabled others to achieve things they couldn't before.","Problem Solving","Medium","We succeed when developers succeed. Our job is to give creators superpowers.","Epic Games Developer Relations","Unreal Engine Philosophy","2022"
Epic Games,Mid Level,Platform Openness,"Build open platforms that benefit all creators","Tell me about a time when you chose openness and interoperability over closed, proprietary approaches.","Values","Medium","Closed platforms benefit platform owners. Open platforms benefit everyone. We choose openness.","Tim Sweeney, CEO","Epic vs Apple Court Filing","2021"
Epic Games,Entry Level,Player-First Philosophy,"Always prioritize player experience over monetization","Describe a time when you advocated for user experience over short-term revenue or convenience.","Culture Fit","Easy","Players first, always. Every decision we make should improve the player experience, not just our bottom line.","Epic Games Design Team","Fortnite Development Blog","2023"
Coursera,Leadership,Universal Access to Learning,"Make high-quality education accessible to anyone, anywhere","Tell me about a time when you worked to remove barriers that prevented people from accessing opportunities.","Leadership","Hard","We believe everyone should have access to the skills and credentials that can improve their lives and careers.","Jeff Maggioncalda, CEO","Coursera Impact Report","2023"
Coursera,Senior,Skills-Based Economy,"Prepare learners for jobs that exist today and will exist tomorrow","Describe a situation where you had to prepare yourself or others for future challenges that weren't clearly defined yet.","Problem Solving","Medium","The economy is shifting from degree-based to skills-based. We're building the bridge to that future.","Coursera Academic Team","Future of Work Report","2022"
Coursera,Mid Level,Learning Effectiveness,"Use data to make learning more effective and engaging","Tell me about a time when you used data and feedback to significantly improve a process or outcome.","Problem Solving","Medium","We don't just deliver content, we optimize learning. Every interaction teaches us how to teach better.","Coursera Learning Science","Learning Effectiveness Research","2023"
Coursera,Entry Level,Credential Recognition,"Help learners get recognition for their skills and achievements","Describe a time when you helped someone get recognition or credit for their work or achievements.","Culture Fit","Easy","Learning without recognition is incomplete. We help learners prove what they know and can do.","Coursera Credentials Team","Coursera Certificates Guide","2023"
Udacity,Leadership,Digital Transformation Enabler,"Help individuals and organizations adapt to the digital economy","Tell me about a time when you helped someone or an organization successfully adapt to major technological change.","Leadership","Hard","We're not just teaching technology, we're enabling human transformation in the digital age.","Gabriel Dalporto, CEO","Udacity Mission","2022"
Udacity,Senior,Industry Partnership,"Bridge the gap between education and industry needs","Describe a situation where you successfully bridged different stakeholder groups with conflicting needs or perspectives.","Problem Solving","Medium","We partner with industry to ensure our graduates are job-ready from day one. Education should prepare people for real careers.","Udacity Partnerships","Industry Partner Program","2023"
Udacity,Mid Level,Project-Based Learning,"Learn by building real-world projects, not just consuming content","Tell me about a time when you learned a new skill by immediately applying it to a practical project.","Culture Fit","Medium","Theory without practice is useless. Practice without theory is dangerous. We combine both through project-based learning.","Udacity Curriculum Team","Nanodegree Philosophy","2022"
Udacity,Entry Level,Mentor-Driven Growth,"Provide personalized guidance to accelerate learning","Describe a time when mentorship or personalized guidance made a significant difference in your development.","Culture Fit","Easy","Everyone needs a guide on their learning journey. We provide mentors who have walked the path before.","Udacity Mentorship","Student Success Stories","2023"
Figma,Leadership,Make Design Accessible,"Democratize design so anyone can participate in the creative process","Tell me about a time when you made a specialized skill or tool accessible to people without traditional training.","Leadership","Hard","Design is too important to be left to designers. We're democratizing design so everyone can participate in creating better user experiences.","Dylan Field, CEO","Figma Philosophy","2021"
Figma,Senior,Collaboration First,"Build tools that enable real-time collaboration and feedback","Describe a situation where you transformed an individual activity into a collaborative process. What was the impact?","Problem Solving","Medium","Design is a team sport. We built Figma to make design collaboration as natural as having a conversation.","Dylan Field, CEO","Config Conference","2022"
Figma,Mid Level,Community-Driven Innovation,"Enable the community to extend and enhance the platform","Tell me about a time when you enabled others to build upon your work or platform to create something unexpected.","Culture Fit","Medium","The best ideas don't come from us, they come from our community. We build platforms that enable innovation we never imagined.","Figma Community Team","Figma Community Blog","2023"
Figma,Entry Level,Design System Thinking,"Think in systems and components, not just individual designs","Describe a time when you approached a problem by creating reusable systems rather than one-off solutions.","Problem Solving","Easy","Great design scales through systems. We help teams build consistent, reusable design systems that grow with their needs.","Figma Design Systems","Design Systems Guide","2023"
Notion,Leadership,Building Blocks Philosophy,"Give people flexible tools to build exactly what they need","Tell me about a time when you provided flexible tools or frameworks that enabled others to create solutions you hadn't anticipated.","Leadership","Hard","We don't build solutions, we build building blocks. Our users create solutions we never could have imagined.","Ivan Zhao, CEO","Notion Blog","2021"
Notion,Senior,Functional Multiplayer,"Enable seamless collaboration in knowledge work","Describe a situation where you designed a system that enabled multiple people to work together more effectively.","Problem Solving","Medium","Knowledge work should be multiplayer by default. We're building the infrastructure for teams to think together.","Notion Team","Notion for Teams","2022"
Notion,Mid Level,No-Code Empowerment,"Enable non-technical users to build powerful workflows and databases","Tell me about a time when you enabled someone without technical skills to accomplish something they thought required programming.","Culture Fit","Medium","Everyone should be able to build the tools they need, regardless of technical background. No-code is about empowerment.","Notion Product Team","No-Code Movement","2023"
Notion,Entry Level,Workspace Personalization,"Let people organize information in ways that match their thinking","Describe a time when you customized a system or process to better match how you naturally work or think.","Culture Fit","Easy","Every person thinks differently. We give people the flexibility to organize their work in ways that make sense to them.","Notion User Experience","Notion Templates","2023"
GitLab,Leadership,Remote-First Culture,"Prove that distributed teams can outperform co-located teams","Tell me about a time when you successfully managed or contributed to a project with team members across different time zones and cultures.","Leadership","Hard","We're not just remote-friendly, we're remote-first. We believe distributed teams are the future of work.","Sid Sijbrandij, CEO","GitLab Remote Work Guide","2020"
GitLab,Senior,Transparency by Default,"Default to transparency in all communications and decision-making","Describe a situation where you chose to share information openly even when it wasn't required or expected.","Values","Medium","We default to transparency because it builds trust and enables better decision-making across the organization.","GitLab Values","GitLab Handbook","2023"
GitLab,Mid Level,Iteration and Efficiency,"Ship small improvements quickly rather than waiting for perfection","Tell me about a time when you chose to ship an imperfect solution quickly and then iterate based on feedback.","Problem Solving","Medium","We ship the minimum viable change and iterate based on feedback. Perfect is the enemy of good and fast.","GitLab Product Team","GitLab Product Principles","2022"
GitLab,Entry Level,Everyone Can Contribute,"Create an environment where anyone can contribute regardless of role or seniority","Describe a time when you contributed valuable ideas or improvements outside your formal job responsibilities.","Culture Fit","Easy","The best ideas can come from anyone, anywhere in the organization. We create environments where everyone can contribute.","GitLab Community","GitLab Contributing Guide","2023"
Teladoc,Leadership,Healthcare Accessibility,"Make quality healthcare accessible regardless of location or mobility","Tell me about a time when you worked to remove barriers that prevented people from accessing essential services.","Leadership","Hard","We're democratizing access to healthcare. Geography, mobility, and time should never be barriers to getting the care you need.","Jason Gorevic, CEO","Teladoc Vision","2022"
Teladoc,Senior,Clinical Excellence via Technology,"Use technology to enhance, not replace, clinical expertise","Describe a situation where you used technology to enhance professional expertise rather than replacing human judgment.","Problem Solving","Medium","Technology should amplify clinical expertise, not replace it. We use innovation to make healthcare professionals more effective.","Teladoc Clinical Team","Clinical Technology Integration","2023"
Teladoc,Mid Level,Patient-Centric Design,"Design all services around patient needs and convenience","Tell me about a time when you redesigned a process or service to be more user-centric.","Culture Fit","Medium","Every feature, every workflow, every decision should make the patient experience better. Technology should serve patients, not the other way around.","Teladoc User Experience","Patient Experience Design","2023"
Teladoc,Entry Level,Care Continuity,"Ensure seamless integration between virtual and in-person care","Describe a time when you helped create seamless handoffs or integration between different systems or processes.","Problem Solving","Easy","Virtual care isn't separate from traditional care, it's part of a integrated healthcare experience.","Teladoc Care Coordination","Integrated Care Model","2023"
23andMe,Leadership,Personal Genetics Revolution,"Empower individuals with access to their genetic information","Tell me about a time when you gave people access to information that fundamentally changed how they understood themselves or their situation.","Leadership","Hard","We believe genetic information belongs to individuals, not just doctors or researchers. We're democratizing access to personal genetics.","Anne Wojcicki, CEO","23andMe Mission","2019"
23andMe,Senior,Research Participation,"Enable individuals to contribute to genetic research for the greater good","Describe a situation where you created a way for individuals to contribute to a larger research effort or social good.","Values","Medium","When individuals share their genetic data for research, they become partners in advancing human health knowledge.","23andMe Research","Genetic Research Platform","2022"
23andMe,Mid Level,Privacy-First Genetics,"Maintain strict privacy controls over sensitive genetic information","Tell me about a time when you implemented strong privacy protections for sensitive personal information.","Values","Medium","Genetic privacy isn't negotiable. We build privacy protection into every system, every process, every decision.","23andMe Privacy Team","Privacy Protection Framework","2023"
23andMe,Entry Level,Health Empowerment,"Help people make informed health decisions based on genetic insights","Describe a time when you helped someone make better decisions by providing them with relevant information and context.","Culture Fit","Easy","Knowledge is power, especially when it comes to health. We help people understand their genetic predispositions so they can take action.","23andMe Health Team","Health Insights Guide","2023"
Compass,Leadership,Real Estate Transformation,"Use technology to transform the real estate experience for everyone","Tell me about a time when you used technology to fundamentally improve an industry process that had remained unchanged for years.","Leadership","Hard","Real estate is the largest asset class in the world, but the experience hasn't changed in decades. We're building the future of real estate.","Robert Reffkin, CEO","Compass Vision","2021"
Compass,Senior,Agent Empowerment,"Give real estate agents better tools and support to serve clients","Describe a situation where you built tools or systems that significantly improved someone else's ability to serve their customers.","Problem Solving","Medium","Great agents need great tools. We build technology that makes agents more effective and their clients more satisfied.","Compass Technology","Agent Platform","2022"
Compass,Mid Level,Data-Driven Insights,"Use data and analytics to improve real estate decisions","Tell me about a time when you used data analysis to provide insights that led to better decision-making.","Problem Solving","Medium","Real estate decisions are often the biggest financial decisions people make. Data and analytics help everyone make better choices.","Compass Analytics","Market Insights Platform","2023"
Compass,Entry Level,Client-First Service,"Always prioritize client needs over commission or convenience","Describe a time when you prioritized a client's best interests even when it wasn't the most profitable or convenient option for you.","Values","Easy","Real estate is about people's lives, not just transactions. We always put client interests first.","Compass Agent Training","Client Service Standards","2023"
WeWork,Leadership,Physical Social Network,"Create spaces that foster community and collaboration","Tell me about a time when you designed or created an environment that brought people together and fostered collaboration.","Leadership","Hard","We're not just renting desks, we're building a physical social network that helps people create meaningful connections.","Adam Neumann, Former CEO","WeWork Philosophy","2018"
WeWork,Senior,Flexible Workspace Solutions,"Adapt workspace solutions to meet diverse and changing needs","Describe a situation where you created flexible solutions that could adapt to different user needs and preferences.","Problem Solving","Medium","Work is changing, and workspace needs to change with it. We create flexible solutions for the future of work.","WeWork Operations","Flexible Workspace Design","2022"
WeWork,Mid Level,Community Building,"Foster genuine connections and collaboration among members","Tell me about a time when you successfully built community among a diverse group of people.","Culture Fit","Medium","Space is just the beginning. Real value comes from the community and connections we help people create.","WeWork Community Team","Community Building Guide","2023"
WeWork,Entry Level,Entrepreneurship Support,"Create environments where entrepreneurs and small businesses can thrive","Describe a time when you helped support someone's entrepreneurial goals or small business growth.","Culture Fit","Easy","Every entrepreneur deserves a professional space and community to help them succeed. We provide both.","WeWork Member Services","Entrepreneur Support Programs","2023"
Roblox,Leadership,Powering Imagination,"Enable people to imagine, create, and play in infinite ways","Tell me about a time when you built tools or platforms that enabled others to express their creativity in ways you hadn't anticipated.","Leadership","Hard","We don't create content, we create the tools for others to create. We power imagination.","David Baszucki, CEO","Roblox Vision","2021"
Roblox,Senior,User-Generated Everything,"Enable users to create, publish, and monetize their own content","Describe a situation where you created systems that enabled others to build and profit from their own creations.","Problem Solving","Medium","The best content comes from our community, not from us. We build platforms where creators can build businesses.","Roblox Creator Team","Creator Economy","2022"
Roblox,Mid Level,Safe Social Interaction,"Create safe spaces for people of all ages to interact and play","Tell me about a time when you designed safety measures for a system that needed to balance openness with protection.","Values","Medium","Safety and creativity aren't opposites, they're partners. We create safe spaces where imagination can flourish.","Roblox Safety Team","Safety and Civility","2023"
Roblox,Entry Level,Learning Through Play,"Make learning engaging through interactive, playful experiences","Describe a time when you made a serious or complex topic more engaging and accessible through interactive approaches.","Culture Fit","Easy","Play is one of the most powerful ways to learn. We create experiences where learning and fun happen together.","Roblox Education","Learning Through Play","2023"
Unity Technologies,Leadership,Democratize Creation,"Make game development and interactive content creation accessible to everyone","Tell me about a time when you took a specialized professional skill and made it accessible to amateurs or beginners.","Leadership","Hard","Game development used to require years of specialized knowledge. We're democratizing creation so anyone can build interactive experiences.","John Riccitiello, Former CEO","Unity Vision","2020"
Unity Technologies,Senior,Cross-Platform Solutions,"Enable creators to build once and deploy everywhere","Describe a situation where you created a solution that worked across multiple different platforms or environments.","Problem Solving","Medium","Creators shouldn't have to choose between platforms. Build once, deploy everywhere - that's the Unity way.","Unity Engineering","Cross-Platform Development","2022"
Unity Technologies,Mid Level,Real-Time 3D,"Push the boundaries of what's possible with real-time 3D graphics","Tell me about a time when you pushed technical boundaries to achieve something that others thought wasn't possible.","Problem Solving","Medium","Real-time 3D is transforming how we interact with digital content. We're pushing the boundaries of what's possible.","Unity Graphics Team","Real-Time Rendering","2023"
Unity Technologies,Entry Level,Creator Success,"Measure success by the success of creators using our platform","Describe a time when you measured your success by how well you enabled others to achieve their goals.","Culture Fit","Easy","We succeed when creators succeed. Every tool we build, every feature we add should help creators achieve their vision.","Unity Creator Success","Creator Support","2023"
Riot Games,Leadership,Player-Focused Innovation,"Every decision should improve the player experience","Tell me about a time when you prioritized end-user experience over internal convenience or short-term profits.","Leadership","Hard","Players are the reason we exist. Every decision, every feature, every change should make the player experience better.","Marc Merrill, Co-founder","Riot Games Philosophy","2020"
Riot Games,Senior,Global Gaming Culture,"Build games that connect players across cultures and continents","Describe a situation where you designed something that successfully appealed to diverse global audiences.","Problem Solving","Medium","Games are a universal language. We build experiences that bring people together regardless of where they come from.","Riot Games International","Global Gaming Report","2023"
Riot Games,Mid Level,Competitive Integrity,"Maintain fairness and integrity in competitive gaming environments","Tell me about a time when you had to enforce fairness in a competitive situation, even when it was difficult.","Values","Medium","Competitive integrity is non-negotiable. Fair play isn't just a feature, it's the foundation of competitive gaming.","Riot Games Esports","Competitive Integrity Guidelines","2023"
Riot Games,Entry Level,Champion Innovation,"Continuously innovate while respecting game balance and player investment","Describe a time when you had to balance innovation with maintaining stability in an existing system.","Problem Solving","Easy","Innovation keeps games fresh, but stability keeps players invested. We balance both to create lasting experiences.","Riot Games Design","Champion Design Philosophy","2023"
Palantir,Leadership,Engineer for Impact,"Build technology that solves real-world problems for institutions and organizations","Tell me about a time when you built or contributed to technology that had measurable real-world impact.","Leadership","Hard","We build software that helps institutions use their data to solve problems. Engineering for engineering's sake isn't enough.","Alex Karp, CEO","Palantir Mission","2021"
Palantir,Senior,Customer Problem First,"Start with understanding the customer's actual problem, not our solution","Describe a situation where you had to deeply understand a problem before proposing any solution.","Problem Solving","Medium","We don't sell technology, we solve problems. Understanding the problem is always the first step.","Palantir Forward Deployed Engineers","Customer Engagement","2022"
